,tweetID,tweetText,tweetRetweetCt,tweetFavoriteCt,tweetSource,tweetCreated,userID,userScreen,userName,userCreateDt,userDesc,userFollowerCt,userFriendsCt,userLocation,userTimezone,tweetHashtagCt,Weight,positiveness,negativeness,sentiment_label,pos_adj,neg_adj
902,717068890338172929,RT @Libertea2012: Sanders and Clinton Are Campaigning Hard in Wisconsin… Against Scott Walker https://t.co/u3feyjy7mJ #NotMeUs https://t.co…,3,0,Twitter for iPhone,2016-04-04 19:18:40,306775013,heinze_jenny,Jenny Heinze,2011-05-28 12:33:49,Progressive Democrat,651,2016,Wisconsin ,,1,0.265,0.0,0.0,positive,0.0,0.0
903,717068635789926400,"Checking out ""The Awful Transformation of Bernie Sanders"" on The Hutchinson Report News: https://t.co/H1tEGLWctZ",0,0,Twitter Web Client,2016-04-04 19:17:39,259381299,LloydDClark,Lloyd Clark,2011-03-01 20:12:43,"Super Proud Husband and Father; Writer; Training and Technical Assistance - Tobacco Control, Wisconsin; Track Coach - Former Jousting World Champ",417,1689,Wisconsin,Central Time (US & Canada),0,1.0,0.014,0.012,negative,0.0,0.2375
904,717068039288520705,RT @saragoldrickrab: My latest op-ed in @journalsentinel : @BernieSanders is right: Make public colleges tuition-free https://t.co/dZPdrVkX…,65,0,Twitter for iPhone,2016-04-04 19:15:17,36101852,lgoldrick25,Liam Goldrick,2009-04-28 15:59:14,"Public education, quality teaching, economic inequality, progressive politics. @NewTeacherCtr policy director. Native New Englander. Opinions are my own.",3139,1197,"Madison, Wisconsin",Central Time (US & Canada),0,1.0,0.421703296703,0.0625,negative,0.0625,0.0625
905,717067953401823232,RT @mcbyrne: UW professor @saragoldrickrab makes the case for @BernieSanders free college plan. https://t.co/1or4poTh3s #WIPrimary,694,0,Twitter for iPhone,2016-04-04 19:14:57,36101852,lgoldrick25,Liam Goldrick,2009-04-28 15:59:14,"Public education, quality teaching, economic inequality, progressive politics. @NewTeacherCtr policy director. Native New Englander. Opinions are my own.",3139,1197,"Madison, Wisconsin",Central Time (US & Canada),1,0.265,0.0598072562358,0.334426627794,positive,0.0138888888889,0.333333333333
906,717067896841588736,"RT @janeosanders: Clear reasoning why Bernie's college plan is better. 
https://t.co/07maRGpBSd",641,0,Twitter for iPhone,2016-04-04 19:14:43,36101852,lgoldrick25,Liam Goldrick,2009-04-28 15:59:14,"Public education, quality teaching, economic inequality, progressive politics. @NewTeacherCtr policy director. Native New Englander. Opinions are my own.",3139,1197,"Madison, Wisconsin",Central Time (US & Canada),0,1.0,0.449648849925,0.00367647058824,negative,0.25,0.0
907,717067583262949376,RT @srjones66: Bernie Sanders Is The Only Presidential Candidate Who Supports $15/Hour Minimum Wage via @politicususa https://t.co/reziahD8…,5,0,Twitter for Android,2016-04-04 19:13:28,1349829794,SableViews,A Personal Opinion,2013-04-13 17:45:27,"kind of an Elly May Clampett that grew up to be a microbiologist. I love animals, nature, science, reason, ideas, books, creativity and art.",3179,2947,"rural Wisconsin, USA",Central Time (US & Canada),0,1.0,0.110664335664,0.0113636363636,positive,0.0,0.0
908,717067291263967232,Feel the empty seats: Bernie Sanders sees “disappointing” turnout for Wisconsin rally https://t.co/g1Aih85bRD via @dailynewsbin,0,0,Linkis.com,2016-04-04 19:12:19,277845186,jacqui4peace,☮JacquiUpNorth☮,2011-04-06 04:29:52,"Progressive Dem,Wife,Mom,USAF Mom, I LOVE #OBAMA won't tolerate people who bash him. #Springsteen #Maddow #Packers #Peace #ImWithHer #NeverBernie",1768,1486,Way up north Wisconsin ,Central Time (US & Canada),0,1.0,0.394871794872,0.0170673076923,negative,0.3125,0.0
909,717066808763801601,"RT @NateSilver538: Wisconsin Democratic polling average:
Sanders 47.7
Clinton 45.0
https://t.co/BpMqQ7tgr9",109,0,Twitter for iPhone,2016-04-04 19:10:24,163540129,slmiller222,Steven Miller,2010-07-06 17:39:42,"Verified account, I checked and it's me. Thank God for Scott Walker. If I haven't pissed you off yet be patient, I'll get to you. #TCOT",9607,9491,Wisconsin,Central Time (US & Canada),0,1.0,0.0,0.0,negative,0.0,0.0
910,717066757400203264,RT @Token12ga: Chaos in Nevada: The Sanders Campaign Just Made the Most Effective Case for Superdelegates to Back Clinton https://t.co/5qll…,2,0,Twitter for iPad,2016-04-04 19:10:12,254340945,cranevl,cranehaven,2011-02-19 03:07:32,"Retired sociologist, love travel and books, six adult children, eleven grandchildren. Over three decades of humanitarian and educational work in Latin America.",339,153,Wisconsin,,0,1.0,0.31675170068,0.00109329446064,positive,0.0,0.0
911,717066647668977664,RT @RLamalWGBA: Several black SUV's and police cars spotted outside #HagemeisterPark one hour b4 #Sanders supposed to speak at KI https://t…,4,0,Twitter Web Client,2016-04-04 19:09:45,32256522,NBC26,NBC26 News,2009-04-17 02:12:22,"NBC26 News, Green Bay, Wisconsin, providing news for Northeast Wisconsin. Retweets and follows are not endorsements",9364,377,"Green Bay, Wisconsin",Central Time (US & Canada),2,0.127,0.284027777778,0.542956349206,negative,0.262723214286,0.526116071429
912,717066513384079360,Sanders makes appeal for Tribal support at Wausau rally https://t.co/pvysJh1Rm2 https://t.co/wcPmgco6TJ,1,0,Buffer,2016-04-04 19:09:13,33637700,wprnews,WPR News,2009-04-20 19:50:47,Wisconsin Public Radio's award winning news team,2517,256,Wisconsin,Central Time (US & Canada),0,1.0,0.0459183673469,0.00109329446064,negative,0.0,0.0
913,717065861299847169,"Trump, Cruz, Sanders, Clinton, sounds like a great dinner party, frankly.",0,0,Twitter Web Client,2016-04-04 19:06:38,1641264698,Nice_Bice,Nice Bice,2013-08-02 20:29:07,"A man who needs no introduction, though you probably didn't know he makes a great lasagna. PM for recipes.",186,983,"Milwaukee, Wisconsin",,0,1.0,0.3125,0.0,positive,0.5,0.015625
914,717065405269995520,peep the summer set on the Bernie sanders snap story talking about Wisconsin 👀,0,6,Twitter for iPhone,2016-04-04 19:04:49,616574740,zeppeliniall,liv,2012-06-23 23:30:06,i could do this forever,2158,249,wisconsin,Central Time (US & Canada),0,1.0,0.0992307692308,0.00333333333333,negative,0.0133928571429,0.0669642857143
915,717064078959648769,RT @millerlynn7772: Bernie Sanders Fracking Connection Discovered After Attacking Clinton He's making money off them!  https://t.co/uwiorS3…,11,0,Twitter for iPad,2016-04-04 18:59:33,254340945,cranevl,cranehaven,2011-02-19 03:07:32,"Retired sociologist, love travel and books, six adult children, eleven grandchildren. Over three decades of humanitarian and educational work in Latin America.",339,153,Wisconsin,,0,1.0,0.0459183673469,0.146926627794,positive,0.02,0.34
916,717063892837408768,RT @smoothkobra: . @almyrOH @TheBpDShow he kinda did https://t.co/nDw0onyG9l https://t.co/yyfAvUg2t8,2,0,Twitter for iPad,2016-04-04 18:58:49,254340945,cranevl,cranehaven,2011-02-19 03:07:32,"Retired sociologist, love travel and books, six adult children, eleven grandchildren. Over three decades of humanitarian and educational work in Latin America.",339,153,Wisconsin,,0,1.0,0.00480769230769,0.0192307692308,positive,0.0,0.0
917,717063116442308608,side note i get to see bernie sanders speak for the first time!! and 3OH!3 is gonna be there too which i havent seen them since 2010 omg,0,3,Twitter Web Client,2016-04-04 18:55:44,16587794,evy_shmurda,evan d,2008-10-04 03:18:55,the real Evy Shmurda | Evan - Milwaukee ✌✌,512,199,Wisconsin,Eastern Time (US & Canada),0,1.0,0.25422008547,0.0142361111111,negative,0.104166666667,0.5
918,717063010456637440,"RT @KimDSummons: . Big day for minimum-wage laws @HillaryClinton not Bernie Sanders, grabs the spotlight. I am forever #NeverHillary https:…",29,0,Twitter for Android,2016-04-04 18:55:18,1349829794,SableViews,A Personal Opinion,2013-04-13 17:45:27,"kind of an Elly May Clampett that grew up to be a microbiologist. I love animals, nature, science, reason, ideas, books, creativity and art.",3180,2947,"rural Wisconsin, USA",Central Time (US & Canada),1,0.265,0.185897435897,0.0443376068376,negative,0.0,0.0
919,717062250784227328,"RT @KevinDarryl: Why Hasn’t Bernie Sanders Released His Tax Returns? (Or Cruz Or Kasich, Either…)  https://t.co/TLCieEe6RG",5,0,Twitter Web Client,2016-04-04 18:52:17,333673940,CarrieS1217,Carrie Scholzen,2011-07-11 22:18:32,"WI sports lover, Packers owner, Animal Lover. I ID as a Lib. Love the West Wing and Buffy the Vampire Slayer.  Home bound w/ Advanced MS.",429,835,Wisconsin,Central Time (US & Canada),0,1.0,0.0375,0.0,positive,0.0,0.0
920,717061297565736962,Sanders vague on free college tuition plan. #WIprimary https://t.co/SriZ2GdZaZ https://t.co/yfBsKPqMJE,0,0,Hootsuite,2016-04-04 18:48:30,14525878,wrtribune,Daily Tribune Media,2008-04-25 12:52:23,News posted by Wisconsin Rapids Daily Tribune staff covering central Wisconsin. Find us on Facebook: /wisconsinrapidstribune Follows aren't endorsements.,2542,240,"Wisconsin Rapids, Wisconsin",Central Time (US & Canada),1,0.265,0.0138888888889,0.333333333333,negative,0.111111111111,0.555555555556
921,717061297565732868,Sanders vague on free college tuition plan. #WIprimary https://t.co/fiFVLJjcKK https://t.co/DZHLh1HKSX,0,0,Hootsuite,2016-04-04 18:48:30,15385717,onwnews,Oshkosh Northwestern,2008-07-11 01:22:56,The Oshkosh Northwestern: Oshkosh's daily source of news information,6686,765,"Oshkosh, Wisconsin",Central Time (US & Canada),1,0.265,0.0138888888889,0.333333333333,negative,0.111111111111,0.555555555556
922,717061297410543617,Sanders vague on free college tuition plan. #WIprimary https://t.co/OszWgOw5jj https://t.co/lLKwZdgoLm,0,0,Hootsuite,2016-04-04 18:48:30,76453806,fdlreporter,Fond du Lac Reporter,2009-09-22 21:20:39,The Fond du Lac area's leading news and information source,4836,393,"Fond du Lac, Wisconsin",Central Time (US & Canada),1,0.265,0.0138888888889,0.333333333333,negative,0.111111111111,0.555555555556
923,717061297406394372,Sanders vague on free college tuition plan. #WIprimary https://t.co/pEtuiTw4Ev https://t.co/ZWqC625ZrX,0,0,Hootsuite,2016-04-04 18:48:30,16796483,PostCrescent,Post-Crescent Media,2008-10-15 23:10:54,"Ultimate news source for Wisconsin's Fox Valley, covering Appleton, Neenah, Menasha & surrounding communities. We want to hear from you! http://t.co/ivxgZb0rKT",14261,2000,"Appleton-Fox Cities, Wisconsin",Central Time (US & Canada),1,0.265,0.0138888888889,0.333333333333,negative,0.111111111111,0.555555555556
924,717061297347682305,Sanders vague on free college tuition plan. #WIprimary https://t.co/s4bzE8ny6U https://t.co/QN0S4d4QVM,0,0,Hootsuite,2016-04-04 18:48:30,17443274,wausauherald,Daily Herald Media,2008-11-17 15:32:43,"What you need to know in Wausau, north central Wisconsin and beyond: now. Real people in our newsroom and the field tweeting news, features, sports & more.",5529,721,"Wausau, Wisconsin",Central Time (US & Canada),1,0.265,0.0138888888889,0.333333333333,negative,0.111111111111,0.555555555556
925,717061164421623808,"RT @Smartypants60: ""progressives across this country, in supporting the candidacy of Sanders, are completely rejecting the Dem Party” https…",2,0,Twitter for iPad,2016-04-04 18:47:58,254340945,cranevl,cranehaven,2011-02-19 03:07:32,"Retired sociologist, love travel and books, six adult children, eleven grandchildren. Over three decades of humanitarian and educational work in Latin America.",339,153,Wisconsin,,0,1.0,0.116616716617,0.118506493506,positive,0.3125,0.0
926,717060650506149888,"RT @JesseLehrich: Bernie Sanders says Wall Street tax would pay for his free tuition plan | Mostly False.
https://t.co/q2okiX3b0G https://t…",89,0,Twitter for iPad,2016-04-04 18:45:56,254340945,cranevl,cranehaven,2011-02-19 03:07:32,"Retired sociologist, love travel and books, six adult children, eleven grandchildren. Over three decades of humanitarian and educational work in Latin America.",339,153,Wisconsin,,0,1.0,0.0934343434343,0.333333333333,negative,0.0138888888889,0.333333333333
927,717060319114166272,RT @JSavoly: Bernie Sanders a regular at high-dollar donor retreats #ImWithHer #HillaryClinton #Hillary2016 #HillYes https://t.co/X8MiGtb7Jn,14,0,Twitter for iPad,2016-04-04 18:44:37,254340945,cranevl,cranehaven,2011-02-19 03:07:32,"Retired sociologist, love travel and books, six adult children, eleven grandchildren. Over three decades of humanitarian and educational work in Latin America.",339,153,Wisconsin,,4,0.033,0.0247252747253,0.0659340659341,positive,0.0247252747253,0.0659340659341
928,717060231331753985,"RT @smoothkobra: Last night I did some more looking at Bernie's assets, via Open Secrets. I wrote an article about what I found: https://t.…",476,0,Twitter Web Client,2016-04-04 18:44:16,333673940,CarrieS1217,Carrie Scholzen,2011-07-11 22:18:32,"WI sports lover, Packers owner, Animal Lover. I ID as a Lib. Love the West Wing and Buffy the Vampire Slayer.  Home bound w/ Advanced MS.",429,835,Wisconsin,Central Time (US & Canada),0,1.0,0.0791132478632,0.196834935897,positive,0.0625,0.15625
929,717059937436901376,The crowd is now moving inside for a rally held by Sen. Bernie Sanders in GB at the KI Convention Center. . https://t.co/TLojydJhCa,9,3,Twitter for iPhone,2016-04-04 18:43:06,991747339,ZimmermanWBAY,Jason Zimmerman,2012-12-05 20:45:09,Fox Valley News Reporter- WBAY-TV 2.,929,124,"Appleton, Wisconsin",,0,1.0,0.121631647673,0.00231481481481,negative,0.208333333333,0.0
930,717059522972372993,"RT @FactCheckBernie: ""She has the right to make money"" -Bernie Sanders on HRC and Goldman Sachs #NYPrimary #WIPrimary https://t.co/cAvAs6CQ…",23,0,Twitter for iPad,2016-04-04 18:41:27,254340945,cranevl,cranehaven,2011-02-19 03:07:32,"Retired sociologist, love travel and books, six adult children, eleven grandchildren. Over three decades of humanitarian and educational work in Latin America.",339,153,Wisconsin,,2,0.127,0.0557867883996,0.0274090839343,negative,0.330357142857,0.0
931,717059497961893888,RT @andrewlacombe: A look at the early crowd to see Bernie #Sanders in #GreenBay this afternoon @fox11news https://t.co/RAbvl9tbTX,2,0,TweetDeck,2016-04-04 18:41:21,24490706,fox11news,WLUK-TV FOX 11,2009-03-15 05:13:12,"The OFFICIAL account of WLUK-TV, Your Source for Balanced News and Severe Weather Coverage",27265,559,"Green Bay, Wisconsin",Central Time (US & Canada),2,0.127,0.0375,0.0427083333333,positive,0.0,0.0416666666667
932,717058829532340225,"RT @FiveThirtyEight: Are Sanders and Cruz really less ""electable""? https://t.co/nYmy0tl6eK https://t.co/3ARqAEgS1T",16,0,Twitter for iPhone,2016-04-04 18:38:41,2975154217,djgrolyo,DJL,2015-01-11 17:00:49,"Future Vet-Loves animals, L.A., Music, , True Crime shows! Support LGBT Rights, HIV activism, Animal Rights, Democrats. Live for my family-rely on my faith.",314,498,"Wisconsin, USA (For Now)",Pacific Time (US & Canada),0,1.0,0.0288461538462,0.291666666667,positive,0.0,0.291666666667
933,717057694692024320,RT @cmpnwtr: Bernie Sanders’s fiction-filled campaign https://t.co/tqeozUoFxs,1,0,Twitter for iPad,2016-04-04 18:34:11,254340945,cranevl,cranehaven,2011-02-19 03:07:32,"Retired sociologist, love travel and books, six adult children, eleven grandchildren. Over three decades of humanitarian and educational work in Latin America.",339,153,Wisconsin,,0,1.0,0.0,0.0,positive,0.0,0.0
934,717057257448407041,Retweet if you believe Bernie Sanders will come out on top in Wisconsin. Like if you believe Hillary will come out on top in Wisconsin.,0,0,Twitter for iPhone,2016-04-04 18:32:27,710094363800576004,myvote206,myvote2016,2016-03-16 13:24:24,2016 Presidential Cartoon Shirt Design Mock Up,58,365,"Wisconsin, USA",,0,1.0,0.297619047619,0.00396825396825,positive,0.0,0.475
935,717057220526129153,"nbc15_madison: #Sanders on eve of WI primary champions labor
https://t.co/6WgbFO9Mu8 #NBC15 https://t.co/bbukmjToyA",0,0,IFTTT,2016-04-04 18:32:18,2969784653,Tec_entComunity,Katelyn Blare,2015-01-09 14:35:30,Technology entrepreneurship community of a techreview.,54,63,"Wisconsin, Madison",Kyiv,2,0.127,0.28,0.035,positive,0.28,0.035
936,717057197021077504,"RT @dnahealthnut: During his 10 yrs in the Senate, Bernie Sanders has been a regular presence at luxurious Dem fundraising retreats. https:…",6,0,Twitter for iPad,2016-04-04 18:32:12,254340945,cranevl,cranehaven,2011-02-19 03:07:32,"Retired sociologist, love travel and books, six adult children, eleven grandchildren. Over three decades of humanitarian and educational work in Latin America.",339,153,Wisconsin,,0,1.0,0.750939849624,0.0922498554078,positive,0.712225274725,0.0659340659341
937,717057122064662528,RT @stylistkavin: #FeelTheReturns MUST READ. Why Is Bernie Sanders Invested On Wall Street? https://t.co/qnyB5Fulgf via @garnetnewsroom,61,0,Twitter for iPad,2016-04-04 18:31:54,254340945,cranevl,cranehaven,2011-02-19 03:07:32,"Retired sociologist, love travel and books, six adult children, eleven grandchildren. Over three decades of humanitarian and educational work in Latin America.",339,153,Wisconsin,,1,0.265,0.0288461538462,0.0,positive,0.0,0.0
938,717057023255248896,Sanders on eve of WI primary champions labor https://t.co/eGGoCS1p6C,0,0,WordPress.com,2016-04-04 18:31:31,3362946074,yskMadison,Madison,2015-08-27 20:10:47,"Follow YSK Madison for the latest news in the #Madison, #Wisconsin area.
http://t.co/dOIXKN43Pf",104,70,"Wisconsin, USA",,0,1.0,0.28,0.035,positive,0.28,0.035
939,717056729972875270,"WISCTV_News3: Trump, Sanders lead social discussion in Wisconsin #news3 https://t.co/pjWp9VkVyg https://t.co/V4OS6dIiqX",0,0,IFTTT,2016-04-04 18:30:21,2969757611,Merch_Intepr,Sean Taft,2015-01-09 14:19:26,"World is the destination of choice for technology decision makers and business leaders who seek expert, in-depth analysis of enterprise technology.",58,64,"Wisconsin, Madison",Kyiv,1,0.265,0.0803571428571,0.0416666666667,positive,0.0,0.0416666666667
940,717056691381080065,"RT @nbc15_madison: #Sanders on eve of WI primary champions labor
https://t.co/9ASMzhSfhy #NBC15 https://t.co/7JFXqS05PB",1,0,(WI) I-39 Updates,2016-04-04 18:30:12,164376088,WII39thm,The Highway Monitor,2010-07-08 18:38:47,This feed provides timely #interstate #traffic info & RT's for I-39 in #WI. Pre-plan your trip or use a text reader on the go. Stop Distracted Driving!,298,99,"Wisconsin, USA",Eastern Time (US & Canada),2,0.127,0.28,0.035,positive,0.28,0.035
941,717056385775755266,RT @Colleges4Bernie: Bernie Sanders Wins Nevada After All #FeelTheBern  https://t.co/fJSkeiwrwC,22,0,Twitter Web Client,2016-04-04 18:28:59,4828171334,VesperHarris,Vesper Harris,2016-01-29 01:29:25,Trump is a PIG.  ENUF DISGRACE-VOTE SANDERS-HE TRULY CARES FOR US. SANDERS 100% #BlackLivesMatter in case you didn't hear it the first time #BlackLivesMatter,370,398,Wisconsin ,,1,0.265,0.0,0.0,negative,0.0,0.0
942,717056338317041664,RT @politico: .@HillaryClinton camp: Wisconsin win won't help @BernieSanders much https://t.co/yrJhdLgMFL https://t.co/Bra4ApLHPF,32,0,Twitter for iPad,2016-04-04 18:28:47,254340945,cranevl,cranehaven,2011-02-19 03:07:32,"Retired sociologist, love travel and books, six adult children, eleven grandchildren. Over three decades of humanitarian and educational work in Latin America.",339,153,Wisconsin,,0,1.0,0.03125,0.00520833333333,negative,0.0,0.0
943,717056004874244096,RT @KevinDarryl: SANDERS OWNS A PART OF WALL STREET! Why Is Bernie Sanders Invested On Wall Street? https://t.co/xdYgubkQkP via  #FeelTheRe…,3,0,Twitter Web Client,2016-04-04 18:27:28,333673940,CarrieS1217,Carrie Scholzen,2011-07-11 22:18:32,"WI sports lover, Packers owner, Animal Lover. I ID as a Lib. Love the West Wing and Buffy the Vampire Slayer.  Home bound w/ Advanced MS.",429,835,Wisconsin,Central Time (US & Canada),1,0.265,0.0288461538462,0.0,positive,0.0,0.0
944,717054996152385536,RT @VFW_Vet: I’m done with Bernie Sanders: Why this democratic socialist is voting for Hillary Clinton - https://t.co/glKFBwnrXT https://t.…,6,0,Twitter for iPad,2016-04-04 18:23:27,254340945,cranevl,cranehaven,2011-02-19 03:07:32,"Retired sociologist, love travel and books, six adult children, eleven grandchildren. Over three decades of humanitarian and educational work in Latin America.",339,153,Wisconsin,,0,1.0,0.308653846154,0.0192307692308,negative,0.25,0.0
945,717053868769677313,And being belligerent. It's not ok to interrupt a Trump/Clinton/Cruz/Sanders rally with your rhetoric. Do you want that happening to you?,0,2,Twitter for iPhone,2016-04-04 18:18:59,50943308,KickingGuy,Caige 2Bic(Kid Cat),2009-06-26 05:58:44,Large Angular Clasts,167,340,"Milwaukee, Wisconsin",Mountain Time (US & Canada),0,1.0,0.466987179487,0.319230769231,positive,0.375,0.0
946,717053799987175425,RT @steakhousegirl: @keethers I don't understand this view when PBO is the leader of the party. Seems like King is more about self-promotio…,6,0,Twitter for iPad,2016-04-04 18:18:42,254340945,cranevl,cranehaven,2011-02-19 03:07:32,"Retired sociologist, love travel and books, six adult children, eleven grandchildren. Over three decades of humanitarian and educational work in Latin America.",339,153,Wisconsin,,0,1.0,0.31875,0.0192307692308,positive,0.1875,0.015625
947,717053206384156672,"RT @Kat4Obama: ""Sanders &amp; Weaver stand in contrast to Pres Obama, who has shut down booing at rallies by saying “Don’t boo, vote!” https://…",5,0,Twitter for iPad,2016-04-04 18:16:21,254340945,cranevl,cranehaven,2011-02-19 03:07:32,"Retired sociologist, love travel and books, six adult children, eleven grandchildren. Over three decades of humanitarian and educational work in Latin America.",339,153,Wisconsin,,0,1.0,0.0212320574163,0.0992324561404,negative,0.0111111111111,0.3875
948,717053042777071616,RT @mcbyrne: UW professor @saragoldrickrab makes the case for @BernieSanders free college plan. https://t.co/1or4poTh3s #WIPrimary,694,0,Twitter Web Client,2016-04-04 18:15:42,4874524375,SJ_1691,Sophia Jacobson,2016-02-07 16:30:59,,54,13,"Wisconsin, USA",Central Time (US & Canada),1,0.265,0.0598072562358,0.334426627794,positive,0.0138888888889,0.333333333333
949,717053027635568645,Got to see Bernie Sanders today #BernieSanders #Janesville https://t.co/mG4S9lqHqo,0,1,Twitter for iPhone,2016-04-04 18:15:38,334817521,derek94gt,Derek Hauger,2011-07-13 18:26:25,"Help Desk, Mustang Enthusiast, Veteran....haeyyyyyyyy",72,74,Wisconsin,,2,0.127,0.0375,0.00104166666667,negative,0.0,0.0
950,717052958274412545,"RT @jaycamikenGL: #Bernie leads #Hillary by 8 points in Wisconsin

Emerson College Poll:
Sanders 51%
Clinton   43%
2 Wks Ago 50 to 44

http…",9,0,Twitter for Android,2016-04-04 18:15:22,1349829794,SableViews,A Personal Opinion,2013-04-13 17:45:27,"kind of an Elly May Clampett that grew up to be a microbiologist. I love animals, nature, science, reason, ideas, books, creativity and art.",3180,2947,"rural Wisconsin, USA",Central Time (US & Canada),2,0.127,0.0803571428571,0.0,positive,0.0,0.0
951,717052709778628609,RT @MSNBC: .@BernieSanders calls for shutting down New York nuclear power plant: https://t.co/wkwl8GVv5q https://t.co/XoHispt3bY,572,0,Twitter Web Client,2016-04-04 18:14:22,4874524375,SJ_1691,Sophia Jacobson,2016-02-07 16:30:59,,54,13,"Wisconsin, USA",Central Time (US & Canada),0,1.0,0.0695153061224,0.0102040816327,negative,0.0423611111111,0.2
952,717052551670153216,"RT @WISCTV_News3: Trump, Sanders lead social discussion in Wisconsin #news3 https://t.co/ljEBJLshz9 https://t.co/EGd3evoiux",3,0,(WI) I-39 Updates,2016-04-04 18:13:45,164376088,WII39thm,The Highway Monitor,2010-07-08 18:38:47,This feed provides timely #interstate #traffic info & RT's for I-39 in #WI. Pre-plan your trip or use a text reader on the go. Stop Distracted Driving!,298,99,"Wisconsin, USA",Eastern Time (US & Canada),1,0.265,0.0803571428571,0.0416666666667,positive,0.0,0.0416666666667
953,717052427963392000,"RT @FrankLuntz: Ted Cruz could be the most conservative GOP nominee in 50 years.

Good for voter enthusiasm. https://t.co/8EGBWU0T9V https:…",256,0,Twitter for Windows,2016-04-04 18:13:15,48215514,sbukosky,Steven Bukosky,2009-06-18 02:36:48,Student of Online Trading Academy and Futures trader. Group leader of VectorVest Lake Geneva User Group (LUG). Some conservative politics tossed in the mix.,74,69,Waukesha Wisconsin,,0,1.0,0.710393772894,0.1125,positive,0.0625,0.1125
954,717051826919587840,"RT @aseitzwald: NEW: Bernie Sanders calls for shutting down Indian Point, highlighting opposition to nuclear power. https://t.co/vRF4vWEMnR",58,0,Twitter for Android,2016-04-04 18:10:52,114873175,wismiss3,Sandy,2010-02-16 21:56:52,"My husband and I are chairmakers, live on a small farm west central Wisc. Love Adam and Lucas Rossi and Lee Cherry. Could even love you, Neil.",1478,2058,Wisconsin,Central Time (US & Canada),0,1.0,0.0695153061224,0.0102040816327,negative,0.0423611111111,0.2
955,717051503794642944,"RT @RussOnPolitics: New #WIprimary Emerson College poll: Bernie: 51%, Hillary: 43%. This is a 14 point swing in just two weeks. Yikes. http…",44,0,Twitter for Android,2016-04-04 18:09:35,1349829794,SableViews,A Personal Opinion,2013-04-13 17:45:27,"kind of an Elly May Clampett that grew up to be a microbiologist. I love animals, nature, science, reason, ideas, books, creativity and art.",3180,2947,"rural Wisconsin, USA",Central Time (US & Canada),1,0.265,0.0288461538462,0.0,negative,0.625,0.0
956,717051365772640256,Video before the Bernie sanders rally starts #Janesville #BernieSanders https://t.co/kskk1Lkqv1,1,1,Twitter for iPhone,2016-04-04 18:09:02,334817521,derek94gt,Derek Hauger,2011-07-13 18:26:25,"Help Desk, Mustang Enthusiast, Veteran....haeyyyyyyyy",72,74,Wisconsin,,2,0.127,0.0,0.0267857142857,negative,0.0,0.0
