,tweetID,tweetText,tweetRetweetCt,tweetFavoriteCt,tweetSource,tweetCreated,userID,userScreen,userName,userCreateDt,userDesc,userFollowerCt,userFriendsCt,userLocation,userTimezone,tweetHashtagCt,Weight,positiveness,negativeness,sentiment_label,pos_adj,neg_adj
566,716716405945737217,"Sanders: Despite progress of ACA, ""today there are 29 million people who have zero health insurance.""",0,0,Twitter Web Client,2016-04-03 19:58:01,21885393,jonathanderson,Jonathan Anderson,2009-02-25 16:43:37,"@USAToday Network-Wisconsin reporter. Interested in journalism, law, FOI. Tweets ≠ endorsement.",1585,2092,Marshfield/Wisconsin Rapids,Central Time (US & Canada),0,1.0,0.0387145748988,0.0263157894737,negative,0.0,0.25
567,716716334038564864,Sanders: 17 million Americans now insured,0,0,Twitter Web Client,2016-04-03 19:57:44,21885393,jonathanderson,Jonathan Anderson,2009-02-25 16:43:37,"@USAToday Network-Wisconsin reporter. Interested in journalism, law, FOI. Tweets ≠ endorsement.",1585,2092,Marshfield/Wisconsin Rapids,Central Time (US & Canada),0,1.0,0.0,0.375,negative,0.0,0.375
568,716716279210582016,"Sanders: ACA has ""done a lot of good."" Got rid of pre-existing conditions.",0,1,Twitter Web Client,2016-04-03 19:57:31,21885393,jonathanderson,Jonathan Anderson,2009-02-25 16:43:37,"@USAToday Network-Wisconsin reporter. Interested in journalism, law, FOI. Tweets ≠ endorsement.",1585,2092,Marshfield/Wisconsin Rapids,Central Time (US & Canada),0,1.0,0.633723732408,0.420546558704,positive,0.0,0.375
569,716716177582661633,Sanders: Health care is a right of all people,0,0,Twitter Web Client,2016-04-03 19:57:07,21885393,jonathanderson,Jonathan Anderson,2009-02-25 16:43:37,"@USAToday Network-Wisconsin reporter. Interested in journalism, law, FOI. Tweets ≠ endorsement.",1585,2092,Marshfield/Wisconsin Rapids,Central Time (US & Canada),0,1.0,0.0288461538462,0.0,positive,0.517857142857,0.0
570,716716119176912896,Sanders: Short-term profits of fossil fuel industry not as important as future of planet,0,0,Twitter Web Client,2016-04-03 19:56:53,21885393,jonathanderson,Jonathan Anderson,2009-02-25 16:43:37,"@USAToday Network-Wisconsin reporter. Interested in journalism, law, FOI. Tweets ≠ endorsement.",1585,2092,Marshfield/Wisconsin Rapids,Central Time (US & Canada),0,1.0,0.320833333333,0.0566666666667,positive,0.320833333333,0.0566666666667
571,716715829501554688,"Sanders: U.S. needs to get away from fossil fuel, focus on sustainable energy",0,0,Twitter Web Client,2016-04-03 19:55:44,21885393,jonathanderson,Jonathan Anderson,2009-02-25 16:43:37,"@USAToday Network-Wisconsin reporter. Interested in journalism, law, FOI. Tweets ≠ endorsement.",1585,2092,Marshfield/Wisconsin Rapids,Central Time (US & Canada),0,1.0,0.642361111111,0.220486111111,positive,0.625,0.0
572,716715635925843968,@isthmus https://t.co/ZbGiuKbpFh Friends of Black River Forest speak to Kohler destruction abuse of power at Sanders Town Hall Sheboygan:51,0,0,Twitter Web Client,2016-04-03 19:54:58,4313491461,friendsbrf1,FBRF,2015-11-29 02:49:10,Grassroots group fighting Kohler's destruction of ecosystem and state land grab in Sheboygan County. Challenging  politically corrupted DNR in Kohler's pocket.,13,49,"Sheboygan, Wisconsin",,0,1.0,0.0,0.0,positive,0.0,0.0
573,716715254181400576,"RT @CBSNews: NEW CBS News poll: Sanders has narrow lead in Wisconsin, Clinton leads in New York https://t.co/hSdv0dlwtu https://t.co/zXighR…",119,0,Twitter for Android,2016-04-03 19:53:27,1349829794,SableViews,A Personal Opinion,2013-04-13 17:45:27,"kind of an Elly May Clampett that grew up to be a microbiologist. I love animals, nature, science, reason, ideas, books, creativity and art.",3167,2945,"rural Wisconsin, USA",Central Time (US & Canada),0,1.0,0.148558897243,0.14298245614,positive,0.0583333333333,0.116666666667
574,716714916845998081,@MidwestEnvServ https://t.co/ZbGiuKbpFh Friends of the Black River Forest speak at Sanders Town Hall on Kohler planned destruction at:51,0,0,Twitter Web Client,2016-04-03 19:52:06,4313491461,friendsbrf1,FBRF,2015-11-29 02:49:10,Grassroots group fighting Kohler's destruction of ecosystem and state land grab in Sheboygan County. Challenging  politically corrupted DNR in Kohler's pocket.,13,49,"Sheboygan, Wisconsin",,0,1.0,0.0,0.0,positive,0.0,0.0
575,716714752421003264,"@MiltownBucky yeah. If Bernie Sanders won, he'd be President Sanders. If Rosario Dawson won, she'd be Babe-raham Lincoln (#WaynesWorldJoke)",0,0,Twitter Web Client,2016-04-03 19:51:27,331791048,JaggdLittlePhil,Frank Blunderwood,2011-07-08 18:32:21,"Lions and Tigers and Blunders, Oh My!",856,862,Wisconsin,America/Chicago,1,0.265,0.370192307692,0.0,negative,0.0,0.0
576,716714708582211584,RT @Maggyw519: Bernie Sanders is an asshole....... https://t.co/3kVhcWxa7U,7,0,Twitter Web Client,2016-04-03 19:51:17,264638020,EPluribusWiggum,E. Pluribus Wiggum,2011-03-12 06:32:07,Express Yourself Don't Repress Yourself.. #BoycottHollywood,197,48,Wisconsin,Central Time (US & Canada),0,1.0,0.0288461538462,0.0,negative,0.0,0.0
577,716714500242669568,"Sanders: U.S. needs comprehensive immigration reform, path toward citizenship",0,0,Twitter Web Client,2016-04-03 19:50:27,21885393,jonathanderson,Jonathan Anderson,2009-02-25 16:43:37,"@USAToday Network-Wisconsin reporter. Interested in journalism, law, FOI. Tweets ≠ endorsement.",1585,2092,Marshfield/Wisconsin Rapids,Central Time (US & Canada),0,1.0,0.0,0.208333333333,positive,0.0,0.0
578,716714319329824769,Sanders on Wall Street: It is their time to help the middle class.,0,0,Twitter Web Client,2016-04-03 19:49:44,21885393,jonathanderson,Jonathan Anderson,2009-02-25 16:43:37,"@USAToday Network-Wisconsin reporter. Interested in journalism, law, FOI. Tweets ≠ endorsement.",1585,2092,Marshfield/Wisconsin Rapids,Central Time (US & Canada),0,1.0,0.0600961538462,0.00520833333333,positive,0.0,0.0
579,716714229890461696,Sanders: We will pay for free tuition by taxing Wall Street.,0,0,Twitter Web Client,2016-04-03 19:49:22,21885393,jonathanderson,Jonathan Anderson,2009-02-25 16:43:37,"@USAToday Network-Wisconsin reporter. Interested in journalism, law, FOI. Tweets ≠ endorsement.",1585,2092,Marshfield/Wisconsin Rapids,Central Time (US & Canada),0,1.0,0.0820707070707,0.333333333333,positive,0.0138888888889,0.708333333333
580,716714140455153664,"Over Dinner, Clinton and Sanders Bash Wisconsin's Scott Walker https://t.co/bZwheyE4RZ",1,0,SNS Analytics,2016-04-03 19:49:01,111568813,WalkerDaily,Scott Walker,2010-02-05 11:34:54,This account aggregates all of the news stories about Governor Scott Walker of Wisconsin. The account is not affiliated with Scott Walker.,4226,4458,Wisconsin ,Pacific Time (US & Canada),0,1.0,0.0,0.0,positive,0.0,0.0
581,716714054463528960,@ScottMilfred https://t.co/ZbGiuKbpFh Friends of the Black River Forest address Kohler destruction at Sanders Town Hall beg.:51,0,0,Twitter Web Client,2016-04-03 19:48:41,4313491461,friendsbrf1,FBRF,2015-11-29 02:49:10,Grassroots group fighting Kohler's destruction of ecosystem and state land grab in Sheboygan County. Challenging  politically corrupted DNR in Kohler's pocket.,13,49,"Sheboygan, Wisconsin",,0,1.0,0.0,0.0,positive,0.0,0.0
582,716713980954353664,"RT @jonathanderson: Sanders: “If you do well in school, yes, you will be able to get a college education.”",4,0,TweetDeck,2016-04-03 19:48:23,14525878,wrtribune,Daily Tribune Media,2008-04-25 12:52:23,News posted by Wisconsin Rapids Daily Tribune staff covering central Wisconsin. Find us on Facebook: /wisconsinrapidstribune Follows aren't endorsements.,2542,240,"Wisconsin Rapids, Wisconsin",Central Time (US & Canada),0,1.0,0.207264957265,0.0313835470085,negative,0.822916666667,0.0
583,716713980878798848,"RT @jonathanderson: Sanders: “If you do well in school, yes, you will be able to get a college education.”",4,0,TweetDeck,2016-04-03 19:48:23,17443274,wausauherald,Daily Herald Media,2008-11-17 15:32:43,"What you need to know in Wausau, north central Wisconsin and beyond: now. Real people in our newsroom and the field tweeting news, features, sports & more.",5524,721,"Wausau, Wisconsin",Central Time (US & Canada),0,1.0,0.207264957265,0.0313835470085,negative,0.822916666667,0.0
584,716713950470094848,Sanders: We have to do something about student debt.,0,0,Twitter Web Client,2016-04-03 19:48:16,21885393,jonathanderson,Jonathan Anderson,2009-02-25 16:43:37,"@USAToday Network-Wisconsin reporter. Interested in journalism, law, FOI. Tweets ≠ endorsement.",1585,2092,Marshfield/Wisconsin Rapids,Central Time (US & Canada),0,1.0,0.0146761133603,0.0455465587045,positive,0.0,0.0
585,716713906648051712,"Sanders: “If you do well in school, yes, you will be able to get a college education.”",4,0,Twitter Web Client,2016-04-03 19:48:05,21885393,jonathanderson,Jonathan Anderson,2009-02-25 16:43:37,"@USAToday Network-Wisconsin reporter. Interested in journalism, law, FOI. Tweets ≠ endorsement.",1585,2092,Marshfield/Wisconsin Rapids,Central Time (US & Canada),0,1.0,0.207264957265,0.0313835470085,negative,0.822916666667,0.0
586,716713485929996288,WHO WANTS TO DRIVE ME TO THE BERNIE SANDERS RALLY TOMORROW!?,1,4,Twitter for iPhone,2016-04-03 19:46:25,252362218,Explod1ngNinja,Pineapple man,2011-02-15 01:30:17,Great source of potassium,338,1393,"Wisconsin, USA",Central Time (US & Canada),0,1.0,0.0375,0.075,negative,0.0,0.0
587,716713427188756481,"Sanders on free tuition: ""Is this a radical idea? Not it is not.""",0,0,Twitter Web Client,2016-04-03 19:46:11,21885393,jonathanderson,Jonathan Anderson,2009-02-25 16:43:37,"@USAToday Network-Wisconsin reporter. Interested in journalism, law, FOI. Tweets ≠ endorsement.",1585,2092,Marshfield/Wisconsin Rapids,Central Time (US & Canada),0,1.0,0.196581196581,0.333333333333,negative,0.138888888889,0.333333333333
588,716713345806630916,Sanders: Public colleges should be free,0,0,Twitter Web Client,2016-04-03 19:45:52,21885393,jonathanderson,Jonathan Anderson,2009-02-25 16:43:37,"@USAToday Network-Wisconsin reporter. Interested in journalism, law, FOI. Tweets ≠ endorsement.",1585,2092,Marshfield/Wisconsin Rapids,Central Time (US & Canada),0,1.0,0.042735042735,0.395833333333,positive,0.0138888888889,0.333333333333
589,716713192018288640,Sanders rally at UW-EC touches wide range of economic issues: https://t.co/pgLhB2VEHX https://t.co/ZrlWWMsvCO,1,0,SocialNewsDesk,2016-04-03 19:45:15,16473779,WQOW,WQOW News 18,2008-09-26 20:09:52,Eau Claire's Own: Digging Deeper into issues that affect the Chippewa Valley; tracking storms day & night; covering local sports like no one else.,8633,282,"Eau Claire, Wisconsin",Central Time (US & Canada),0,1.0,0.233333333333,0.072619047619,negative,0.233333333333,0.047619047619
590,716712944868990976,"Sanders talks about student debt, gets applause",0,0,Twitter Web Client,2016-04-03 19:44:16,21885393,jonathanderson,Jonathan Anderson,2009-02-25 16:43:37,"@USAToday Network-Wisconsin reporter. Interested in journalism, law, FOI. Tweets ≠ endorsement.",1585,2092,Marshfield/Wisconsin Rapids,Central Time (US & Canada),0,1.0,0.0173611111111,0.0121527777778,negative,0.0,0.0
591,716712830355898369,RT @KailiJoy: Bernie Sanders blaming his wife for not being able to release his tax returns is just about the most perfect thing.,49,0,Twitter for iPad,2016-04-03 19:43:49,254340945,cranevl,cranehaven,2011-02-19 03:07:32,"Retired sociologist, love travel and books, six adult children, eleven grandchildren. Over three decades of humanitarian and educational work in Latin America.",330,153,Wisconsin,,0,1.0,0.918108974359,0.208333333333,negative,1.44791666667,0.0
592,716712637019635712,Sanders: This campaign is listening to young people.,0,0,Twitter Web Client,2016-04-03 19:43:03,21885393,jonathanderson,Jonathan Anderson,2009-02-25 16:43:37,"@USAToday Network-Wisconsin reporter. Interested in journalism, law, FOI. Tweets ≠ endorsement.",1585,2092,Marshfield/Wisconsin Rapids,Central Time (US & Canada),0,1.0,0.103846153846,0.075,positive,0.075,0.075
593,716712567381561344,"Sanders cites income gap b/t males &amp; females. ""There is no rational economic reason for that. It is nothing more than old-fashioned sexism.""",0,0,Twitter Web Client,2016-04-03 19:42:46,21885393,jonathanderson,Jonathan Anderson,2009-02-25 16:43:37,"@USAToday Network-Wisconsin reporter. Interested in journalism, law, FOI. Tweets ≠ endorsement.",1585,2092,Marshfield/Wisconsin Rapids,Central Time (US & Canada),0,1.0,0.645192307692,0.0,positive,0.5875,0.0
594,716712391870967809,"Sanders: ""This campaign is listening to women.""",0,0,Twitter Web Client,2016-04-03 19:42:04,21885393,jonathanderson,Jonathan Anderson,2009-02-25 16:43:37,"@USAToday Network-Wisconsin reporter. Interested in journalism, law, FOI. Tweets ≠ endorsement.",1585,2092,Marshfield/Wisconsin Rapids,Central Time (US & Canada),0,1.0,0.0288461538462,0.0,positive,0.0,0.0
595,716712344815017984,"Sanders: ""We're going to raise Social Security""",0,0,Twitter Web Client,2016-04-03 19:41:53,21885393,jonathanderson,Jonathan Anderson,2009-02-25 16:43:37,"@USAToday Network-Wisconsin reporter. Interested in journalism, law, FOI. Tweets ≠ endorsement.",1585,2092,Marshfield/Wisconsin Rapids,Central Time (US & Canada),0,1.0,0.0458333333333,0.0118055555556,positive,0.0,0.5
596,716712259829956609,"RT @Bill_Lenner: .@docrocktex26 @getfitshannon @denver_rose President Bernie Sanders ""State of the speech? ""Jane's working on it. might be…",5,0,Twitter for iPad,2016-04-03 19:41:33,254340945,cranevl,cranehaven,2011-02-19 03:07:32,"Retired sociologist, love travel and books, six adult children, eleven grandchildren. Over three decades of humanitarian and educational work in Latin America.",330,153,Wisconsin,,0,1.0,0.0296296296296,0.0037037037037,negative,0.125,0.0
597,716711781201215489,"RT @jonathanderson: Sanders: To make sure drinking water stays clean, we must ""phase out fracking""",4,0,TweetDeck,2016-04-03 19:39:39,14525878,wrtribune,Daily Tribune Media,2008-04-25 12:52:23,News posted by Wisconsin Rapids Daily Tribune staff covering central Wisconsin. Find us on Facebook: /wisconsinrapidstribune Follows aren't endorsements.,2542,240,"Wisconsin Rapids, Wisconsin",Central Time (US & Canada),0,1.0,0.474142669189,0.183423062732,positive,0.760777777778,0.358666666667
598,716711781113204736,"RT @jonathanderson: Sanders: To make sure drinking water stays clean, we must ""phase out fracking""",4,0,TweetDeck,2016-04-03 19:39:39,17443274,wausauherald,Daily Herald Media,2008-11-17 15:32:43,"What you need to know in Wausau, north central Wisconsin and beyond: now. Real people in our newsroom and the field tweeting news, features, sports & more.",5524,721,"Wausau, Wisconsin",Central Time (US & Canada),0,1.0,0.474142669189,0.183423062732,positive,0.760777777778,0.358666666667
599,716711693859090432,"Sanders: To make sure drinking water stays clean, we must ""phase out fracking""",4,0,Twitter Web Client,2016-04-03 19:39:18,21885393,jonathanderson,Jonathan Anderson,2009-02-25 16:43:37,"@USAToday Network-Wisconsin reporter. Interested in journalism, law, FOI. Tweets ≠ endorsement.",1585,2092,Marshfield/Wisconsin Rapids,Central Time (US & Canada),0,1.0,0.474142669189,0.183423062732,positive,0.760777777778,0.358666666667
600,716711350190284800,"RT @KaivanShroff: Sanders has marketed as humblest man on Earth, of course he doesn't want to release tax returns showing that he too earns…",34,0,Twitter for iPad,2016-04-03 19:37:56,254340945,cranevl,cranehaven,2011-02-19 03:07:32,"Retired sociologist, love travel and books, six adult children, eleven grandchildren. Over three decades of humanitarian and educational work in Latin America.",330,153,Wisconsin,,0,1.0,0.15217611336,0.120546558704,positive,0.0,0.0
601,716711161249603584,"Sanders: Trade is not ""sexy"" issue, but enormously important issue affecting workers and economy.",1,2,Twitter Web Client,2016-04-03 19:37:11,21885393,jonathanderson,Jonathan Anderson,2009-02-25 16:43:37,"@USAToday Network-Wisconsin reporter. Interested in journalism, law, FOI. Tweets ≠ endorsement.",1585,2092,Marshfield/Wisconsin Rapids,Central Time (US & Canada),0,1.0,0.978846153846,0.0525,negative,0.8,0.015
602,716710880155738112,Watch LA PROTEST: CNN SIT-IN FOR BERNIE SANDERS TO END MEDIA BIAS! on @livestream: https://t.co/1bXoY0aj5e,9,5,Linkis.com,2016-04-03 19:36:04,204135207,TardisMechanic1,BadWolf TimeLady,2010-10-18 00:41:19,The revolution is not an apple that falls when it is ripe. You have to make it fall. -Che Guevara.,1059,1156,Wisconsin,Central Time (US & Canada),0,1.0,0.0,0.0,negative,0.0,0.0
603,716710702472368128,RT @rtmystan: Bernie Sanders https://t.co/crHmCaIu5m,228,0,Twitter for iPhone,2016-04-03 19:35:21,252362218,Explod1ngNinja,Pineapple man,2011-02-15 01:30:17,Great source of potassium,339,1393,"Wisconsin, USA",Central Time (US & Canada),0,1.0,0.0,0.0,negative,0.0,0.0
604,716710389518434306,"RT @TheObamaDiary: 'Apologies to Bernie Sanders'

https://t.co/ABvFUoujXo https://t.co/cwBL1lGd2Q",72,0,Twitter for iPad,2016-04-03 19:34:07,254340945,cranevl,cranehaven,2011-02-19 03:07:32,"Retired sociologist, love travel and books, six adult children, eleven grandchildren. Over three decades of humanitarian and educational work in Latin America.",330,153,Wisconsin,,0,1.0,0.0,0.0,positive,0.0,0.0
605,716710061066727424,"RT @edixon1213: Go chk out @smoothkobra's thread on Sanders investments, you're gonna flip... @Only4RM @jfreewright",15,0,Twitter for iPad,2016-04-03 19:32:49,254340945,cranevl,cranehaven,2011-02-19 03:07:32,"Retired sociologist, love travel and books, six adult children, eleven grandchildren. Over three decades of humanitarian and educational work in Latin America.",330,153,Wisconsin,,0,1.0,0.0111111111111,0.00138888888889,positive,0.0,0.2375
606,716709949762613248,RT @UWMadisonPolice: Police and security briefing is underway for today's Sanders event at the Kohl Center. https://t.co/oP4joBHmow,5,0,Twitter Web Client,2016-04-03 19:32:22,288052709,SairaAnwer,Saira Anwer,2011-04-26 04:44:25,Reporter. Anchor. Cupcake enthusiast.,207,176,"Wisconsin, USA",,0,1.0,0.0288461538462,0.0,positive,0.0,0.0
607,716709746250805249,Susan Sarandon Says She May Not Vote For Clinton If Sanders Loses Dem Race https://t.co/PisDlOpqcy,0,0,Facebook,2016-04-03 19:31:33,14070273,oldjohnboy,oldjohnboy,2008-03-02 23:09:25,Active supporter of  education for disadvantaged Nicaragua kids. Supporting kids in Granada Nicaragua.,85,647,Green Bay Wisconsin,Central Time (US & Canada),0,1.0,0.0113636363636,0.0,positive,0.0,0.0
608,716709582278504449,"RT @jonathanderson: Sanders: ""This is a campaign of the people, by the people and for the people."" Standing ovation ensues.",4,0,TweetDeck,2016-04-03 19:30:54,14525878,wrtribune,Daily Tribune Media,2008-04-25 12:52:23,News posted by Wisconsin Rapids Daily Tribune staff covering central Wisconsin. Find us on Facebook: /wisconsinrapidstribune Follows aren't endorsements.,2542,240,"Wisconsin Rapids, Wisconsin",Central Time (US & Canada),0,1.0,0.0288461538462,0.0729166666667,positive,0.0,0.0
609,716709582077341697,"RT @jonathanderson: Sanders: ""This is a campaign of the people, by the people and for the people."" Standing ovation ensues.",4,0,TweetDeck,2016-04-03 19:30:54,17443274,wausauherald,Daily Herald Media,2008-11-17 15:32:43,"What you need to know in Wausau, north central Wisconsin and beyond: now. Real people in our newsroom and the field tweeting news, features, sports & more.",5524,721,"Wausau, Wisconsin",Central Time (US & Canada),0,1.0,0.0288461538462,0.0729166666667,positive,0.0,0.0
610,716709526473465861,"Sanders: ""Secretary Clinton has gone a different route in terms of raising money.""",0,1,Twitter Web Client,2016-04-03 19:30:41,21885393,jonathanderson,Jonathan Anderson,2009-02-25 16:43:37,"@USAToday Network-Wisconsin reporter. Interested in journalism, law, FOI. Tweets ≠ endorsement.",1585,2092,Marshfield/Wisconsin Rapids,Central Time (US & Canada),0,1.0,0.205701754386,0.0964546783626,positive,0.275,0.464583333333
611,716709468738822145,"Sanders: ""This is a campaign of the people, by the people and for the people."" Standing ovation ensues.",4,2,Twitter Web Client,2016-04-03 19:30:27,21885393,jonathanderson,Jonathan Anderson,2009-02-25 16:43:37,"@USAToday Network-Wisconsin reporter. Interested in journalism, law, FOI. Tweets ≠ endorsement.",1585,2092,Marshfield/Wisconsin Rapids,Central Time (US & Canada),0,1.0,0.0288461538462,0.0729166666667,positive,0.0,0.0
612,716709392905859073,"Sanders: ""You can run a winning campaign without being dependent on Wall Street and the big money interests.""",0,1,Twitter Web Client,2016-04-03 19:30:09,21885393,jonathanderson,Jonathan Anderson,2009-02-25 16:43:37,"@USAToday Network-Wisconsin reporter. Interested in journalism, law, FOI. Tweets ≠ endorsement.",1585,2092,Marshfield/Wisconsin Rapids,Central Time (US & Canada),0,1.0,0.190252836594,0.0496366776855,positive,0.719551282051,0.211004273504
613,716709355199062017,RT @RipleyInCT: The Double-speak #Sanders engaged in with regard to his #Taxes answer on @CNN is very telling. He only takes a salary? Real…,1,0,Twitter for iPhone,2016-04-03 19:30:00,18479820,elevate53,elevate53,2008-12-30 15:50:52,"Liberal, Red Sox, Cubs fan, not a fan of Republican Party",1605,2028,"Madison, Wisconsin",Central Time (US & Canada),2,0.127,0.20463980464,0.00992063492063,positive,0.508928571429,0.00892857142857
614,716709315365769216,"Sanders: ""Our average contribution is $27. This is pretty revolutionary.""",0,1,Twitter Web Client,2016-04-03 19:29:51,21885393,jonathanderson,Jonathan Anderson,2009-02-25 16:43:37,"@USAToday Network-Wisconsin reporter. Interested in journalism, law, FOI. Tweets ≠ endorsement.",1585,2092,Marshfield/Wisconsin Rapids,Central Time (US & Canada),0,1.0,0.394497863248,0.381944444444,positive,0.253472222222,0.361111111111
615,716709235497771008,"Sanders criticizes big money in politics, says his campaign has received $6 million individual campaign contributions.",0,0,Twitter Web Client,2016-04-03 19:29:32,21885393,jonathanderson,Jonathan Anderson,2009-02-25 16:43:37,"@USAToday Network-Wisconsin reporter. Interested in journalism, law, FOI. Tweets ≠ endorsement.",1585,2092,Marshfield/Wisconsin Rapids,Central Time (US & Canada),0,1.0,0.264821801006,0.237320062978,positive,0.469551282051,0.0235042735043
616,716708833997926400,RT @CNNSotu: Sanders will not commit to matching Clinton posting 8 yrs of tax returns on website before NY. Sanders says his wife prepares…,471,0,Twitter Web Client,2016-04-03 19:27:56,277845186,jacqui4peace,☮JacquiUpNorth☮,2011-04-06 04:29:52,"Progressive Dem,Wife,Mom,USAF Mom, I LOVE #OBAMA won't tolerate people who bash him. #Springsteen #Maddow #Packers #Peace #ImWithHer #NeverBernie",1767,1486,Way up north Wisconsin ,Central Time (US & Canada),0,1.0,0.20303030303,0.0375,positive,0.0,0.0
617,716708661964455937,RT @AGirl4Bernie: 170 Economists endorsed him + Clinton's ex sec. of labor. Economy would SOAR under Bernie https://t.co/iJoTDMfP2T https:/…,49,0,Twitter for Android,2016-04-03 19:27:15,1349829794,SableViews,A Personal Opinion,2013-04-13 17:45:27,"kind of an Elly May Clampett that grew up to be a microbiologist. I love animals, nature, science, reason, ideas, books, creativity and art.",3167,2945,"rural Wisconsin, USA",Central Time (US & Canada),0,1.0,0.25,0.0,positive,0.0,0.1875
618,716708483861753856,Sanders says country needs to rethink how mental health care is provided,0,1,Twitter Web Client,2016-04-03 19:26:33,21885393,jonathanderson,Jonathan Anderson,2009-02-25 16:43:37,"@USAToday Network-Wisconsin reporter. Interested in journalism, law, FOI. Tweets ≠ endorsement.",1585,2092,Marshfield/Wisconsin Rapids,Central Time (US & Canada),0,1.0,0.100924075924,0.258333333333,negative,0.025,0.05
619,716708386696404993,"RT @smoothkobra: Today, a Sanders supporter angrily told me its about class and that Blacks should get over racism. My response: https://t.…",838,0,Twitter Web Client,2016-04-03 19:26:09,277845186,jacqui4peace,☮JacquiUpNorth☮,2011-04-06 04:29:52,"Progressive Dem,Wife,Mom,USAF Mom, I LOVE #OBAMA won't tolerate people who bash him. #Springsteen #Maddow #Packers #Peace #ImWithHer #NeverBernie",1767,1486,Way up north Wisconsin ,Central Time (US & Canada),0,1.0,0.0720486111111,0.0512152777778,positive,0.375,0.0
620,716708301166288898,Sanders gets raucous applause after he mentions his bill to end federal ban on marijuana.,1,0,Twitter Web Client,2016-04-03 19:25:49,21885393,jonathanderson,Jonathan Anderson,2009-02-25 16:43:37,"@USAToday Network-Wisconsin reporter. Interested in journalism, law, FOI. Tweets ≠ endorsement.",1585,2092,Marshfield/Wisconsin Rapids,Central Time (US & Canada),0,1.0,0.0486111111111,0.137152777778,negative,0.03125,0.125
621,716708099487305732,"RT @ClydesPlace: Bernie Sanders whole career shtick has been about the taxes others pay.  Yet, cloaks his own in a veil of ""Jane ate my hom…",49,0,Twitter for Android,2016-04-03 19:25:01,1477241472,vickscan,VickScan,2013-06-02 13:03:14,Mother and grandmother that loves politics and the democratic process. Fired Up and Ready to Go!   Add me to a list = a BLOCK!           #ImWithHer,886,1036,Wisconsin ,Pacific Time (US & Canada),0,1.0,0.265229726414,0.201315789474,negative,0.116666666667,0.00833333333333
622,716707750709866496,"RT @smoothkobra: If it only took me 15 minutes to find out that Bernie Sanders is profitting from fracking, what else is he making money fr…",226,0,Twitter Web Client,2016-04-03 19:23:38,277845186,jacqui4peace,☮JacquiUpNorth☮,2011-04-06 04:29:52,"Progressive Dem,Wife,Mom,USAF Mom, I LOVE #OBAMA won't tolerate people who bash him. #Springsteen #Maddow #Packers #Peace #ImWithHer #NeverBernie",1767,1486,Way up north Wisconsin ,Central Time (US & Canada),0,1.0,0.1398209925,0.0136180960479,negative,0.0,0.2375
