,Unnamed: 0,tweetID,tweetText,tweetRetweetCt,tweetFavoriteCt,tweetSource,tweetCreated,userID,userScreen,userName,userCreateDt,userDesc,userFollowerCt,userFriendsCt,userLocation,userTimezone,tweetHashtagCt,Weight
182,9637,712044132513026048,"RT @conradhackett: Top fact-check result
Trump: False
Cruz: False/mostly false

Clinton, Sanders: Mostly true
Kasich: True/mostly true http…",143,0,Buffer,2016-03-21 22:32:04,4794182534,WeNeedHillary,Progressive Man,2016-01-21 17:36:10,#Hillary2016 #ImWithHer #HillYes #ShesWithUs #UniteBlue #TopProg #LibCrib #p2 #PDmfnb #Obama #GunSense #StandwithPP #TNTweeters,5288,5412,"Idaho, USA",Pacific Time (US & Canada),0,1.0
183,10334,712042585926340608,Sanders says this election is about young people; they like it... https://t.co/P219EEmLCo,0,0,Facebook,2016-03-21 22:25:56,28126057,KBOI670,670 KBOI,2009-04-01 15:29:19,"670 KBOI is Idaho's 50,000 watt News Talk Radio Leader. Thanks for following us!",5670,1991,"Boise, Idaho",Mountain Time (US & Canada),0,1.0
184,10597,712042059054653440,RT @taylorbohrr: the Bernie sanders rally was awesome,5,0,Twitter for iPhone,2016-03-21 22:23:50,1424500368,al_xxxxp,alex polifuckinlit,2013-05-13 03:09:39,chill out #Bernie2016,326,236,idaho ,,0,1.0
185,10948,712041279388000263,Thousands showed up at Taco Bell Arena at Boise State today to listen to Bernie Sanders. Full coverage at 5 and 6! https://t.co/e0YN360Jcq,0,1,Twitter Web Client,2016-03-21 22:20:44,82788350,Emjayktvb,Mark Johnson,2009-10-16 03:33:46,"KTVB News Anchor, reporter, sports fan.  Happily married to Chrissy for 22 years!  Father of TWO sets of the greatest twins God ever made!",1463,98,"Boise, Idaho ",Mountain Time (US & Canada),0,1.0
186,11290,712040522131611653,RT @IdahoPressTrib: PHOTOS: This afternoon's @BernieSanders rally in Boise https://t.co/AyXihtnfPv,3,0,Tweetbot for iΟS,2016-03-21 22:17:44,21824534,GregKreller,Greg Kreller,2009-02-25 02:09:38,"Multimedia editor @IdahoPressTrib, @TexasTech alum, photojournalist, skier, brewer and western drifter - going wherever the tumbleweeds take me.",747,694,"Boise, Idaho",Mountain Time (US & Canada),0,1.0
187,11500,712040083545837568,PHOTOS: This afternoon's @BernieSanders rally in Boise https://t.co/AyXihtnfPv,3,2,Idaho Press-Tribune IPT,2016-03-21 22:15:59,18087829,IdahoPressTrib,Idaho Press-Tribune,2008-12-12 22:32:41,Official Twitter account for the Idaho Press-Tribune,13703,6388,"Nampa, Idaho",Mountain Time (US & Canada),0,1.0
188,12333,712038418151284736,RT @IdahoGOP: Bernie Sanders has brought his message of socialism to Boise. But does his message line up with Idahoans' values? https://t.c…,3,0,Mobile Web (M5),2016-03-21 22:09:22,559906522,IamtheRickster,Tyler Ricks,2012-04-21 22:30:23,"Political Junkie, Funny,Member of @AdaCountyTARs/@idahoyr/@TeensForTed,  Alumni of @CruzMillennial/@RandStudents/@Team_Rand. Always #NeverTrump",1023,948,Idaho,Mountain Time (US & Canada),0,1.0
189,12848,712037326839488512,Sanders rallies supporters at second Idaho campaign stop https://t.co/kAsFvhW7yE,0,0,IFTTT,2016-03-21 22:05:02,2335595143,TheIdahoReport,The Idaho Report,2014-02-09 19:52:37,Serving Idaho by only reporting news that happens in the Gem State.,2267,1,Idaho,Pacific Time (US & Canada),0,1.0
190,13122,712036726680788995,RT @llendonmar46: #BernieSanders Border Wall Not Needed As Part Of #Immigration Reform https://t.co/VAJNU582ng #p2 #USLatino #UniteBlue #tc…,23,0,Twitter for Android,2016-03-21 22:02:39,2274974018,Erasmo78856372,Erasmo jesus,2014-01-03 19:25:36,,1531,1526,idaho,,6,0.009
191,13326,712036244402925568,Susan Sarandon stumps for Sanders in Boise ahead of Idaho caucus - WTVC https://t.co/ZcNOF3beoM #Boise,0,0,SocialPresence,2016-03-21 22:00:44,2980142435,NewsInBoise,Boise News,2015-01-15 18:13:28,Follow us to receive the latest news in Boise Idaho,228,0,Boise Idaho,,1,0.265
192,13475,712035928005550081,"RT @thehill: Sanders slams Trump during border visit: We should be ""appalled"" by his ""bigoted"" comments https://t.co/hMTQdJEBrD https://t.c…",111,0,Twitter for Android,2016-03-21 21:59:28,2274974018,Erasmo78856372,Erasmo jesus,2014-01-03 19:25:36,,1531,1526,idaho,,0,1.0
193,13557,712035716314886144,"Bernie Sanders speaks to a Boise crowd of about 8,000 at Boise State University's @TacoBellArena https://t.co/c7tHSaZuxS",7,8,Twitter Web Client,2016-03-21 21:58:38,16043218,IBRnews,IdahoBusinessReview,2008-08-29 15:21:35,Idaho's source of local business news and information. Your business is our business. Subscribe now for instant access to premium content http://t.co/H1Df7pjeyC,9317,1188,Idaho,Mountain Time (US & Canada),0,1.0
194,14139,712034322539257858,"RT @DanaBordeaux: Donald Trump and Bernie Sanders want universal healthcare paid for by the ""government."" Its a small small world.",7,0,Twitter for Android,2016-03-21 21:53:06,2840798923,hitgrl15,Griffian,2014-10-05 04:15:26,Christian. Constitutional Conservative. Former military brat. #2A #1A Pro life Pro Israel. Anti Islam. Family. Pets are family too. 18+ #Cruz2016   OlllllllO,4393,4103,"North Idaho, USA",Pacific Time (US & Canada),0,1.0
195,14541,712033367248801793,"""Think about the taxes if Sanders gets elected!"" - people who have enough money to wipe their asses with",0,4,Twitter for iPhone,2016-03-21 21:49:18,1727254232,Captain_Walter,treadmill tumbleweed,2013-09-04 01:59:04,legalize ranch!,379,437,Idaho,,0,1.0
196,15906,712029594912575488,Sanders rallies supporters during Boise campaign stop - KTVB https://t.co/AV1nea5l8P,0,0,twitterfeed,2016-03-21 21:34:18,27976939,boisenews,Boise Idaho News,2009-03-31 22:11:13,Boise Idaho News,2479,1522,Boise Idaho,Mountain Time (US & Canada),0,1.0
197,16240,712028713018204160,"RT @kylieatwood: Sanders in Boise, ID: I think our country isn't as divided as media makes it out.. Democracy is not buying elections https…",13,0,Twitter for iPhone,2016-03-21 21:30:48,112951779,KindaTrevor,Bearcat,2010-02-10 06:39:17,lol oh,372,685,Idaho,Arizona,0,1.0
198,18119,712022861926412289,"An estimated 7,000 people came to hear Bernie Sanders in Boise today. Our coverage: https://t.co/KeUJWzufGa https://t.co/MnHOWEwiPh",0,4,TweetDeck,2016-03-21 21:07:33,935774174,MyMeridianPress,Meridian Press,2012-11-09 00:32:47,"Meridian Press is a weekly newspaper distributed to thousands of Meridian residents every Friday, filled with local business, city, school & entertainment news.",2850,1931,"Meridian, Idaho",,0,1.0
199,18387,712022092867178496,. @GregKreller snapped some great shots at the #BernieSanders rally. Had fun teaming up with him to interview voters https://t.co/8B4J2GL8nI,1,1,TweetDeck,2016-03-21 21:04:30,381833291,HollyBeechMP,Holly Beech,2011-09-29 01:04:29,"Meridian Press reporter with Idaho Press-Tribune, covering local city, school, business and community news. NNU grad, studied journalism, history and Spanish.",1286,922,"Nampa, Idaho",Mountain Time (US & Canada),1,0.265
200,18856,712020761989353472,RT @PopPoliticsAVT: Bernie Sanders Draws Large Crowd At 2nd Idaho Campaign Stop https://t.co/0i8Ad7AeXO #feelthebern #berniesanders #stillb…,5,0,Twitter Web Client,2016-03-21 20:59:13,707311380936806400,DanielleIsHappy,Danielle Pimentel,2016-03-08 21:05:49,"#Bernie2016 24 year old student at University of Idaho. I'm very passionate about the environment, politics, animals... and being happy (most of the time).",537,1045,"Idaho, USA",,3,0.063
201,20353,712016435086626820,the Bernie sanders rally was awesome,5,8,Twitter for iPhone,2016-03-21 20:42:01,1460507304,taylorbohrr,Tay,2013-05-26 20:04:58,Tray McCormick is my boy,644,498,"Idaho, USA",,0,1.0
202,20562,712015946316034048,RT @trustcurrency: #WouldMakeABetterPresident maybe guy who got arrested &amp; organized  desegregation in Chicago https://t.co/YIx9xwHWhn http…,5,0,Twitter Web Client,2016-03-21 20:40:04,707311380936806400,DanielleIsHappy,Danielle Pimentel,2016-03-08 21:05:49,"#Bernie2016 24 year old student at University of Idaho. I'm very passionate about the environment, politics, animals... and being happy (most of the time).",537,1045,"Idaho, USA",,1,0.265
203,21010,712014694018486272,Sanders urges Idaho Dems to turn out for tomorrow's caucuses https://t.co/TbX73iAILH,0,0,dlvr.it,2016-03-21 20:35:06,573930109,IDSmallBiz,Emily Swensen,2012-05-07 20:06:23,If you believe that a thriving Small Business and Entrepreneurial community makes Idaho State strong then support it by retweeting us!,3865,4140,Idaho,Atlantic Time (Canada),0,1.0
204,21254,712013915547242497,"RT @GuerrillaDems: If You Don't Give Up, Bernie Has a Clear Path to Victory https://t.co/SLN4jVu0O8
#ForThePeople #FeelTheBern #NotMeUs htt…",157,0,Twitter Web Client,2016-03-21 20:32:00,707311380936806400,DanielleIsHappy,Danielle Pimentel,2016-03-08 21:05:49,"#Bernie2016 24 year old student at University of Idaho. I'm very passionate about the environment, politics, animals... and being happy (most of the time).",537,1045,"Idaho, USA",,3,0.063
205,21286,712013815039131648,"RT @RevoltPolitic: If Bernie Sanders is nominated, Utah will vote for a Democrat for the first time since 1964. https://t.co/7NRgM9N19P",96,0,Twitter Web Client,2016-03-21 20:31:36,707311380936806400,DanielleIsHappy,Danielle Pimentel,2016-03-08 21:05:49,"#Bernie2016 24 year old student at University of Idaho. I'm very passionate about the environment, politics, animals... and being happy (most of the time).",537,1045,"Idaho, USA",,0,1.0
206,22168,712011419118600192,"Hearing Senator Sanders speak today was one of the best experience I've ever had, he has my vote… https://t.co/srq1ZajWKp",0,1,Instagram,2016-03-21 20:22:05,304620378,captainmagnum,Cole  Dansie,2011-05-24 20:37:03,Beardsman - ΦΔΘ - Boise State,103,110,"Nampa, Idaho",Central Time (US & Canada),0,1.0
207,22317,712011018428420096,Sanders' message against the status quo ignites Boise crowd https://t.co/smooAwqjUX,1,1,Idaho Press-Tribune IPT,2016-03-21 20:20:29,18087829,IdahoPressTrib,Idaho Press-Tribune,2008-12-12 22:32:41,Official Twitter account for the Idaho Press-Tribune,13703,6388,"Nampa, Idaho",Mountain Time (US & Canada),0,1.0
208,22809,712009739421523968,KTVB Sanders rallies supporters during Boise campaign stop KTVB Sanders stopped to rally voters… https://t.co/jKgTKnA3oA,0,0,Google,2016-03-21 20:15:25,366931232,Idaho_Guide,Idaho_Guide,2011-09-03 02:36:53,It is information on Idaho.,1353,1670,Idaho,Hawaii,0,1.0
209,23189,712008622578905089,RT @_ashhhbaby: I just don't understand why anyone would want to vote for Bernie Sanders. NOTHING IS FREE PEOPLE. 😂,3,0,Twitter for iPhone,2016-03-21 20:10:58,408176322,Its_T_Worrell,Tyler,2011-11-09 02:39:07,"it's cheaper to be yourself, ain't no wrong way to be. #AirForce",1976,1044,"Boise, Idaho✈️Texarkana",Central Time (US & Canada),0,1.0
210,24092,712006018432155648,Susan Sarandon stumps for Sanders in Boise ahead of Idaho caucus - https://t.co/lNNr01F1Av https://t.co/2YZfp8hDHY #Boise,0,0,SocialPresence,2016-03-21 20:00:37,2980142435,NewsInBoise,Boise News,2015-01-15 18:13:28,Follow us to receive the latest news in Boise Idaho,228,0,Boise Idaho,,1,0.265
211,25360,712002822938578944,Sanders sees victory path 'right through Idaho'; follow rally live - Idaho Statesman https://t.co/r2q0Mf2pQi,0,1,twitterfeed,2016-03-21 19:47:56,27976939,boisenews,Boise Idaho News,2009-03-31 22:11:13,Boise Idaho News,2479,1522,Boise Idaho,Mountain Time (US & Canada),0,1.0
212,25363,712002821151789056,"Sanders rallies cheering Boise crowd, bashes 'billionaires buying elections' - The Spokesman Review (registrat... https://t.co/mYyMfY2Zsc",2,2,twitterfeed,2016-03-21 19:47:55,27976939,boisenews,Boise Idaho News,2009-03-31 22:11:13,Boise Idaho News,2479,1522,Boise Idaho,Mountain Time (US & Canada),0,1.0
213,25364,712002819423862785,Boise's ralliers at Taco Bell Arena are #FeelingtheBern on social media - KBOI-TV https://t.co/gQmLTDAfYZ,3,2,twitterfeed,2016-03-21 19:47:55,27976939,boisenews,Boise Idaho News,2009-03-31 22:11:13,Boise Idaho News,2479,1522,Boise Idaho,Mountain Time (US & Canada),1,0.265
214,25975,712001278046384128,Eye on Boise: Bernie Sanders urges Idaho Dems to turn out for tomorrow's caucuses https://t.co/Dm3f3MfLKo #idpol,0,2,Twitter Web Client,2016-03-21 19:41:47,44360214,BetsyZRussell,Betsy Z. Russell,2009-06-03 13:41:11,,5723,320,"Boise, Idaho",Mountain Time (US & Canada),1,0.265
215,26652,711999482695553024,"@AliciaGarza_ @janicemorinn You've been quoted in my #Storify story ""Bernie Sanders draws crowd to Boise rally"" https://t.co/jMGqZu6iBj",0,2,Storify,2016-03-21 19:34:39,8980312,IdahoStatesman,Idaho Statesman,2007-09-19 18:56:13,"The Idaho Statesman newspaper is your #1 source for news, sports, outdoors, business, traffic, & more for Boise, Meridian, Eagle, Nampa, Idaho.",43005,3270,"Boise, Idaho, USA",Mountain Time (US & Canada),1,0.265
216,26653,711999482452267008,"@theJoelHoward You've been quoted in my #Storify story ""Bernie Sanders draws crowd to Boise rally"" https://t.co/jMGqZu6iBj",0,1,Storify,2016-03-21 19:34:39,8980312,IdahoStatesman,Idaho Statesman,2007-09-19 18:56:13,"The Idaho Statesman newspaper is your #1 source for news, sports, outdoors, business, traffic, & more for Boise, Meridian, Eagle, Nampa, Idaho.",43005,3270,"Boise, Idaho, USA",Mountain Time (US & Canada),1,0.265
217,26654,711999481898782720,"@N_Groff @davlinnews @IDSBillD You've been quoted in my #Storify story ""Bernie Sanders draws crowd to Boise rally"" https://t.co/jMGqZtOHJL",0,0,Storify,2016-03-21 19:34:39,8980312,IdahoStatesman,Idaho Statesman,2007-09-19 18:56:13,"The Idaho Statesman newspaper is your #1 source for news, sports, outdoors, business, traffic, & more for Boise, Meridian, Eagle, Nampa, Idaho.",43005,3270,"Boise, Idaho, USA",Mountain Time (US & Canada),1,0.265
218,26655,711999481726771200,"@reflectivity @kkruesi You've been quoted in my #Storify story ""Bernie Sanders draws crowd to Boise rally"" https://t.co/jMGqZtOHJL",0,0,Storify,2016-03-21 19:34:39,8980312,IdahoStatesman,Idaho Statesman,2007-09-19 18:56:13,"The Idaho Statesman newspaper is your #1 source for news, sports, outdoors, business, traffic, & more for Boise, Meridian, Eagle, Nampa, Idaho.",43005,3270,"Boise, Idaho, USA",Mountain Time (US & Canada),1,0.265
219,26656,711999481705861120,"@WPJohnWagner @rockybarker You've been quoted in my #Storify story ""Bernie Sanders draws crowd to Boise rally"" https://t.co/jMGqZtOHJL",1,0,Storify,2016-03-21 19:34:39,8980312,IdahoStatesman,Idaho Statesman,2007-09-19 18:56:13,"The Idaho Statesman newspaper is your #1 source for news, sports, outdoors, business, traffic, & more for Boise, Meridian, Eagle, Nampa, Idaho.",43005,3270,"Boise, Idaho, USA",Mountain Time (US & Canada),1,0.265
220,26772,711999205959712768,Idaho Statesman (blog) Susan Sarandon stumps for Sanders in Boise ahead of Idaho caucus WTVC… https://t.co/jKgTKnA3oA,0,0,Google,2016-03-21 19:33:33,366931232,Idaho_Guide,Idaho_Guide,2011-09-03 02:36:53,It is information on Idaho.,1353,1670,Idaho,Hawaii,0,1.0
221,27080,711998435759501312,"Sanders: “Nobody has asked me for my birth certificate. Maybe it has something to do with the tone of my skin, I don't know.""",1,0,TweetDeck,2016-03-21 19:30:30,381833291,HollyBeechMP,Holly Beech,2011-09-29 01:04:29,"Meridian Press reporter with Idaho Press-Tribune, covering local city, school, business and community news. NNU grad, studied journalism, history and Spanish.",1286,922,"Nampa, Idaho",Mountain Time (US & Canada),0,1.0
222,27094,711998394412171264,"Bernie Sanders talked to supporters in Boise for about 75 minutes. The rally just wrapped up.
We'll have the full video online later today.",1,1,TweetDeck,2016-03-21 19:30:20,557915119,jmasters7,John Masters,2012-04-19 17:51:19,"Internet producer for http://t.co/qoFWPAIp51. Husband to Beth, dad to Mandy. Enjoys golf and Idaho.",122,83,"Boise, Idaho",,0,1.0
223,27101,711998382949187584,Sanders also criticizes Trump for being part of the anti-Obama birther movement.,1,0,TweetDeck,2016-03-21 19:30:17,381833291,HollyBeechMP,Holly Beech,2011-09-29 01:04:29,"Meridian Press reporter with Idaho Press-Tribune, covering local city, school, business and community news. NNU grad, studied journalism, history and Spanish.",1286,922,"Nampa, Idaho",Mountain Time (US & Canada),0,1.0
224,27138,711998288468123648,Pretty cool event by Bernie Sanders here in Boise.,0,3,Twitter for iPhone,2016-03-21 19:29:54,44668650,RivalsStubbs,Stubbs Zanelli,2009-06-04 17:31:45,"Husband, Father | Senior Beat Writer for Boise State men's basketball and football at https://t.co/XAPn5grxPO -- https://t.co/AX8xZEvO4p | Future politician",1351,2035,Idaho,Pacific Time (US & Canada),0,1.0
225,27162,711998236215668736,RT @DCSQ11: Bernie Sanders only 1 who can beat Trump/Cruz! #UofA #Idaho #Utah #Arizona #NY #NYForBernie #Tuesday #March22nd https://t.co/43…,1,0,RoundTeam,2016-03-21 19:29:42,3473446641,IdahoLovers,Idaho Lover,2015-08-28 21:24:28,"#Idaho Lover. For all things in and about Idaho USA. Eat, drink, chat, tweet and date in Idaho. #FreeDatingInIdaho",848,502,"Idaho, USA",Pacific Time (US & Canada),8,0.002
226,27179,711998200656232448,"Sanders wraps speech, calls on Democrsts to support him at tomorrow's caucus. https://t.co/7r58JoNjZF",2,1,Twitter for iPhone,2016-03-21 19:29:33,543514255,ScottLoganKBOI,scott logan,2012-04-02 15:52:54,"Senior reporter at KBOI 2NEWS. Grew up in Boise, traveled world then came home",1003,61,"Boise, Idaho ",Arizona,0,1.0
227,27282,711997951371911168,"Sanders: “Trump is a pathological liar. (America) will not elect Donald Trump...he insults Mexicans, he insults Muslims, he insults women.""",0,2,TweetDeck,2016-03-21 19:28:34,381833291,HollyBeechMP,Holly Beech,2011-09-29 01:04:29,"Meridian Press reporter with Idaho Press-Tribune, covering local city, school, business and community news. NNU grad, studied journalism, history and Spanish.",1286,922,"Nampa, Idaho",Mountain Time (US & Canada),0,1.0
228,27292,711997929397952517,"Reading: Bannock County Democrats Move Caucus to Handle Large Crowds: Bernie Sanders, I-Vt., speaks to a crowd... https://t.co/dI4yw5T5vM",0,0,twitterfeed,2016-03-21 19:28:29,24819893,Idaho_Falls,IdahoFalls.com,2009-03-17 02:07:16,Idaho Falls Online Marketplace and community information,2030,249,"Idaho Falls, Idaho",Mountain Time (US & Canada),0,1.0
229,27451,711997621523451904,"RT @KTVB: Bernie Sanders ""We have go to make public colleges and universities tuition free!""
https://t.co/eqB2FWXflg",3,0,Twitter Web Client,2016-03-21 19:27:15,707311380936806400,DanielleIsHappy,Danielle Pimentel,2016-03-08 21:05:49,"#Bernie2016 24 year old student at University of Idaho. I'm very passionate about the environment, politics, animals... and being happy (most of the time).",537,1047,"Idaho, USA",,0,1.0
230,27485,711997542444060673,"RT @WPJohnWagner: Bernie Sanders draws a late-morning crowd of about 7,000 in Boise, Idaho, according to staff at the arena.",96,0,Twitter Web Client,2016-03-21 19:26:57,707311380936806400,DanielleIsHappy,Danielle Pimentel,2016-03-08 21:05:49,"#Bernie2016 24 year old student at University of Idaho. I'm very passionate about the environment, politics, animals... and being happy (most of the time).",537,1047,"Idaho, USA",,0,1.0
231,27635,711997232086515716,"Sanders calls Trump ""pathological liar."" https://t.co/CRdvV854nz",4,2,Twitter for iPhone,2016-03-21 19:25:43,543514255,ScottLoganKBOI,scott logan,2012-04-02 15:52:54,"Senior reporter at KBOI 2NEWS. Grew up in Boise, traveled world then came home",1003,61,"Boise, Idaho ",Arizona,0,1.0
232,27754,711996876279537665,"“One of the criticisms against me is, 'Oh, Bernie Sanders, nice guy, combs his hair really well, but he cannot win a general election.'”",0,0,TweetDeck,2016-03-21 19:24:18,381833291,HollyBeechMP,Holly Beech,2011-09-29 01:04:29,"Meridian Press reporter with Idaho Press-Tribune, covering local city, school, business and community news. NNU grad, studied journalism, history and Spanish.",1286,922,"Nampa, Idaho",Mountain Time (US & Canada),0,1.0
233,28149,711995816387301378,Boise Weekly Storify: Covering 'The Bern' at Sanders' Idaho Rally https://t.co/r3lyi7SAhq #FeelTheBern,0,0,Twitter for iPhone,2016-03-21 19:20:05,40742421,CarlNorman,Carl Norman,2009-05-17 21:36:46,"I support the #ACLU, #AmnestyInternational, peace, human rights, and #Bernie2016. I have a lifelong interest in philosophy.",14830,14348,"Nampa, Idaho",Mountain Time (US & Canada),1,0.265
234,28201,711995668882132993,Sanders draws crowd in Idaho Falls leading into state democratic caucus https://t.co/QI7WDZkcNf,0,0,Facebook,2016-03-21 19:19:30,87033578,TetonValleyNews,Teton Valley News,2009-11-02 21:31:12,Voice of the Valley since 1909.,440,197,"Driggs, Idaho",Mountain Time (US & Canada),0,1.0
235,28782,711994027361509376,"Bernie Sanders: “I've been criticized for saying this, so I will say it again: ... Health care is a right of all people, not a privilege.""",0,0,TweetDeck,2016-03-21 19:12:58,381833291,HollyBeechMP,Holly Beech,2011-09-29 01:04:29,"Meridian Press reporter with Idaho Press-Tribune, covering local city, school, business and community news. NNU grad, studied journalism, history and Spanish.",1286,922,"Nampa, Idaho",Mountain Time (US & Canada),0,1.0
236,29362,711992512924114948,"Sanders only mentioned Hillary Clinton a few times but targeted ""rigged economy and corrupt campaign finance."" https://t.co/VXjq14hfPo",2,2,Twitter for iPhone,2016-03-21 19:06:57,543514255,ScottLoganKBOI,scott logan,2012-04-02 15:52:54,"Senior reporter at KBOI 2NEWS. Grew up in Boise, traveled world then came home",1003,61,"Boise, Idaho ",Arizona,0,1.0
237,29644,711991845417451520,"Why is Hillary so afraid of Trump? Clinton/Soros Behind Violent Riots At Trump Rallies,Not Sanders https://t.co/2bRF7ITdvZ via @dailycaller",0,0,Mobile Web,2016-03-21 19:04:18,19899344,IdaFlo,IdaFlo,2009-02-02 09:23:41,"Conservative, Wife, Mom, Teacher, Confessional Lutheran",4426,4359,Idaho,Central Time (US & Canada),0,1.0
238,29827,711991414834397184,RT @HollyBeechMP: Big turnout for the Bernie Sanders rally at Boise State today. https://t.co/wbZ7ooY2gH,12,0,TweetDeck,2016-03-21 19:02:36,935774174,MyMeridianPress,Meridian Press,2012-11-09 00:32:47,"Meridian Press is a weekly newspaper distributed to thousands of Meridian residents every Friday, filled with local business, city, school & entertainment news.",2850,1931,"Meridian, Idaho",,0,1.0
239,29829,711991407318278144,"Sanders talking about student debt ""if Congress can bail out Wall Street we can bail the middle class.""",0,0,TweetDeck,2016-03-21 19:02:34,557915119,jmasters7,John Masters,2012-04-19 17:51:19,"Internet producer for http://t.co/qoFWPAIp51. Husband to Beth, dad to Mandy. Enjoys golf and Idaho.",122,83,"Boise, Idaho",,0,1.0
240,29831,711991405044846592,"Clinton And Soros Are Behind Violent Riots At Trump Rallies, Not Sanders https://t.co/2bRF7ITdvZ via @dailycaller",0,0,Mobile Web,2016-03-21 19:02:33,19899344,IdaFlo,IdaFlo,2009-02-02 09:23:41,"Conservative, Wife, Mom, Teacher, Confessional Lutheran",4426,4359,Idaho,Central Time (US & Canada),0,1.0
241,29852,711991356869124096,"Bernie Sanders: “We have got to make public colleges' and universities' tuition free. Is this a radical idea? It really isn't.""",0,0,TweetDeck,2016-03-21 19:02:22,381833291,HollyBeechMP,Holly Beech,2011-09-29 01:04:29,"Meridian Press reporter with Idaho Press-Tribune, covering local city, school, business and community news. NNU grad, studied journalism, history and Spanish.",1286,922,"Nampa, Idaho",Mountain Time (US & Canada),0,1.0
242,30084,711990811433500672,"Bernie Sanders ""We have go to make public colleges and universities tuition free!""
https://t.co/AZkXpsn58a",0,1,TweetDeck,2016-03-21 19:00:12,557915119,jmasters7,John Masters,2012-04-19 17:51:19,"Internet producer for http://t.co/qoFWPAIp51. Husband to Beth, dad to Mandy. Enjoys golf and Idaho.",122,83,"Boise, Idaho",,0,1.0
243,30228,711990445354582016,"RT @ConsultReid: Total employees by campaign:
Sanders 865
Clinton 765
Trump 94
Cruz 88
Kasich 40
https://t.co/Cmf8Ar5mzN",231,0,Twitter Web Client,2016-03-21 18:58:44,2713061568,PaulPyle,Paul W. Pyle,2014-08-06 22:23:35,"VP of Operations, website admin, video editor, husband of Janna, and father of 6yr old son Asa. Christian. Constitutional conservative. 2A. Homeschool.",375,234,"Nampa, Idaho",Mountain Time (US & Canada),0,1.0
244,30728,711989154796601344,"Sanders: It's time to rethink the 'war on drugs.' Marijuana shouldn't be federal crime; heroin addiction is a health, not a criminal, issue.",0,0,Twitter for Android,2016-03-21 18:53:37,381833291,HollyBeechMP,Holly Beech,2011-09-29 01:04:29,"Meridian Press reporter with Idaho Press-Tribune, covering local city, school, business and community news. NNU grad, studied journalism, history and Spanish.",1286,922,"Nampa, Idaho",Mountain Time (US & Canada),0,1.0
245,30744,711989125168009216,Why did the socialist go to the Bernie Sanders rally? He heard it was free.,0,5,Twitter for iPhone,2016-03-21 18:53:30,19867932,johnONeil,John P. 0'Neil,2009-02-01 17:49:22,"Record Hut Captain, eLDopamine singer & slanger. Grouched Bitterstream. Seattle Mariners baseball and Boise State Football. Rock the goat.",1375,949,Boise Idaho,Mountain Time (US & Canada),0,1.0
246,30855,711988803515187200,Sen. Sanders calls for raising the national minimum wage to $15 an hour. @BernieSanders https://t.co/f0fOucDrLG,20,19,Twitter for iPhone,2016-03-21 18:52:13,549411147,IdahoOnYourSide,6 On Your Side,2012-04-09 15:48:54,"New, Now and Next",4572,1635,"Boise, Idaho",Mountain Time (US & Canada),0,1.0
