,Unnamed: 0,tweetID,tweetText,tweetRetweetCt,tweetFavoriteCt,tweetSource,tweetCreated,userID,userScreen,userName,userCreateDt,userDesc,userFollowerCt,userFriendsCt,userLocation,userTimezone,tweetHashtagCt,Weight
122,9256,711681043997175808,RT @verda_verde: Bernie gets group endorsements when members decide; Hillary when leaders decide https://t.co/FLHUVhuYjp #ByThePeople https…,46,0,Twitter Web Client,2016-03-20 22:29:17,707311380936806400,DanielleIsHappy,Danielle Pimentel,2016-03-08 21:05:49,"#Bernie2016 24 year old student at University of Idaho. I'm very passionate about the environment, politics, animals... and being happy (most of the time).",536,1045,"Idaho, USA",,1,0.265
123,10928,711676796484214784,"RT @BernieSanders: Idaho, want real change? Caucus on Tuesday for Bernie Sanders. Bring your friends and family with you! #ByThePeople http…",1257,0,Twitter for Android,2016-03-20 22:12:25,60497581,JoelHuff,Pizza Claus,2009-07-27 05:16:42,U of I. Pi Kappa Alpha.,264,139,"Moscow, Idaho ",,1,0.265
124,12057,711674083910373376,"RT @BernieSanders: Idaho, want real change? Caucus on Tuesday for Bernie Sanders. Bring your friends and family with you! #ByThePeople http…",1257,0,Twitter for iPhone,2016-03-20 22:01:38,219722789,ReadJamAds,Jared Adams,2010-11-25 17:51:27,"Nerd, wannabe superhero, breakfast cereal enthusiast, Bernie Sanders supporter.",102,127,"Pocatello, Idaho",,1,0.265
125,13699,711670212928544768,RT @MicMej231997: The Bernie Sanders campaign is literally a presidential campaign run #ByThePeople!,5,0,Twitter Web Client,2016-03-20 21:46:15,707311380936806400,DanielleIsHappy,Danielle Pimentel,2016-03-08 21:05:49,"#Bernie2016 24 year old student at University of Idaho. I'm very passionate about the environment, politics, animals... and being happy (most of the time).",535,1046,"Idaho, USA",,1,0.265
126,14325,711668472007172096,#ByThePeople Video of Bernie Sanders Predicting His 2016 Campaign Is Going Viral https://t.co/68P012iMr6,0,0,Twitter Web Client,2016-03-20 21:39:20,707311380936806400,DanielleIsHappy,Danielle Pimentel,2016-03-08 21:05:49,"#Bernie2016 24 year old student at University of Idaho. I'm very passionate about the environment, politics, animals... and being happy (most of the time).",535,1046,"Idaho, USA",,1,0.265
127,14549,711667867696046080,"RT @davlinnews: Can't make it to the Boise rally Monday? Susan Sarandon is campaigning for @BernieSanders today. 3 pm, Sanders HQ, 280 N 8t…",3,0,Twitter for iPhone,2016-03-20 21:36:56,17175610,quinnperry,Quinn Perry,2008-11-05 01:13:46,"Communication/Lobbying with @IdTLA. Views expressed are mine and not @IdTLA. Me: outdoors, equality, politics, travel, cooking, music, writing, and flyfishing.",265,416,"Boise, Idaho",Mountain Time (US & Canada),0,1.0
128,15368,711665757948502017,"RT @davlinnews: Can't make it to the Boise rally Monday? Susan Sarandon is campaigning for @BernieSanders today. 3 pm, Sanders HQ, 280 N 8t…",3,0,Twitter Web Client,2016-03-20 21:28:33,38621006,SamSandmire,Sam Sandmire,2009-05-08 06:32:07,"I love/live to ski  & be outdoors - wife, mom, former college gymnastics coach (Boise State), freeski fan, fun lover, progressive activist, hiker, dog lover.",793,1444,"Boise, Idaho",Mountain Time (US & Canada),0,1.0
129,16076,711663647043391492,"Actress Susan Sarandon speaks on Bernie Sanders as ""refreshing"" and ""the lesser of two evils"" in Boise @KBOITV https://t.co/RkiST54IsD",16,14,Twitter for iPhone,2016-03-20 21:20:10,3255048247,KaylaCashKBOI,Kayla Cash,2015-06-24 23:16:34,News Junkie • Idaho Vandal • Social Media Producer for @KBOITV • Insta@kboi2news Opinions➡️my own • Personal account: @kaylacash1234,263,824,"Idaho, USA",Pacific Time (US & Canada),0,1.0
130,16471,711662654960500736,RT @LouisianaBernie: Crowd waiting in line for Bernie Sanders' Rally in Seattle! #ByThePeople https://t.co/ag4FKhHqI3,232,0,Twitter Web Client,2016-03-20 21:16:13,707311380936806400,DanielleIsHappy,Danielle Pimentel,2016-03-08 21:05:49,"#Bernie2016 24 year old student at University of Idaho. I'm very passionate about the environment, politics, animals... and being happy (most of the time).",537,1046,"Idaho, USA",,1,0.265
131,19964,711653711861264384,"RT @BernieSanders: We don't need a bigger wall or more barbed wire. We need a humane immigration policy that keeps families together. 
http…",1409,0,Twitter for iPhone,2016-03-20 20:40:41,629529046,PaulKemp76,Paul Kemp,2012-07-07 17:57:03,Law abiding happy go lucky American,112,710,Idaho,Central Time (US & Canada),0,1.0
132,20330,711652619136008198,RT @RawStory: Amy Goodman rips CNN for airing Trump’s empty stage instead of Sanders’ speech https://t.co/ILAtnDisHV https://t.co/OF6HKX5RBU,118,0,Twitter Web Client,2016-03-20 20:36:20,242903028,JaeKar99,ASH: Jason,2011-01-25 21:27:07,"Strong Advocate for Atheism, Anti-Theist, Secular Recovering Alcoholic, Humility or Prison is in your future.",1521,2128,Living in my own private Idaho,Mountain Time (US & Canada),0,1.0
133,20790,711651204246278144,"RT @RevoltPolitic: ""Bernie Sanders deserves the support of everyone who favors social and economic justice"" - Danny Glover https://t.co/yRz…",287,0,Tweetbot for iΟS,2016-03-20 20:30:43,40742421,CarlNorman,Carl Norman,2009-05-17 21:36:46,"I support the #ACLU, #AmnestyInternational, peace, human rights, and #Bernie2016. I have a lifelong interest in philosophy.",14827,14347,"Nampa, Idaho",Mountain Time (US & Canada),0,1.0
134,23345,711644043025850368,"RT @Nfahre: Hillary Clinton, Bernie Sanders, and Donald Trump were on a boat. The boat sank. Who survived? &gt;America.",237,0,Twitter for Android,2016-03-20 20:02:16,48179484,AshleyBudden,Ashley,2009-06-18 00:32:29,,121,415,Idaho,Pacific Time (US & Canada),0,1.0
135,23533,711643416384249856,Pretty excited to hear Bernie Sanders speak tomorrow in Boise. Hoping to get some great photos. #BernieOrBust #AnyoneButHillary,0,2,Twitter Web Client,2016-03-20 19:59:46,2321106451,nroslm,Drew,2014-01-31 17:08:54,On the Oregon Coast born and raised. On the beach is where I spent most of my days...,749,1028,Pacific Northwest (Idaho),Mountain Time (US & Canada),2,0.127
136,24067,711641817876471813,"Boo for #KFC for messin' with the history of Colonel Sanders. Enuff already, #normmcdonald is… https://t.co/lHR36PR6lL",0,0,Instagram,2016-03-20 19:53:25,94135321,BoiseInsure,Mark Nielebeck,2009-12-02 17:40:05,Comprehensive Insurance solutions at the best possible prices.,235,331,"Idaho, Oregon, and California",Mountain Time (US & Canada),2,0.127
137,24367,711640891992113157,RT @DNewsPolitics: New Deseret News/KSL poll: Utahns would vote for Clinton or Sanders over Trump https://t.co/Eo6E5s6fJP #utpol https://t.…,13,0,Twitter for iPad,2016-03-20 19:49:44,31037741,PhilCampbell6,Phil Campbell,2009-04-14 02:47:51,TV and PR professional currently working for Bonneville Joint School District 93.,343,165,"Idaho Falls, Idaho",Pacific Time (US & Canada),1,0.265
138,26159,711635883351543808,I will be at the Taco Bell Arena for the Bernie Sanders rally at 5am. Anyone is welcomed to join me.... https://t.co/6ojve3TFzU,0,0,Facebook,2016-03-20 19:29:50,415937200,ManFred1701,Manny Herrera,2011-11-19 01:02:38,Manuel Herrera •Boise State University •Marketing & Business Management •President of Bronco Lovers United •Marketing Intern for Sorrentos,516,886,"Boise, Idaho",America/Boise,0,1.0
139,26313,711635446854508544,RT @MrDane1982: Bernie Sanders Was No 'Pioneer' On Same-Sex Marriage  https://t.co/IgpyHu8XFh https://t.co/a0ukrmXLD2,15,0,Buffer,2016-03-20 19:28:06,4794182534,WeNeedHillary,Progressive Man,2016-01-21 17:36:10,#Hillary2016 #ImWithHer #HillYes #ShesWithUs #UniteBlue #TopProg #LibCrib #p2 #PDmfnb #Obama #GunSense #StandwithPP #TNTweeters,5261,5377,"Idaho, USA",Pacific Time (US & Canada),0,1.0
140,26376,711635329187336192,"Can't make it to the Boise rally Monday? Susan Sarandon is campaigning for @BernieSanders today. 3 pm, Sanders HQ, 280 N 8th Street. #idpol",3,4,TweetDeck,2016-03-20 19:27:38,87532454,davlinnews,Melissa Davlin,2009-11-04 21:04:47,"Co-host, @idahoreports, Idaho Public Television. Also, @theppppod. Politics, news, Idaho, etc.",3641,1106,"Idaho, USA",Pacific Time (US & Canada),1,0.265
141,26905,711633782747475968,"RT @virginia4bernie: If Trump=GOP nominee, Utah goes blue in Nov:
🔷 Hillary beats him by 2%
🔶 Bernie WALLOPS him by 11% 
#bythepeople
https…",256,0,Twitter Web Client,2016-03-20 19:21:29,707311380936806400,DanielleIsHappy,Danielle Pimentel,2016-03-08 21:05:49,"#Bernie2016 24 year old student at University of Idaho. I'm very passionate about the environment, politics, animals... and being happy (most of the time).",536,1045,"Idaho, USA",,1,0.265
142,27380,711632364527443968,RT @LouisianaBernie: Bernie Sanders. #ByThePeople https://t.co/QqocntDBmB,21,0,Twitter Web Client,2016-03-20 19:15:51,707311380936806400,DanielleIsHappy,Danielle Pimentel,2016-03-08 21:05:49,"#Bernie2016 24 year old student at University of Idaho. I'm very passionate about the environment, politics, animals... and being happy (most of the time).",536,1045,"Idaho, USA",,1,0.265
143,27766,711631262985773057,RT @WI4Bernie: Amy Goodman Blasts CNN for Airing Trump’s Empty Stage Instead of Sanders’ Speech https://t.co/UnEFEWYMYP #FeelTheBern,49,0,Twitter Web Client,2016-03-20 19:11:29,707311380936806400,DanielleIsHappy,Danielle Pimentel,2016-03-08 21:05:49,"#Bernie2016 24 year old student at University of Idaho. I'm very passionate about the environment, politics, animals... and being happy (most of the time).",536,1045,"Idaho, USA",,1,0.265
144,27883,711630949750951937,"RT @BernieSanders: We don't need a bigger wall or more barbed wire. We need a humane immigration policy that keeps families together. 
http…",1412,0,Twitter Web Client,2016-03-20 19:10:14,707311380936806400,DanielleIsHappy,Danielle Pimentel,2016-03-08 21:05:49,"#Bernie2016 24 year old student at University of Idaho. I'm very passionate about the environment, politics, animals... and being happy (most of the time).",536,1045,"Idaho, USA",,0,1.0
145,29256,711627141281030144,RT @truthtotweet: .@hermanbutler1 RT! #BernieInVancouver LIVE 1 pm PT https://t.co/wSWGFWhswN OR https://t.co/UmxvbX6OKq RT! #StillSanders …,3,0,Twitter Web Client,2016-03-20 18:55:06,707311380936806400,DanielleIsHappy,Danielle Pimentel,2016-03-08 21:05:49,"#Bernie2016 24 year old student at University of Idaho. I'm very passionate about the environment, politics, animals... and being happy (most of the time).",536,1045,"Idaho, USA",,2,0.127
146,30748,711623441288286208,"Why the Rise of Trump, Cruz and Sanders Is the Logical Result of the 1% Not Paying Taxes @alternet https://t.co/yYT2XTIFiY",0,0,Twitter Web Client,2016-03-20 18:40:24,236149457,IdahoIndependen,IdahoIndependent,2011-01-09 22:47:45,I am an Independent who believes in President Obama.The Supreme Court is too important to elect a Republican.The Republican party has lost it's way.,1366,1839,"Boise, Idaho",,0,1.0
147,30836,711623226233741313,"Why the Rise of Trump, Cruz and Sanders Is the Logical Result of the 1% Not Paying Taxes @alternet https://t.co/FK1B5DssAy",0,0,Twitter Web Client,2016-03-20 18:39:33,236149457,IdahoIndependen,IdahoIndependent,2011-01-09 22:47:45,I am an Independent who believes in President Obama.The Supreme Court is too important to elect a Republican.The Republican party has lost it's way.,1366,1839,"Boise, Idaho",,0,1.0
148,32563,711618754874974208,RT @lavenderblue27: Bernie Sanders Supporters Raise $4 Million In 3 Days To Keep Political Revolution Growing https://t.co/1AD2zHWY33,3,0,Twitter Web Client,2016-03-20 18:21:47,707311380936806400,DanielleIsHappy,Danielle Pimentel,2016-03-08 21:05:49,"#Bernie2016 24 year old student at University of Idaho. I'm very passionate about the environment, politics, animals... and being happy (most of the time).",536,1045,"Idaho, USA",,0,1.0
149,34039,711614838137487361,RT @truthtotweet: .@ENIgnacio RT!! #BernieInVancouver starts at 1 pm PT Watch it here: https://t.co/wSWGFWhswN OR here: https://t.co/UmxvbX…,11,0,Twitter Web Client,2016-03-20 18:06:13,707311380936806400,DanielleIsHappy,Danielle Pimentel,2016-03-08 21:05:49,"#Bernie2016 24 year old student at University of Idaho. I'm very passionate about the environment, politics, animals... and being happy (most of the time).",536,1045,"Idaho, USA",,1,0.265
150,34782,711612938671423489,RT @steveaoki: I'm with Bernie Sanders. He's got my vote. #feelthebern #MakeDonaldDrumpfAgain https://t.co/ErmOco3apa,769,0,Twitter Web Client,2016-03-20 17:58:40,707311380936806400,DanielleIsHappy,Danielle Pimentel,2016-03-08 21:05:49,"#Bernie2016 24 year old student at University of Idaho. I'm very passionate about the environment, politics, animals... and being happy (most of the time).",536,1045,"Idaho, USA",,2,0.127
151,35147,711612128520634368,RT @cidelson: Hear why Rep. Tulsi Gabbard says @BernieSanders best candidate for veterans' health care https://t.co/BSkNzwtbu9 https://t.co…,22,0,Twitter Web Client,2016-03-20 17:55:27,707311380936806400,DanielleIsHappy,Danielle Pimentel,2016-03-08 21:05:49,"#Bernie2016 24 year old student at University of Idaho. I'm very passionate about the environment, politics, animals... and being happy (most of the time).",536,1045,"Idaho, USA",,0,1.0
152,35312,711611764434034688,"RT @PhillyForBernie: Under President Sanders - Median income would soar by more than $22,000!! https://t.co/dP9QsiCWsX #bythepeople #Bernie…",120,0,Twitter Web Client,2016-03-20 17:54:00,707311380936806400,DanielleIsHappy,Danielle Pimentel,2016-03-08 21:05:49,"#Bernie2016 24 year old student at University of Idaho. I'm very passionate about the environment, politics, animals... and being happy (most of the time).",536,1045,"Idaho, USA",,2,0.127
153,36118,711610150478434304,RT @IdahoStatesman: Here's what to know if you want to see Bernie Sanders in Boise on Monday: https://t.co/uetDwoyvFx #idpol https://t.co/p…,12,0,Twitter for iPhone,2016-03-20 17:47:35,22116472,KatyMoeller,Katy Moeller,2009-02-27 06:52:51,"Oregon Duck. Newspaper reporter. Sports fanatic. Animal lover. Boundless curiosity. Huge fan of Colbert. Night owl. I live in Boise, and I've gone native.",3364,3955,"Boise, Idaho",Mountain Time (US & Canada),1,0.265
154,36479,711609374267977729,"RT @BernieSanders: We don't need a bigger wall or more barbed wire. We need a humane immigration policy that keeps families together. 
http…",1412,0,Twitter for Android,2016-03-20 17:44:30,963669578,feliciaofoz,Felicia Ozuna,2012-11-22 05:20:52,"We live in a random and chaotic universe.
@OFAcademy cosmetology student",1193,1261,"Idaho, USA",Arizona,0,1.0
155,38085,711605651219288064,RT @TheresaSchroe14: USCITs agree with @BernieSanders #Arizona #Utah #Idaho Vote Sanders! #OfThePeople  https://t.co/3D6z8wDFOb,4,0,RoundTeam,2016-03-20 17:29:42,3473446641,IdahoLovers,Idaho Lover,2015-08-28 21:24:28,"#Idaho Lover. For all things in and about Idaho USA. Eat, drink, chat, tweet and date in Idaho. #FreeDatingInIdaho",851,502,"Idaho, USA",Pacific Time (US & Canada),4,0.033
156,38496,711604547798446080,"RT @RevoltPolitic: ""Of course I support Bernie Sanders, without hesitation!"" - Thomas Piketty https://t.co/hmM6SazA0l",485,0,Twitter Web Client,2016-03-20 17:25:19,707311380936806400,DanielleIsHappy,Danielle Pimentel,2016-03-08 21:05:49,"#Bernie2016 24 year old student at University of Idaho. I'm very passionate about the environment, politics, animals... and being happy (most of the time).",536,1045,"Idaho, USA",,0,1.0
157,38519,711604477669695488,"RT @Libertea2012: The DNC is corrupt, @DWStweets must go! Support Bernie Sanders #FeelTheBern #UniteBlue #1u https://t.co/SiD0ivpEec https:…",13,0,Twitter Web Client,2016-03-20 17:25:03,707311380936806400,DanielleIsHappy,Danielle Pimentel,2016-03-08 21:05:49,"#Bernie2016 24 year old student at University of Idaho. I'm very passionate about the environment, politics, animals... and being happy (most of the time).",536,1045,"Idaho, USA",,3,0.063
158,41490,711596361133662208,RT @kateloving: Sanders Voters in MA 2 Sue Bill Clinton 4 Illegal Electioneering on Primary Day - Seek Delegates be Awarded 2 Bernie https:…,130,0,Twitter Web Client,2016-03-20 16:52:47,707311380936806400,DanielleIsHappy,Danielle Pimentel,2016-03-08 21:05:49,"#Bernie2016 24 year old student at University of Idaho. I'm very passionate about the environment, politics, animals... and being happy (most of the time).",536,1045,"Idaho, USA",,0,1.0
159,42959,711592340356378626,@stevenoh88 I just wonder if we're on a wild goose chase now.  The math has become steep for Sanders.,0,0,Twitter Web Client,2016-03-20 16:36:49,39100089,jamenta,John Amenta,2009-05-10 19:51:17,Former software engineer at Cape Canaveral. Worked on  CLCS project - space shuttle NASA.,1198,531,"Idaho Falls, ID",Mountain Time (US & Canada),0,1.0
160,43934,711589580244320256,"RT @Taniel: Unbelievable poll of Utah, which Romney won 73-25: It has Kasich/Cruz up 20-30%—but Trump trailing Clinton/Sanders! 
https://t.…",84,0,Twitter for iPhone,2016-03-20 16:25:51,379962842,billpostmus,Bill Postmus,2011-09-25 21:06:15,"Former elected official & GOP chair. Musings on world, nat'l & state politics. Supporter of @Israel, @JesusShow , & Friend of Bill W. RT's are not endorsements.",124117,134930,California & Idaho,Pacific Time (US & Canada),0,1.0
161,44235,711588762866880514,Sanders Voters in MA toSueBillClinton for Illegal Electioneering on Primary Day -Seek Delegates be Awarded to Bernie https://t.co/SbDDa7PMvL,6,7,Linkis.com,2016-03-20 16:22:36,2881946306,gonzosmom,Jen B,2014-10-29 10:42:21,chronic pain patient for 12+ years. It turns your life upside down. Bernie Sanders the ONLY authentic politician/person running for President. #FeelTheBern,450,1421,Almost Idaho,Eastern Time (US & Canada),0,1.0
162,45936,711584278828560384,RT @KREM2: Presidential candidate @BernieSanders is visiting Spokane today. More info on the rally: https://t.co/rLy3aJYeU2,5,0,Twitter for iPhone,2016-03-20 16:04:47,1088135228,rantronolopolis,Randaho,2013-01-14 05:52:23,Vandal & FIJI | Stressed but Blessed | Insta: randatronolopolis | SC: randaytron_bro,587,555,"the dirty scow, idaho",Pacific Time (US & Canada),0,1.0
163,46486,711582489983242240,"REALITY: Bernie Sanders Accomplished Almost NOTHING WHILE SERVING FOR YEARS https://t.co/RaaBkW7QtE
#ShesWithUs https://t.co/oPY6hlOxsg",61,58,Buffer,2016-03-20 15:57:40,4794182534,WeNeedHillary,Progressive Man,2016-01-21 17:36:10,#Hillary2016 #ImWithHer #HillYes #ShesWithUs #UniteBlue #TopProg #LibCrib #p2 #PDmfnb #Obama #GunSense #StandwithPP #TNTweeters,5272,5410,"Idaho, USA",Pacific Time (US & Canada),1,0.265
164,46873,711581070601228289,".@maatkare67 @ToConservatives @9kittens 
https://t.co/Xox92gUcIU
Sanders accomplished VERY LITTLE in Congress.",3,6,Twitter Web Client,2016-03-20 15:52:02,4794182534,WeNeedHillary,Progressive Man,2016-01-21 17:36:10,#Hillary2016 #ImWithHer #HillYes #ShesWithUs #UniteBlue #TopProg #LibCrib #p2 #PDmfnb #Obama #GunSense #StandwithPP #TNTweeters,5272,5410,"Idaho, USA",Pacific Time (US & Canada),0,1.0
165,48009,711577218305101824,"Awesome video of Boise bringing the Bern! 
Via Idaho Women for Bernie Sanders
#stillsanders
#boiseforbernie https://t.co/HfeqwVDUAJ",1,1,Facebook,2016-03-20 15:36:43,32247084,BoiseForBernie,Diane Dalton,2009-04-17 01:44:18,Vote for Bernie Sanders,72,94,"Boise, Idaho",Mountain Time (US & Canada),2,0.127
166,49941,711570310403727360,"RT @HotakainenRob: Clinton, Sanders united on global warming, divided on #nuclear energy https://t.co/qJZYXyRqsO",2,0,Twitter for Android,2016-03-20 15:09:16,39647626,whmanny,Bill Manny,2009-05-13 01:01:51,"Hiker, backpacker, peak-bagger, cyclist, dad, husband, uncle, son and newspaper editor.",578,468,"Boise, Idaho, USA",Mountain Time (US & Canada),1,0.265
167,574,712064961573490696,WATCH LIVE AT 6: Sen. Bernie Sanders in Boise + the latest on a multi-vehicle car crash:https://t.co/D79tzmFRQ2 https://t.co/9vFmJrmRO1,0,0,Twitter Web Client,2016-03-21 23:54:51,549411147,IdahoOnYourSide,6 On Your Side,2012-04-09 15:48:54,"New, Now and Next",4569,1635,"Boise, Idaho",Mountain Time (US & Canada),0,1.0
168,1720,712062306973306881,"RT @PredictIt_: #Sanders leading #Idaho, but @HilaryClinton holds huge lead in Democratic nomination market. https://t.co/acStFcWEX5 https:…",25,0,RoundTeam,2016-03-21 23:44:18,3473446641,IdahoLovers,Idaho Lover,2015-08-28 21:24:28,"#Idaho Lover. For all things in and about Idaho USA. Eat, drink, chat, tweet and date in Idaho. #FreeDatingInIdaho",850,502,"Idaho, USA",Pacific Time (US & Canada),2,0.127
169,2048,712061580712615936,"RT @democracynow: Amy Goodman Tells CNN the Media is ""Manufacturing Consent"" for Trump While Silencing Sanders https://t.co/QWXmaE7nkr http…",464,0,Twitter Web Client,2016-03-21 23:41:24,707311380936806400,DanielleIsHappy,Danielle Pimentel,2016-03-08 21:05:49,"#Bernie2016 24 year old student at University of Idaho. I'm very passionate about the environment, politics, animals... and being happy (most of the time).",537,1045,"Idaho, USA",,0,1.0
170,2923,712059709163896832,RT @MMFlint: Youth vote for Sanders is double the youth vote for Clinton and Trump COMBINED. https://t.co/4dtnuju1iO,2746,0,Twitter Web Client,2016-03-21 23:33:58,50087957,ezrasace,ezrasace,2009-06-23 20:15:30,We are drowning in information but starved for knowledge. - John Naisbitt,386,140,Idaho,Mountain Time (US & Canada),0,1.0
171,4635,712055613254148096,Bernie Sanders Introduces Legislation to End Federal Ban on Marijuana https://t.co/huxj3pbgnQ,0,1,Hootsuite,2016-03-21 23:17:42,1390949336,Progress_Sieve,Arthur Galus,2013-04-30 02:14:55,"Old Hippie, the furtherest feather on the left wing, Catholic, Grandparent, still on my journey, keeping on 'keeping on'",1462,1452,"Boise, Idaho",Mountain Time (US & Canada),0,1.0
172,5012,712054758585065472,VIDEO: We spoke with a few Bernie Sanders supporters at today's rally. What do you think of the candidate? https://t.co/IREOS2BeqG,1,3,Idaho Press-Tribune IPT,2016-03-21 23:14:18,18087829,IdahoPressTrib,Idaho Press-Tribune,2008-12-12 22:32:41,Official Twitter account for the Idaho Press-Tribune,13703,6388,"Nampa, Idaho",Mountain Time (US & Canada),0,1.0
173,5688,712053191139983360,@MiaFarrow Sanders wasn't involved.,0,0,Twitter Web Client,2016-03-21 23:08:04,39100089,jamenta,John Amenta,2009-05-10 19:51:17,Former software engineer at Cape Canaveral. Worked on  CLCS project - space shuttle NASA.,1199,531,"Idaho Falls, ID",Mountain Time (US & Canada),0,1.0
174,5986,712052412958126080,Sanders rallies supporters during Boise campaign stop - KTVB https://t.co/Blyn7GFGSM,0,0,twitterfeed,2016-03-21 23:04:59,27976939,boisenews,Boise Idaho News,2009-03-31 22:11:13,Boise Idaho News,2479,1522,Boise Idaho,Mountain Time (US & Canada),0,1.0
175,5987,712052409732718592,Thousands Flock to Boise State to See Presidential Hopeful Sanders Speak - Boise Weekly https://t.co/36ewAYexF6,0,0,twitterfeed,2016-03-21 23:04:58,27976939,boisenews,Boise Idaho News,2009-03-31 22:11:13,Boise Idaho News,2479,1522,Boise Idaho,Mountain Time (US & Canada),0,1.0
176,6056,712052289188532224,RT @Chlodoll: Bernie Sanders is an amazing speaker. So worth it,1,0,Twitter for iPhone,2016-03-21 23:04:29,415937200,ManFred1701,Manny Herrera,2011-11-19 01:02:38,Manuel Herrera •Boise State University •Marketing & Business Management •President of Bronco Lovers United •Marketing Intern for Sorrentos,515,886,"Boise, Idaho",America/Boise,0,1.0
177,7332,712049157108682753,"RT @DannyEFreeman: On Syria, Sanders said that ""those who advocate for stronger military involvement…have not paid close enough attention t…",43,0,Twitter Web Client,2016-03-21 22:52:02,707311380936806400,DanielleIsHappy,Danielle Pimentel,2016-03-08 21:05:49,"#Bernie2016 24 year old student at University of Idaho. I'm very passionate about the environment, politics, animals... and being happy (most of the time).",537,1045,"Idaho, USA",,0,1.0
178,7446,712048930792415233,"RT @mutealbino: Bernie Sanders Has A Clear Path To Victory #ForThePeople
https://t.co/nrOXNnYlym",1,0,Twitter Web Client,2016-03-21 22:51:08,707311380936806400,DanielleIsHappy,Danielle Pimentel,2016-03-08 21:05:49,"#Bernie2016 24 year old student at University of Idaho. I'm very passionate about the environment, politics, animals... and being happy (most of the time).",537,1045,"Idaho, USA",,1,0.265
179,7850,712047997899542528,"RT @IdahoStatesman: @WPJohnWagner @rockybarker You've been quoted in my #Storify story ""Bernie Sanders draws crowd to Boise rally"" https://…",1,0,Twitter for Android,2016-03-21 22:47:26,16982540,rockybarker,Rocky Barker,2008-10-26 16:54:38,"Author,Scorched Earth, producer, Firestorm Last Stand In Yellowstone, blogger, columnist, reporter with Idaho Statesman. On team that was Pulitzer finalist.",2465,335,"Boise, Idaho",Mountain Time (US & Canada),1,0.265
180,8791,712045984117886978,"RT @LiberalLaTchr: Bernie Sanders is the only candidate truly of, by and #ForThePeople https://t.co/EioZXN0mU1",16,0,Twitter Web Client,2016-03-21 22:39:26,707311380936806400,DanielleIsHappy,Danielle Pimentel,2016-03-08 21:05:49,"#Bernie2016 24 year old student at University of Idaho. I'm very passionate about the environment, politics, animals... and being happy (most of the time).",537,1045,"Idaho, USA",,1,0.265
181,9099,712045310609121280,"RT @DailyNewsBin: Supporting Hillary Clinton is the best shot fans of Bernie Sanders have of achieving their goals

https://t.co/jErrXeh3oR",25,0,Twitter Web Client,2016-03-21 22:36:45,236149457,IdahoIndependen,IdahoIndependent,2011-01-09 22:47:45,I am an Independent who believes in President Obama.The Supreme Court is too important to elect a Republican.The Republican party has lost it's way.,1365,1839,"Boise, Idaho",,0,1.0
