,Unnamed: 0,tweetID,tweetText,tweetRetweetCt,tweetFavoriteCt,tweetSource,tweetCreated,userID,userScreen,userName,userCreateDt,userDesc,userFollowerCt,userFriendsCt,userLocation,userTimezone,tweetHashtagCt,Weight
247,31066,711988305353510912,Boise is feeling the Bern today https://t.co/hdKlllI51z #Sanders #Bernie #Election2016 #BoiseState https://t.co/AH93psaBUR,0,3,Twitter Web Client,2016-03-21 18:50:14,22116472,KatyMoeller,Katy Moeller,2009-02-27 06:52:51,"Oregon Duck. Newspaper reporter. Sports fanatic. Animal lover. Boundless curiosity. Huge fan of Colbert. Night owl. I live in Boise, and I've gone native.",3364,3955,"Boise, Idaho",Mountain Time (US & Canada),4,0.033
248,31102,711988245798621185,RT @berniesanders_1: Media Silent as Bernie Sanders Packs Seattle Arena Beyond Capacity (VIDEO) https://t.co/0dBS7Ok1b0 #StillSanders #Medi…,2,0,Twitter Web Client,2016-03-21 18:50:00,707311380936806400,DanielleIsHappy,Danielle Pimentel,2016-03-08 21:05:49,"#Bernie2016 24 year old student at University of Idaho. I'm very passionate about the environment, politics, animals... and being happy (most of the time).",538,1048,"Idaho, USA",,2,0.127
249,31472,711987296027828224,"Eye on Boise: Bernie Sanders rallies cheering Boise crowd, bashes 'billionaires buying elections' https://t.co/PVHMynqvcy #idpol",0,1,Twitter Web Client,2016-03-21 18:46:14,44360214,BetsyZRussell,Betsy Z. Russell,2009-06-03 13:41:11,,5722,320,"Boise, Idaho",Mountain Time (US & Canada),1,0.265
250,31757,711986648813154304,Bernie Sanders has brought his message of socialism to Boise. But does his message line up with Idahoans' values? https://t.co/d4bDorlmTE,3,6,Twitter Web Client,2016-03-21 18:43:39,24190626,IdahoGOP,Idaho GOP,2009-03-13 15:36:44,Official twitter page of the Idaho Republican Party. We're on on Facebook at: https://t.co/bEEB5NQsuD. Election info/resources: https://t.co/z1W5yhwxx6,4712,2485,Idaho,Mountain Time (US & Canada),0,1.0
251,31842,711986500674564096,"Sanders said America's incarceration rate is ""nuts."" ""It is a better investment to send a kid to the University of Idaho than to jail.""",0,3,Twitter for Android,2016-03-21 18:43:04,381833291,HollyBeechMP,Holly Beech,2011-09-29 01:04:29,"Meridian Press reporter with Idaho Press-Tribune, covering local city, school, business and community news. NNU grad, studied journalism, history and Spanish.",1286,922,"Nampa, Idaho",Mountain Time (US & Canada),0,1.0
252,31844,711986499001036800,"""Sometimes, when people stand up for too long and don't get water, they have trouble standing""- Bernie Sanders",0,3,Twitter for iPhone,2016-03-21 18:43:04,40985564,MTWiggins4,Matt Wiggins,2009-05-18 22:25:22,mc'scuse me bitch,242,205,Idaho,Mountain Time (US & Canada),0,1.0
253,32059,711985931448766465,"Sen. Sanders ""it's time to rethink the so called war on drugs"" @BernieSanders https://t.co/dBgiLfo8bP",0,1,Twitter for iPhone,2016-03-21 18:40:48,549411147,IdahoOnYourSide,6 On Your Side,2012-04-09 15:48:54,"New, Now and Next",4572,1635,"Boise, Idaho",Mountain Time (US & Canada),0,1.0
254,32090,711985870694264832,".@Ryan_NWMP on #Periscope: Bernie sanders rally Boise, ID https://t.co/DDFwaSAfBN",0,0,Twitter for iPhone,2016-03-21 18:40:34,4064749619,wyattwall341,csgotrades,2015-10-29 02:17:30,cs:go trader and more will buy any skin off of you!!!!,60,180,"Idaho, USA",,1,0.265
255,32178,711985672718929922,Sen. Sanders calls for demilitarization of police departments https://t.co/ghehV52tkh,0,2,Twitter for iPhone,2016-03-21 18:39:47,549411147,IdahoOnYourSide,6 On Your Side,2012-04-09 15:48:54,"New, Now and Next",4572,1635,"Boise, Idaho",Mountain Time (US & Canada),0,1.0
256,32250,711985492368052224,"Bernie Sanders says about today's large crowd: ""I thought I'd walked into the wrong state - I was told Idaho was a conservative state.""",1,2,Twitter for Android,2016-03-21 18:39:04,381833291,HollyBeechMP,Holly Beech,2011-09-29 01:04:29,"Meridian Press reporter with Idaho Press-Tribune, covering local city, school, business and community news. NNU grad, studied journalism, history and Spanish.",1286,922,"Nampa, Idaho",Mountain Time (US & Canada),0,1.0
257,32354,711985218433867777,Sen. Sanders calls out police over recent shootings of unarmed African Americans. @BernieSanders https://t.co/7PeQYHqedT,1,1,Twitter for iPhone,2016-03-21 18:37:58,549411147,IdahoOnYourSide,6 On Your Side,2012-04-09 15:48:54,"New, Now and Next",4572,1635,"Boise, Idaho",Mountain Time (US & Canada),0,1.0
258,32380,711985141128646656,"LIVE on #Periscope: Bernie sanders rally Boise, ID https://t.co/h0D00cZYiJ",1,1,Periscope,2016-03-21 18:37:40,401057337,Ryan_NWMP,Ryan Oswald,2011-10-30 00:12:14,,59,157,Boise Idaho,Mountain Time (US & Canada),1,0.265
259,32627,711984575186997248,"RT @ElizLanders: Sanders guesses that, ""vast majority of conservatives in Idaho believe that current campaign finance laws make no sense.""",15,0,Twitter for iPhone,2016-03-21 18:35:25,422089163,AbelNunez_17,Abel Nunez Jr.,2011-11-26 20:02:10,"22 Faith, family and time. 1Timothy4:12 21! #AKPsi #Baseballism ⚾️ Founder of LVPnow blog. #BeatDepression #LVPnow https://t.co/CD3N8gBwiu",223,709,"Idaho Falls, Idaho ",Arizona,0,1.0
260,32631,711984572561539072,"RT @WayneEdH: Sally Field on Bernie Sanders: 'He's losing his decency'
#StepDownBernie
#ImWithHer
#AZPrimary #UTPrimary #IDPrimary
https://…",82,0,Buffer,2016-03-21 18:35:24,4794182534,WeNeedHillary,Progressive Man,2016-01-21 17:36:10,#Hillary2016 #ImWithHer #HillYes #ShesWithUs #UniteBlue #TopProg #LibCrib #p2 #PDmfnb #Obama #GunSense #StandwithPP #TNTweeters,5296,5411,"Idaho, USA",Pacific Time (US & Canada),5,0.018
261,32726,711984352993742848,"Senator Sanders promising an economy that ""works for everyone not just the 1%."" https://t.co/jKeqIJinT2",10,14,Twitter for iPhone,2016-03-21 18:34:32,549411147,IdahoOnYourSide,6 On Your Side,2012-04-09 15:48:54,"New, Now and Next",4572,1635,"Boise, Idaho",Mountain Time (US & Canada),0,1.0
262,32803,711984132482445313,"RT @ConsultReid: Total employees by campaign:
Sanders 865
Clinton 765
Trump 94
Cruz 88
Kasich 40
https://t.co/Cmf8Ar5mzN",231,0,Twitter for iPhone,2016-03-21 18:33:39,379962842,billpostmus,Bill Postmus,2011-09-25 21:06:15,"Former elected official & GOP chair. Musings on world, nat'l & state politics. Supporter of @Israel, @JesusShow , & Friend of Bill W. RT's are not endorsements.",124133,134947,California & Idaho,Pacific Time (US & Canada),0,1.0
263,33108,711983382339555328,RT @politics4667: Sanders campaign seems unwilling to meet with press in Boise https://t.co/PRZ46vlQ3L #IDCaucus #UTCaucus #AZPrimary #imwi…,7,0,TweetDeck,2016-03-21 18:30:41,138611280,9voltDC,James  Wells,2010-04-30 01:44:25,"Fauxtographer, Cinematography nerd, Macintosh aficionado, Coffee addict...",246,140,"Nampa, Idaho",Central Time (US & Canada),4,0.033
264,33626,711982140850737152,"An excellent point-by-point speech by Sen. Sanders. Democracy, economic corruption, oligarchy. Stringent! #BernieInBoise",0,0,Twitter for Android,2016-03-21 18:25:45,290638522,kencf0618,Kenneth Freeman,2011-04-30 16:42:16,"Ingress, EFF, ECUSA, INFJ. Roller derby fan. Wikipedian. Runs @torproject relays. Severely deaf middle-aged nerd & life skills manqué. PGP upon request.",602,711,"Boise, Idaho",Mountain Time (US & Canada),1,0.265
265,33734,711981885837021184,Senator Sanders accuses GOP Governors of suppressing the vote.  @ButchOtter,0,1,Twitter for iPhone,2016-03-21 18:24:44,549411147,IdahoOnYourSide,6 On Your Side,2012-04-09 15:48:54,"New, Now and Next",4572,1635,"Boise, Idaho",Mountain Time (US & Canada),0,1.0
266,34219,711980767404904449,some girl behind Bernie Sanders just dabbed,0,3,Twitter for iPhone,2016-03-21 18:20:17,2271015547,OliviaBradshaww,Olivia Bradshaw,2014-01-01 01:17:00,Idaho ASA Fastpitch Travel Softball&Volleyball Sophomore at MMACHS • Sports for MVHS Training everyday #otf #athlete #varsity,225,176,Idaho,Pacific Time (US & Canada),0,1.0
267,34267,711980631819812865,Welcome to Boise Senator Sanders! @boisestatelive https://t.co/gJz2KhjMIy,3,3,Tweetbot for iΟS,2016-03-21 18:19:45,373594810,AliciaGarza_,Alicia Garza,2011-09-14 21:36:43,"assoc. prof, Boise State U • Fat Nepantlera • writer of corridos • neophyte filmmaker • into Xicana lit, digital humanities, Chicano/a sci fi, Fat Studies",101,140,"Boise, Idaho",Mountain Time (US & Canada),0,1.0
268,34300,711980571409256448,"RT @GuerrillaDems: How Bernie Sanders Bridged a Generational Divide https://t.co/HnP24XVIUz

#WeAreBernie #Hillary2016 #LibCrib https://t.c…",45,0,Twitter Web Client,2016-03-21 18:19:30,707311380936806400,DanielleIsHappy,Danielle Pimentel,2016-03-08 21:05:49,"#Bernie2016 24 year old student at University of Idaho. I'm very passionate about the environment, politics, animals... and being happy (most of the time).",539,1053,"Idaho, USA",,3,0.063
269,34336,711980501729288192,RT @michaelallenmar: 10 ways Bernie Sanders would make the economy work for everyone https://t.co/Kt8aGkHVtu via @Salon https://t.co/Re3Ueq…,15,0,Twitter Web Client,2016-03-21 18:19:14,707311380936806400,DanielleIsHappy,Danielle Pimentel,2016-03-08 21:05:49,"#Bernie2016 24 year old student at University of Idaho. I'm very passionate about the environment, politics, animals... and being happy (most of the time).",539,1053,"Idaho, USA",,0,1.0
270,34337,711980499783294981,"Sanders now speaking, amazed at crowd size, ""I thought this was a conservative state!"" https://t.co/fkBhBs2KPY",0,0,Facebook,2016-03-21 18:19:13,28126057,KBOI670,670 KBOI,2009-04-01 15:29:19,"670 KBOI is Idaho's 50,000 watt News Talk Radio Leader. Thanks for following us!",5670,1991,"Boise, Idaho",Mountain Time (US & Canada),0,1.0
271,34374,711980423954440192,"Bernie Sanders is now live on https://t.co/xMvMnbOHpD!
https://t.co/AZkXpsn58a https://t.co/tcSttbv3lv",0,0,TweetDeck,2016-03-21 18:18:55,557915119,jmasters7,John Masters,2012-04-19 17:51:19,"Internet producer for http://t.co/qoFWPAIp51. Husband to Beth, dad to Mandy. Enjoys golf and Idaho.",122,83,"Boise, Idaho",,0,1.0
272,34689,711979702639050752,"Actress Susan Sarandon is addressing the Boise crowd before Bernie Sanders takes the stage.
https://t.co/AZkXpsn58a https://t.co/mR1J04MycS",6,13,TweetDeck,2016-03-21 18:16:03,557915119,jmasters7,John Masters,2012-04-19 17:51:19,"Internet producer for http://t.co/qoFWPAIp51. Husband to Beth, dad to Mandy. Enjoys golf and Idaho.",122,83,"Boise, Idaho",,0,1.0
273,35033,711978981071962113,.@SusanSarandon just took the stage to help introduce @BernieSanders: https://t.co/v5czCigBOI https://t.co/A9tu4htWkv,15,22,Twitter Web Client,2016-03-21 18:13:11,549411147,IdahoOnYourSide,6 On Your Side,2012-04-09 15:48:54,"New, Now and Next",4572,1635,"Boise, Idaho",Mountain Time (US & Canada),0,1.0
274,35926,711976888332234752,Feeling frustrated by the upcoming election? Take a moment to read this article submitted by Shon Sanders. https://t.co/3CgNWp8Apm,0,0,Weebly App,2016-03-21 18:04:52,1374271117,CTKNampa,CTK Church Nampa,2013-04-23 09:36:07,Grace and forgiveness in the context of authentic community is REAL here. I invite you to come and you will be surprised at how good it feels.,130,260,"Nampa, Idaho",Mazatlan,0,1.0
275,36357,711975795573428224,"RT @ABCPolitics: ""That's him!"" @BernieSanders strolls into @MaryAliceParks' livesteam: https://t.co/bPygGDybh9
https://t.co/4zoAvcR9mO",124,0,Twitter Web Client,2016-03-21 18:00:32,707311380936806400,DanielleIsHappy,Danielle Pimentel,2016-03-08 21:05:49,"#Bernie2016 24 year old student at University of Idaho. I'm very passionate about the environment, politics, animals... and being happy (most of the time).",540,1053,"Idaho, USA",,0,1.0
276,36412,711975682759262209,RT @gregorywhahn: National &amp; local media converge on #BoiseState for Sanders. 3rd major pres candidate to hit campus this primary. https://…,3,0,Twitter Web Client,2016-03-21 18:00:05,44360214,BetsyZRussell,Betsy Z. Russell,2009-06-03 13:41:11,,5722,320,"Boise, Idaho",Mountain Time (US & Canada),1,0.265
277,36453,711975578581098500,RT @janicemorinn: #BernieinBoise live stream: https://t.co/KoSWi4HjVq,6,0,Twitter Web Client,2016-03-21 17:59:40,263182835,viper1829,Jody Owsley,2011-03-09 15:15:50,"Father, Husband, & Gamer. Loves Dr Who, Star Wars, Comic Books & Football (World and American).",277,1535,"Boise, Idaho",Mountain Time (US & Canada),1,0.265
278,36483,711975503104647168,RT @ProgNation1: Bernie Sanders Is a Once in a Lifetime Presidential Candidate. The Time Is Now. https://t.co/BQ5hyvZnAT,12,0,Twitter Web Client,2016-03-21 17:59:22,707311380936806400,DanielleIsHappy,Danielle Pimentel,2016-03-08 21:05:49,"#Bernie2016 24 year old student at University of Idaho. I'm very passionate about the environment, politics, animals... and being happy (most of the time).",540,1053,"Idaho, USA",,0,1.0
279,36660,711975058822934530,RT @IdahoOnYourSide: .@TacoBellArena is packed with people waiting for @BernieSanders. Watch the live stream: https://t.co/v5czCigBOI https…,16,0,Twitter Web Client,2016-03-21 17:57:36,263182835,viper1829,Jody Owsley,2011-03-09 15:15:50,"Father, Husband, & Gamer. Loves Dr Who, Star Wars, Comic Books & Football (World and American).",277,1535,"Boise, Idaho",Mountain Time (US & Canada),0,1.0
280,36670,711975024274444289,National &amp; local media converge on #BoiseState for Sanders. 3rd major pres candidate to hit campus this primary. https://t.co/Obrh9c3jie,3,3,Twitter for Android,2016-03-21 17:57:28,1222727299,gregorywhahn,Gregory Hahn,2013-02-26 18:52:44,"#BoiseState, #HigherEd, #Idaho,  @julierose78 #RideOn",1013,555,"Boise, Idaho",Pacific Time (US & Canada),1,0.265
281,36680,711974999502893056,WATCH: Sen. Bernie Sanders speaks at Taco Bell Arena https://t.co/dH7dHTffEX via @IdahoOnYourSide,0,0,Twitter Web Client,2016-03-21 17:57:22,263182835,viper1829,Jody Owsley,2011-03-09 15:15:50,"Father, Husband, & Gamer. Loves Dr Who, Star Wars, Comic Books & Football (World and American).",277,1535,"Boise, Idaho",Mountain Time (US & Canada),0,1.0
282,36744,711974842308939776,"Sanders rally about to get underway, crowd doing The Wave.",0,0,Facebook,2016-03-21 17:56:44,28126057,KBOI670,670 KBOI,2009-04-01 15:29:19,"670 KBOI is Idaho's 50,000 watt News Talk Radio Leader. Thanks for following us!",5669,1991,"Boise, Idaho",Mountain Time (US & Canada),0,1.0
283,36880,711974510640144384,"I liked a @YouTube video https://t.co/2cTzszBR6v LIVE Stream: Bernie Sanders Rally in Boise, ID (3-21-16) LIVE Bernie Sanders Boise",1,1,Google,2016-03-21 17:55:25,1340753630,HelpingMeHome,Karla M Luckow,2013-04-10 01:53:37,"My goal is for you to tell your Friends, Karla is Helping Me Home.  This will happen when Your Dreams and My Realtor Skills come together.",165,352,"Nampa, Idaho",Mountain Time (US & Canada),0,1.0
284,37083,711973922720198656,RT @IdahoOnYourSide: .@TacoBellArena is packed with people waiting for @BernieSanders. Watch the live stream: https://t.co/v5czCigBOI https…,16,0,Twitter Web Client,2016-03-21 17:53:05,707311380936806400,DanielleIsHappy,Danielle Pimentel,2016-03-08 21:05:49,"#Bernie2016 24 year old student at University of Idaho. I'm very passionate about the environment, politics, animals... and being happy (most of the time).",540,1053,"Idaho, USA",,0,1.0
285,37146,711973760073646081,"The crowd at Taco Bell Arena crowd is getting excited for the arrival of Bernie Sanders. Watch it live now.
https://t.co/AZkXpsn58a",1,2,TweetDeck,2016-03-21 17:52:26,557915119,jmasters7,John Masters,2012-04-19 17:51:19,"Internet producer for http://t.co/qoFWPAIp51. Husband to Beth, dad to Mandy. Enjoys golf and Idaho.",122,83,"Boise, Idaho",,0,1.0
286,37660,711972336031952896,Bernie Sanders is in Boise today. Is there any chance we could get him to learn some economics while he's here? https://t.co/HqMoW8sw4f,0,0,Facebook,2016-03-21 17:46:47,1199945682,idahoans,Idahoans for Liberty,2013-02-20 07:48:35,Idahoans for Liberty is a grassroots organization dedicated to the principles of individual liberty and free market economics.,359,554,Idaho ,Mountain Time (US & Canada),0,1.0
287,37917,711971603433717760,RT @BenSpielberg: 1) My new post requests that @hillaryclinton supporters like @paulkrugman &amp; @mtomasky stop ignoring the following: https:…,94,0,Twitter Web Client,2016-03-21 17:43:52,707311380936806400,DanielleIsHappy,Danielle Pimentel,2016-03-08 21:05:49,"#Bernie2016 24 year old student at University of Idaho. I'm very passionate about the environment, politics, animals... and being happy (most of the time).",540,1053,"Idaho, USA",,0,1.0
288,38225,711970904050282502,RT @StoneSculptorJN: Poll Shows Bernie Sanders' Tax Plan Is The Favorite Of 2016 Taxpayers #NotMeUs via @politicususa https://t.co/QrIOSHj0…,3,0,Twitter Web Client,2016-03-21 17:41:05,707311380936806400,DanielleIsHappy,Danielle Pimentel,2016-03-08 21:05:49,"#Bernie2016 24 year old student at University of Idaho. I'm very passionate about the environment, politics, animals... and being happy (most of the time).",540,1053,"Idaho, USA",,1,0.265
289,38292,711970763696316417,RT @SenSanders: NEWS: Sanders Leads Effort to Support Seniors Program https://t.co/fn6csvljOr https://t.co/QGhoCXOUO7,880,0,Twitter Web Client,2016-03-21 17:40:32,707311380936806400,DanielleIsHappy,Danielle Pimentel,2016-03-08 21:05:49,"#Bernie2016 24 year old student at University of Idaho. I'm very passionate about the environment, politics, animals... and being happy (most of the time).",540,1053,"Idaho, USA",,0,1.0
290,38372,711970600990867456,RT @SenSanders: NEWS: Sanders Calls on Treasury to Prevent Pfizer Tax Dodge https://t.co/mAAANT1UFK https://t.co/PbiMTMnQpG,1526,0,Twitter Web Client,2016-03-21 17:39:53,707311380936806400,DanielleIsHappy,Danielle Pimentel,2016-03-08 21:05:49,"#Bernie2016 24 year old student at University of Idaho. I'm very passionate about the environment, politics, animals... and being happy (most of the time).",540,1053,"Idaho, USA",,0,1.0
291,38466,711970362435571712,"WATCH: Sen. Bernie Sanders speaks in Boise
https://t.co/G0fL0dxLo3 https://t.co/3qEhUVjo4a",0,2,Twitter for iPhone,2016-03-21 17:38:56,59794307,michelleedmonds,Michelle Edmonds,2009-07-24 14:22:28,"News Anchor @idahoonyourside 
6 On Your Side & Fox 9",3353,771,"Boise, Idaho",Mountain Time (US & Canada),0,1.0
292,38503,711970286363615237,.@TacoBellArena is packed with people waiting for @BernieSanders. Watch the live stream: https://t.co/v5czCigBOI https://t.co/4jb1Go5wlB,16,25,Twitter Web Client,2016-03-21 17:38:38,549411147,IdahoOnYourSide,6 On Your Side,2012-04-09 15:48:54,"New, Now and Next",4572,1635,"Boise, Idaho",Mountain Time (US & Canada),0,1.0
293,38504,711970284912267264,"RT @SassySenSanders: bernie sanders: *speaks*
hillary clinton: ^RT",734,0,Twitter for iPhone,2016-03-21 17:38:38,2814336757,elnamariee,Elna,2014-09-17 05:45:37,"dude, stop talking crazy and make us some tea.",118,183,"Idaho, USA",,0,1.0
294,38645,711969925296881664,"RT @michaelallenmar: Wall Street expert shocks CNBC as he states Bernie Sanders is best for economy (VIDEO) -
https://t.co/pAIfaE714x https…",22,0,Twitter Web Client,2016-03-21 17:37:12,707311380936806400,DanielleIsHappy,Danielle Pimentel,2016-03-08 21:05:49,"#Bernie2016 24 year old student at University of Idaho. I'm very passionate about the environment, politics, animals... and being happy (most of the time).",540,1053,"Idaho, USA",,0,1.0
295,38996,711969134419038209,Sanders to visit Utah Monday https://t.co/B38e555g3x,0,1,IFTTT,2016-03-21 17:34:04,2335595143,TheIdahoReport,The Idaho Report,2014-02-09 19:52:37,Serving Idaho by only reporting news that happens in the Gem State.,2267,1,Idaho,Pacific Time (US & Canada),0,1.0
296,39070,711968990914936837,RT @KelseyMarieKBOI: The first Sanders supporter in line tells me he arrived at 3:30 am.,6,0,Twitter Web Client,2016-03-21 17:33:29,3255048247,KaylaCashKBOI,Kayla Cash,2015-06-24 23:16:34,News Junkie • Idaho Vandal • Social Media Producer for @KBOITV • Insta@kboi2news Opinions➡️my own • Personal account: @kaylacash1234,264,824,"Idaho, USA",Pacific Time (US & Canada),0,1.0
297,39245,711968629168992256,"RT @skookerG: Koch empire is praising Bernie Sanders for this vote.
👉🏼@joavargas_1220 @HiTestProgress @SuperckookLarry @ProChildVA https://…",20,0,Buffer,2016-03-21 17:32:03,4794182534,WeNeedHillary,Progressive Man,2016-01-21 17:36:10,#Hillary2016 #ImWithHer #HillYes #ShesWithUs #UniteBlue #TopProg #LibCrib #p2 #PDmfnb #Obama #GunSense #StandwithPP #TNTweeters,5299,5411,"Idaho, USA",Pacific Time (US & Canada),0,1.0
298,39908,711967420634636288,"RT @TheNewDeal: 30,000 show up at Bernie Sanders rally in Seattle

But remember, they keep telling you this race is over...

#StillSanders
…",373,0,Twitter Web Client,2016-03-21 17:27:15,707311380936806400,DanielleIsHappy,Danielle Pimentel,2016-03-08 21:05:49,"#Bernie2016 24 year old student at University of Idaho. I'm very passionate about the environment, politics, animals... and being happy (most of the time).",540,1053,"Idaho, USA",,1,0.265
299,39919,711967393371672576,"RT @SusanSarandon: ""Sanders Outperformed Projections on Super Tuesday II – And the Calendar Gets Better from Here On Out” https://t.co/6Kpi…",557,0,Twitter Web Client,2016-03-21 17:27:08,707311380936806400,DanielleIsHappy,Danielle Pimentel,2016-03-08 21:05:49,"#Bernie2016 24 year old student at University of Idaho. I'm very passionate about the environment, politics, animals... and being happy (most of the time).",540,1053,"Idaho, USA",,0,1.0
300,40024,711967183803277312,RT @vivabernie: Will Hillary ever fight for Healthcare for All? Or has she taken too much money from Big Pharma? Switch to Sanders https://…,164,0,Twitter Web Client,2016-03-21 17:26:18,707311380936806400,DanielleIsHappy,Danielle Pimentel,2016-03-08 21:05:49,"#Bernie2016 24 year old student at University of Idaho. I'm very passionate about the environment, politics, animals... and being happy (most of the time).",540,1053,"Idaho, USA",,0,1.0
301,40502,711966274318786560,Today's Poll: today's poll: Who would you prefer to see in person at a rally -- Bernie Sanders or Bill Clinton? https://t.co/uYLVQBaQdX,0,1,TweetDeck,2016-03-21 17:22:42,125809538,HucksOnline,D.F. Oliveria,2010-03-23 23:16:19,Dave Oliveria writes the Huckleberries column for The Spokesman-Review and compiles the Huckleberries Online blog. Both focus on Coeur d'Alene and North Idaho.,2084,506,"Coeur d'Alene, Idaho",Pacific Time (US & Canada),0,1.0
302,40561,711966130290593792,"RT @phillipbalayan: Free Markets -- Bernie Sanders &amp; Donald Trump Oppose Them, Blindly https://t.co/lA6LDLj54E",1,0,Twitter for Android,2016-03-21 17:22:07,2840798923,hitgrl15,Griffian,2014-10-05 04:15:26,Christian. Constitutional Conservative. Former military brat. #2A #1A Pro life Pro Israel. Anti Islam. Family. Pets are family too. 18+ #Cruz2016   OlllllllO,4401,4111,"North Idaho, USA",Pacific Time (US & Canada),0,1.0
303,40581,711966099940593664,"At the Bernie Sanders rally, feel the Bern! https://t.co/IoBP2w8zZs",6,10,Twitter for Android,2016-03-21 17:22:00,2369455057,womack_greg,Greg Womack,2014-03-02 22:11:45,"President Local #149 Boise Firefighters IAFF 7th District Field Service Rep proudly serving WA, ID, MT and AK!",385,360,Boise Idaho,,0,1.0
304,40785,711965709241229312,RT @bubblebrow: I strongly support Bernie Sanders because he will restore our faith in the government and create a future to believe in. #F…,16,0,Twitter Web Client,2016-03-21 17:20:27,707311380936806400,DanielleIsHappy,Danielle Pimentel,2016-03-08 21:05:49,"#Bernie2016 24 year old student at University of Idaho. I'm very passionate about the environment, politics, animals... and being happy (most of the time).",540,1053,"Idaho, USA",,1,0.265
305,40958,711965394496413696,RT @ZaidJilani: Almost 70% of Democrats living abroad voted for Sanders over Clinton https://t.co/Ombcu9etdR,87,0,Twitter Web Client,2016-03-21 17:19:12,707311380936806400,DanielleIsHappy,Danielle Pimentel,2016-03-08 21:05:49,"#Bernie2016 24 year old student at University of Idaho. I'm very passionate about the environment, politics, animals... and being happy (most of the time).",540,1053,"Idaho, USA",,0,1.0
306,41826,711964981755940865,RT @KaylaCashKBOI: Actress Susan Sarandon in Boise to speak with Bernie Sanders volunteers: https://t.co/N1nbGw3vPb https://t.co/wykK5hHVzH,9,0,Twitter Web Client,2016-03-21 17:17:33,707311380936806400,DanielleIsHappy,Danielle Pimentel,2016-03-08 21:05:49,"#Bernie2016 24 year old student at University of Idaho. I'm very passionate about the environment, politics, animals... and being happy (most of the time).",540,1057,"Idaho, USA",,0,1.0
307,41871,711964923228790784,@sanders_kaila I came back,0,1,Twitter for iPhone,2016-03-21 17:17:20,2248240248,KristyNiccolls,Kristy Niccolls,2013-12-16 05:40:22,Jesus-loving travel addict & sunshine-chasing snow cone connoisseur | ΑΣΤ {αα} | SLU {2019} |,225,199,"Eagle, Idaho | St.Leo, Florida",Mazatlan,0,1.0
308,42101,711964675471048704,"RT @KaylaCashKBOI: Actress Susan Sarandon speaks on Bernie Sanders as ""refreshing"" and ""the lesser of two evils"" in Boise @KBOITV https://t…",16,0,Twitter Web Client,2016-03-21 17:16:20,707311380936806400,DanielleIsHappy,Danielle Pimentel,2016-03-08 21:05:49,"#Bernie2016 24 year old student at University of Idaho. I'm very passionate about the environment, politics, animals... and being happy (most of the time).",540,1057,"Idaho, USA",,0,1.0
309,42363,711964549289607168,RT @Libertea2012: RT Stand Together -- Bernie Sanders ad    via @YouTube https://t.co/3bnWo8hAhg https://t.co/86GdTgtO8v: Stand… https://t.…,3,0,Twitter Web Client,2016-03-21 17:15:50,707311380936806400,DanielleIsHappy,Danielle Pimentel,2016-03-08 21:05:49,"#Bernie2016 24 year old student at University of Idaho. I'm very passionate about the environment, politics, animals... and being happy (most of the time).",540,1057,"Idaho, USA",,0,1.0
