,tweetID,tweetText,tweetRetweetCt,tweetFavoriteCt,tweetSource,tweetCreated,userID,userScreen,userName,userCreateDt,userDesc,userFollowerCt,userFriendsCt,userLocation,userTimezone,tweetHashtagCt,Weight,positiveness,negativeness,sentiment_label,pos_adj,neg_adj
577,712017090677309440,"RT @Rutherford_Inst: Commentary: Fascism, American Style #Politics #Trump #Clinton - https://t.co/IfE8DdSfxA",19,0,Twitter Web Client,2016-03-21 20:44:37,809256522,ccGaudette,Charles Gaudette,2012-09-07 17:15:16,"Computer specialist. I can be compassionate w/o the Government forcing me to be compassionate, in fact, I insist on it. #LibertyAmendments",782,1964,"Arizona, USA",Arizona,3,0.063,0.0,0.0,positive,0.0,0.0
578,712016800779612160,"@elizabethforma @realDonaldTrump Warren and Clinton are communists,nothing more. Citizens completely dependent on gov. That's communism.",0,5,Twitter Web Client,2016-03-21 20:43:28,915482424,dcrushbooks,D.C. Rush,2012-10-30 20:58:57,"Illustrated eBooks, Paperback and Audio Books for children learning Family Values such as teamwork, leadership and friendship.",2239,2239,Arizona,Arizona,0,1.0,0.0288461538462,0.0,positive,0.0,0.1875
579,712016738435510274,RT @FoxNewsInsider: .@DiamondandSilk: Clintons 'Can Go Home and Sit Down and Be Quiet' @jessebwatters https://t.co/Mna5dQF4Jh https://t.co/…,231,0,Twitter for Android,2016-03-21 20:43:13,2235082710,Pamelapilates,Pamela More,2013-12-07 21:34:08,As a fitness instructor and past yo-yo dieter I want to share my passion for exercise with tips to stay motivated for better health.,21,30,Arizona,,0,1.0,0.0,0.0,positive,0.0,0.0
580,712016590586294272,RT @intifada: Is @AIPAC racially profiling conference attendees? Black student leader says Israel lobby group investigated him https://t.co…,23,0,Twitter Web Client,2016-03-21 20:42:38,366126775,CharlesLamadrid,Charles Lamadrid,2011-09-01 16:29:27,"AA Degree (Valedictorian), Independent Researcher/Whistleblower, Activist, Dissident Intellectual, Anarchist, Teacher, Innocent Ex-Prisoner/ #45920, Love=Answer",11358,151,"Phoenix, Arizona, USA",Arizona,0,1.0,0.0402097902098,0.0,positive,0.0,0.0
581,712016409153413124,RT @MGriego12news: Line of people waiting to get inside Hillary Clinton's rally at Carl Hayden High School #12news https://t.co/v6CprvnyJO,2,0,RoundTeam,2016-03-21 20:41:55,17187236,12News,12 News,2008-11-05 12:15:42,"#Arizona's source for #breakingnews, #traffic, #weather, #sports and more. Got a news tip? Call us at 602-444-1212. Email photos or video to connect@12news.com.",95621,10668,"Arizona, USA",Arizona,1,0.265,0.0173611111111,0.137152777778,positive,0.25,0.0
582,712016408016777217,RT @MGriego12news: Line of people waiting to get inside Hillary Clinton's rally at Carl Hayden High School #12news https://t.co/l7uXJyQ3sr,5,0,RoundTeam,2016-03-21 20:41:54,17187236,12News,12 News,2008-11-05 12:15:42,"#Arizona's source for #breakingnews, #traffic, #weather, #sports and more. Got a news tip? Call us at 602-444-1212. Email photos or video to connect@12news.com.",95621,10668,"Arizona, USA",Arizona,1,0.265,0.0173611111111,0.137152777778,positive,0.25,0.0
583,712015638651215873,RT @zuuumie777: BHO remains as Evasive &amp; Silent about Christian deaths as Jeffrey Epstein 4 Bill Clinton  https://t.co/gXbm6CvYbz https://t…,2,0,Twitter Web Client,2016-03-21 20:38:51,3122210124,springerpappy,Patrick Springer,2015-04-01 00:37:43,,143,134,"Arizona, USA",,0,1.0,0.0,0.0,positive,0.0,0.0
584,712014490255032321,RT @risetoflyy: People actually support a clear well documented murderer like Hillary Clinton! OMYGOD! https://t.co/WLMPjFbGFm,16,0,Twitter Web Client,2016-03-21 20:34:17,19921268,SharNeal,Sharon Andreas,2009-02-02 18:32:11,I love  Rock  Roll and volunteer at animal shelter - rescue is hard but so rewarding too- I am conservative & love our constitution-want America Great Again,7121,7830,Arizona USA,Pacific Time (US & Canada),0,1.0,0.71095421123,0.0150401069519,positive,1.48330269608,0.0193014705882
585,712014086754668544,RT @JohnAPellizzari: Lines of people braving the heat for Hillary Clinton event. #abc15 https://t.co/p2ugmeWqV3,6,0,TweetDeck,2016-03-21 20:32:41,19370463,ErisaNakano,Erisa Nakano,2009-01-22 23:50:02,Real-Time Editor at @abc15 // Broadcast Journalism graduate of @Cronkite_ASU,1688,879,"Phoenix, Arizona",Mountain Time (US & Canada),1,0.265,0.0,0.625,positive,0.0,0.0
586,712011918899339265,"Hillary Clinton bows to Netanyahu

https://t.co/NKCd4ZiZpU",0,0,Linkis.com,2016-03-21 20:24:04,40788228,akeleven,Jean Wylie,2009-05-18 02:01:50,"Supporter of Planned Parenthood since 1971. Retired liberal. Formerly Middle Class. Dreams expired.
TrueTwit users, I will not be following you. Sorry.",2489,4562,arizona,America/Phoenix,0,1.0,0.05,0.0,positive,0.0,0.0
587,712010908705251328,Watch Gabby Giffords  and Mark Kelly introduce former President Clinton https://t.co/ak89MoRmsk,2,0,StarNet Labs,2016-03-21 20:20:03,3952661,TucsonStar,Arizona Daily Star,2007-04-09 23:04:05,The Arizona Daily Star is Tucson's main source for local news. We cover the issues that Southern Arizonans care about most.,34870,5014,"Tucson, Arizona",Arizona,0,1.0,0.0,0.09375,positive,0.0,0.09375
588,712010231094480897,RT @BeverleeHughes3: Here's a two pronged fork: republicans are terrified and misogynists are too. Why the hate for Hillary Clinton? @CNN h…,5,0,Twitter for Android,2016-03-21 20:17:22,22846618,lehimesa,lehi,2009-03-04 22:33:48,artist mom granny wife teacher caretaker mule friend farm worker cat herder dog lover bird watcher voter. Pres Obama will be in history books forever!,4854,5337,arizona,Pacific Time (US & Canada),0,1.0,0.307692307692,0.125,negative,0.0,0.125
589,712009469643907073,Did Hillary Clinton Defeat Bernie Sanders on Trade? https://t.co/fuL8NF4Evj,0,0,Tumblr,2016-03-21 20:14:20,808758,naum,Naum Trifanoff,2007-03-03 18:10:27,"baseball buff, code monkey, hockey freak, jesus follower,  transnational progressive conservative, voracious reader, webologist",1163,2286,Arizona,Arizona,0,1.0,0.0,0.0,negative,0.0,0.0
590,712008573727846400,RT @ThisWeekABC: Raul Castro dodges question on Trump vs. Clinton https://t.co/b2lUJ4m7h0 https://t.co/oAMdVHSsBq,3,0,Twitter for iPad,2016-03-21 20:10:47,30173639,davewilbur,David Wilbur,2009-04-10 06:04:56,"Writer, public policy and political junkie.",110,196,"Tempe, Arizona",Pacific Time (US & Canada),0,1.0,0.0,0.0,positive,0.0,0.0
591,712008235398475776,"Why the hate for Hillary? https://t.co/9rSP9KDUZ2 Um, perhaps b/c she's a puppet of multinational corporations and she lies a lot?",0,0,Twitter Web Client,2016-03-21 20:09:26,393586294,ronthomasaz,Ron Thomas,2011-10-18 19:21:47,"Phoenix, Arizona divorce, child custody, and bankruptcy attorney. My passion is protecting the rights of husbands & fathers in divorce & custody battles.",2273,2143,"Phoenix, Arizona",,0,1.0,0.0,0.0535714285714,negative,0.0,0.0
592,712006682105290752,FOX10Phoenix: RT SKrafftFox10: Line forming outside Carl Hayden HS in Phx for Hillary Clinton rally #FOX10Phoenix https://t.co/rvPdNbDmwM,0,1,IFTTT,2016-03-21 20:03:16,703603733092044800,JamesWyseAZ,Arizona 100,2016-02-27 15:32:57,"https://t.co/x7IxYgBLtS Celebrating #Arizona over the last #100years. Proudly promoting #tourism, #localbusiness, #localnews and #sportsnews",35,13,"Arizona, USA",Pacific Time (US & Canada),1,0.265,0.00625,0.00625,positive,0.00625,0.00625
593,712005923464548353,"Bill Clinton stumps for Hillary Clinton in Phoenix
https://t.co/69EPhr6nNU https://t.co/tnrdPrTUch",1,0,TweetDeck,2016-03-21 20:00:15,2753211010,PhoenixDailyNew,Phoenix Daily News,2014-08-28 09:32:33,"Local news, sports, business, politics, entertainment, travel and opinion for Phoenix and Arizona. DM us 24/7",13634,5406,"City of Phoenix, Arizona",Arizona,0,1.0,0.0,0.0,positive,0.0,0.0
594,712005902908264448,RT @MrDane1982: Fact checkers confirm Hillary Clinton is more honest than any of her 2016 opponents https://t.co/9Y5eRzGoPI via @dailynewsb…,34,0,Twitter Web Client,2016-03-21 20:00:10,1421458982,PAWarnhoff,Phyllis Anne,2013-05-11 19:53:31,,4154,4354,Living in sunny Arizona,,0,1.0,0.347723704867,0.0561224489796,positive,0.31887755102,0.0561224489796
595,712005896340054016,New: Hillary Clinton’s AIPAC Speech Forgets To Mention Her State Department Trying To Cause Riots In Is…  - https://t.co/WCsh6Jz249 #azright,0,0,MorningInArizona,2016-03-21 20:00:08,242114285,MorninginAz,Dawn West,2011-01-24 00:14:22,A group of conservative bloggers trying to make Arizona the best state in the Union.,520,339,"Tucson, Arizona",Arizona,1,0.265,0.0625,0.0138888888889,positive,0.0,0.0
596,712005444621852672,RT @businessinsider: George Clooney endorses Hillary Clinton and says she's 'the only grown-up in the room' https://t.co/CZIETDqXUB https:/…,74,0,Twitter for iPhone,2016-03-21 19:58:21,23217667,gab_salazar,GabrielaSalazar,2009-03-07 18:13:25,"Living in Phoenix,",54,224,Arizona ,Central Time (US & Canada),0,1.0,0.261363636364,0.0,positive,0.0,0.0
597,712004949878644736,George Clooney writes letter supporting Hillary Clinton https://t.co/QAF4RdLU8L @EW #Swaegg https://t.co/yVN6nsVqWa,0,0,IFTTT,2016-03-21 19:56:23,1240563103,SwaeggOut,Swaegg,2013-03-04 05:15:26,"The Hottest Celebrity, Fashion & Lifestyle Social Wall.",7209,1891,Arizona,,1,0.265,0.0818181818182,0.0113636363636,positive,0.3125,0.0
598,712004312667279361,Critics Aghast at 'Disgusting Speech' Clinton Just Gave to AIPAC - https://t.co/89YrB9IA95,0,0,Twitter Web Client,2016-03-21 19:53:51,157013030,TodaysComments,TodaysComments,2010-06-18 15:57:50,"vietnam vet- USS Forrestal CVA-59 survivor, father/grandfather, retired photographer, Kindergarten teacher. links/RTs not necessarily endorsements.",1912,1955,effed up Arizona,Arizona,0,1.0,0.0,0.0,positive,0.0,0.0
599,712003559810736129,RT @Bernlennials: .@BernieSanders crushes Clinton among Democrats abroad https://t.co/wsOOmeXNBg #VoteTogether #FeelTheBern https://t.co/UV…,73,0,Twitter for Android,2016-03-21 19:50:51,66590126,ladybugpicnics,mildredlewis,2009-08-18 04:01:46,,909,3296,"Arizona, USA",,2,0.127,0.0,0.0,positive,0.0,0.0
600,712003121778532352,If Bernie does not win for president were gonna be fuck sideways  come on Hillary Clinton or Trump i rather have a dog for president,0,2,Twitter for iPad,2016-03-21 19:49:07,320573618,DareIFuckenCare,Arianna,2011-06-20 04:39:21,God Julian Casablancas is all that matters n The Strokes enough said ⚡️⚡️,310,320,Arizona,Mountain Time (US & Canada),0,1.0,0.627427944862,0.0475306856886,negative,0.0,0.25
601,712002540867424260,RT @pieroAlessio: The Troubling Friendship of Hillary Clinton and George W. Bush https://t.co/TdAR6msjKi,1,0,Twitter Web Client,2016-03-21 19:46:48,29010023,Mary_Burgess,Mary Burgess,2009-04-05 16:09:32,"Visionary and Supporter of the Arts! - Inner Artist, Reiki Master, Certified Angel Card Reader™. Hobby artist, culture & laughing. https://t.co/npewNsQaWU",21222,18795,"Arizona, USA",Arizona,0,1.0,0.0,0.0,positive,0.0,0.0
602,712002489445318656,I'M MEETING HILLARY RODHAM CLINTON TODAYYYYY,0,12,Twitter for iPhone,2016-03-21 19:46:36,1565260310,patmoy95,Patrick Moyse,2013-07-03 08:46:37,"Statistically, we're headed toward an age where everybody's gonna be, like, caramel and queer.",295,457,Arizona,,0,1.0,0.0,0.0,negative,0.0,0.0
603,712002023877713920,"RT @grindingdude: Hillary emails reveal, Google wanted to overthrow Assad W/ MAPPING tool. Obama reveals Google bringing Wi-Fi to Cuba http…",3,0,Twitter Web Client,2016-03-21 19:44:45,3206947907,wildwas2112,Randy Buchanan,2015-04-25 17:43:51,"hunting, gun rights , freedom from the Radical Liberal idiots! HOT Peppers-Heavy Rock-N-Roll Conservative,American Indian-Believing God,Guns,America 1st!",154,276,"Arizona, USA",,0,1.0,0.0602272727273,0.109090909091,positive,0.625,0.0
604,712001942499643392,If you're thinking of voting for Trump because you can't stand Clinton you aren't thinking very hard https://t.co/L7OmIIyPb6,0,0,Twitter Web Client,2016-03-21 19:44:26,197004139,AZWildcatMom,Lisa,2010-09-30 12:38:22,,220,806,Arizona,Arizona,0,1.0,0.294230769231,0.0761217948718,positive,1.0,0.21875
605,712001477959520256,RT @DavidAFrench: Clinton Email Scandal Update -- Is Sidney Blumenthal in Trouble? https://t.co/ZHdTmORBUY via @NRO,4,0,Twitter for iPhone,2016-03-21 19:42:35,99945284,PastorSproul,Mike Sproul,2009-12-28 13:15:35,Senior Pastor to the greatest people in the world at Tri-City Baptist Church and ANG Asst to the Command Chaplain USAFE-AFAFRICA,1219,1302,"Chandler, Arizona USA",Arizona,0,1.0,0.0288461538462,0.0,positive,0.0,0.0
606,712001227656048640,RT @abc15sports: That time when @Suns guard @EBled2 got a shout out from former president @billclinton: https://t.co/G0qcUNk9qS https://t.c…,9,0,Twitter for Android,2016-03-21 19:41:35,979050428,lane21_,FurcapVerlane,2012-11-29 19:57:25,19 / Navajo / Phoenix Suns Fan & Much More,341,188,Arizona,,0,1.0,0.0173611111111,0.105902777778,positive,0.0,0.33125
607,712000933341712384,"RT @RBReich: Pay no attention to the national media, who want you to think Hillary Clinton has the Democratic nomination is... https://t.co…",1056,0,Twitter for iPhone,2016-03-21 19:40:25,205958156,ftc539,Frank Copple,2010-10-22 00:02:01,IAILFLVAIACAIAKSWIMAWIPOAWIGACASAOPOAWIFLKYMNAZ That's where I've lived.,67,109,Arizona,Pacific Time (US & Canada),0,1.0,0.446406882591,0.102918353576,positive,0.0,0.0
608,711998827037745152,RT @sanderswinsbig: Sanders crushes Clinton among Democrats abroad - #FeelTheBern #NeverHillary #DumpTrump https://t.co/E8sYLAehQT https://…,17,0,Twitter for Android,2016-03-21 19:32:03,949112370,dehubbard427,Derrick Hubbard,2012-11-15 05:41:44,Semper Fi!!,277,369,"Arizona, USA",Arizona,3,0.063,0.015625,0.09375,positive,0.0,0.0
609,711997777245437953,RT @USAforTrump2016: Clinton And Soros Are Behind Violent Riots At Trump Rallies https://t.co/d7qZiSOQN4 via @dailycaller,32,0,Twitter for Android,2016-03-21 19:27:53,1380791672,LeKristie,Kristie Le Boeuf,2013-04-26 01:21:21,"TRUMP SUPPORTER...MAKE AMERICA GREAT AGAIN!
Lover of all Animals.",28,33,"Arizona, USA",,0,1.0,0.0,0.0,positive,0.0,0.0
610,711997468158734336,"Arpaio nemesis campaigning for Clinton, could be sleeper VP pick https://t.co/wRejJhLTfW #Phoenix",0,0,dlvr.it,2016-03-21 19:26:39,521747967,AZSmallBz,Jose Kenney,2012-03-11 22:46:55,If you believe that #SmallBiz and #Entrepreneurs make the State of #Arizona strong then show some love by retweeting! Proud member of #KESocial!,4009,4177,"Arizona, USA",Atlantic Time (Canada),1,0.265,0.0288461538462,0.0,positive,0.0,0.0
611,711996847569682433,RT @os2hankh: FBI director: Clinton broke the law - The Horn News https://t.co/mJoRVn3822,2,0,Twitter Web Client,2016-03-21 19:24:11,19921268,SharNeal,Sharon Andreas,2009-02-02 18:32:11,I love  Rock  Roll and volunteer at animal shelter - rescue is hard but so rewarding too- I am conservative & love our constitution-want America Great Again,7120,7829,Arizona USA,Pacific Time (US & Canada),0,1.0,0.00988700564972,0.0282485875706,positive,0.0,0.375
612,711996381594955777,"Yes, that high school @HillaryClinton is visiting is the one in that movie #spareparts with @georgelopez  https://t.co/Cy6tIWgE6a …",1,0,Twitter Web Client,2016-03-21 19:22:20,206849105,ruelaswritings,Richard Ruelas,2010-10-23 21:50:24,"Arizona Republic/azcentral reporter, writing about Arizona people and Arizona wine, Tempe born and raised; never won a Ladmo Bag.",1303,654,Arizona,,1,0.265,0.187156593407,0.0967261904762,positive,0.258333333333,0.0738095238095
613,711996279300042752,"I hope Camp Clinton is taking note: as a running mate, @SenWarren would be a very effective anti-Trump messenger. https://t.co/lHS5xgrQcQ",0,1,Twitter Web Client,2016-03-21 19:21:55,320440760,seth_scott,Seth Scott,2011-06-19 22:38:53,Chief of Staff for Policy for Phoenix @MayorStanton. @ASUCollegeofLaw alum. Sun Devil for life.,1400,1660,"Phoenix, Arizona",,0,1.0,0.604319291819,0.00992063492063,positive,1.4375,0.0
614,711996116196315138,"RT @RogerJStoneJr: ""Blaming @SenSanders for protesters at @realDonaldTrump  Rallys
like blaming REDS  for Reichstag Fire.#IClinton/OP"" http…",97,0,Twitter Web Client,2016-03-21 19:21:17,19921268,SharNeal,Sharon Andreas,2009-02-02 18:32:11,I love  Rock  Roll and volunteer at animal shelter - rescue is hard but so rewarding too- I am conservative & love our constitution-want America Great Again,7120,7829,Arizona USA,Pacific Time (US & Canada),1,0.265,0.0,0.416666666667,positive,0.1875,0.015625
615,711994933893140481,RT @timjhogan: Gabrielle Giffords appearance brings Phoenix rally for Hillary Clinton to its feet https://t.co/SqXTw3Wm6q,8,0,Twitter for iPhone,2016-03-21 19:16:35,22722263,DM3AZ,David Martinez III,2009-03-04 02:44:27,"@UofA alum born & raised in @TownofMarana, now in @CityofPhoenixAz as @SMFBadvocate. Pray at @SMBasilica, serve on @HRC Board of Govs & as @HRCaz Co-Chair.",1435,1575,"Arizona, USA",Arizona,0,1.0,0.0,0.0,positive,0.0,0.0
616,711994932198842368,Giffords brings rally for Clinton to its feet https://t.co/q2Oa5zLdCm,1,2,Hootsuite,2016-03-21 19:16:34,50099768,azcInsider,azcInsider,2009-06-23 20:56:36,"Breaking news on Arizona politics. Get our NEW apps! iPhone: http://t.co/kcHwSl9cba, iPad: http://t.co/HzzZ5FfuLG, Android: http://t.co/563Yi3rMaJ",7161,504,Arizona,Pacific Time (US & Canada),0,1.0,0.0227272727273,0.0340909090909,positive,0.0,0.0
617,711994279095185409,"RT @BuzzFeedNews: Raúl Castro, after being asked whether he prefers Clinton or Trump: ""I cannot vote in the United States"" https://t.co/Epb…",131,0,Twitter for iPhone,2016-03-21 19:13:59,172437515,gaminogabriel,Gabriel A. Gamiño G.,2010-07-29 18:25:35,Aspiring to become the Voice of the Voiceless. Journalist. PBS NewsHour All-Star Alumni. Former @arizonapbs Intern. Immigrant. Español. RTs not endorsements,569,838,"Phoenix, Arizona",Pacific Time (US & Canada),0,1.0,0.419917582418,0.0,positive,0.0,0.0
618,711993081680175104,"RT @voxdotcom: Clinton has a $30 billion plan to help coal miners, but it got buried by a silly ""gaffe"" https://t.co/xzQDTmOk0O",49,0,Twitter for Android,2016-03-21 19:09:13,598217856,phoenixethos,Ally,2012-06-03 08:05:22,"disembodied | 
#BirdGang",2375,5000,"Phoenix, Arizona",Arizona,0,1.0,0.141812865497,0.481176900585,negative,0.0,0.8125
619,711992099487350785,MADNESS: Emails Show Google Directing Clinton State Department Foreign Policy - https://t.co/1sNRVUSYOj https://t.co/e4LcQTWhR4,1,0,Twitter Web Client,2016-03-21 19:05:19,125128428,amronsomar,Norma  Ramos,2010-03-21 19:57:06,"All the latest in my endeavors to find something to do besides work ~ie~Twitter. etc.~Registered INDEPENDENT~~ Prolife,Teaparty,The  CONSTITUTION RULES",14789,15191,Arizona/Central Calif,Arizona,0,1.0,0.0,0.0,positive,0.0,0.0
620,711990838201417728,Polls show #HillaryClinton will beat #BernieSanders in the #ArizonaPrimary unless young people get out and vote https://t.co/V5hBt63OhR,17,12,Twitter Web Client,2016-03-21 19:00:18,241747502,MiriamWasser,Miriam Wasser,2011-01-23 01:48:57,Staff writer at Phoenix New Times miriam.wasser@newtimes.com,574,576,"Phoenix, Arizona",Eastern Time (US & Canada),3,0.063,0.220078502415,0.0980223429952,positive,0.075,0.3125
621,711989860714684416,"RT @NBCNightlyNews: PolitiFact: Hillary Clinton's claim on small donors is ""Mostly False"". https://t.co/x3n5Db4hUh https://t.co/BDVa4ZxWXa",18,0,TweetCaster for Android,2016-03-21 18:56:25,160614743,makingitlookeas,Bob,2010-06-28 17:36:33,GT Steam Origin: LeavingOnAJet,190,170,Arizona,Arizona,0,1.0,0.0288461538462,0.8375,positive,0.0,0.2625
622,712428569247395841,RT @BenSwann_: Clinton Email Shows US Sought Syria Regime Change for Israel’s Sake https://t.co/p7qJfwgun2 #tcot via @BenSwann_ https://t.c…,42,0,TweetDeck,2016-03-22 23:59:41,125128428,amronsomar,Norma  Ramos,2010-03-21 19:57:06,"All the latest in my endeavors to find something to do besides work ~ie~Twitter. etc.~Registered INDEPENDENT~~ Prolife,Teaparty,The  CONSTITUTION RULES",14791,15191,Arizona/Central Calif,Arizona,1,0.265,0.0,0.0,positive,0.0,0.0
623,712428456215072768,Politically minded! Chloe Grace Moretz hits campaign trail for Hillary Clinton in Nevada - Daily Mail https://t.co/Lh9yJvxNHk,0,0,Twitter for iPad,2016-03-22 23:59:14,1265367288,_imthedevil,god,2013-03-13 20:30:13,"i am the superman. it's my halo. fuck you! i am the batman , spiderman and the hulk also. i'm the dc/marvel universe. i'm peter pan, you're not. get used to it",403,1218,NOT MESA ARIZONA,Arizona,0,1.0,0.375,0.0723039215686,positive,0.0,0.0
624,712427648748638212,RT @Cap_Institute: Chelsea Clinton Slips Up BIG Time… Reveals OUTRAGEOUS Plan Her Mother Has For Illegals https://t.co/hwHv0WF0SX #tcot htt…,31,0,TweetDeck,2016-03-22 23:56:02,125128428,amronsomar,Norma  Ramos,2010-03-21 19:57:06,"All the latest in my endeavors to find something to do besides work ~ie~Twitter. etc.~Registered INDEPENDENT~~ Prolife,Teaparty,The  CONSTITUTION RULES",14791,15191,Arizona/Central Calif,Arizona,1,0.265,0.0,0.0,positive,0.0,0.0
625,712427611243155456,"RT @PrisonPlanet: George Clooney loves Muslims so much he has endorsed Hillary Clinton.

The woman (cont) https://t.co/auXmX264lt",0,0,TweetCaster for Android,2016-03-22 23:55:53,32816955,PamCeeInAz,PamCeeInAz,2009-04-18 06:42:50,"Proud American; Cooking show junkie! Proud Packers Fan, AZ Coyotes Fan; formerly known as @ PamYotesFan; married to @desertrat214",2177,2221,"Arizona, USA",Arizona,0,1.0,0.884868421053,0.0263157894737,positive,0.0,0.0
626,712427276286046208,"Another Indigenous Activist Is Assassinated, Urging Calls for Clinton to Come Clean on Role in Honduran Coup |  https://t.co/KFn03aHD8M",1,1,Twitter Web Client,2016-03-22 23:54:33,394475970,Gobreski,Aaron,2011-10-20 04:00:52,"Urban Shaman, Philosopher, Artist and Environmental Love Dispensary",97,202,"Phoenix, Arizona, USA",Mountain Time (US & Canada),0,1.0,0.0238095238095,0.00198412698413,positive,0.0,0.0
627,712426583915507712,RT @pivotamerica: Did Hillary Clinton Plant Moles in the Sanders Campaign? https://t.co/42u5tBnRMJ https://t.co/LaXAQdMJwq,47,0,Twitter for Android,2016-03-22 23:51:48,40788228,akeleven,Jean Wylie,2009-05-18 02:01:50,"Supporter of Planned Parenthood since 1971. Retired liberal. Formerly Middle Class. Dreams expired.
TrueTwit users, I will not be following you. Sorry.",2520,4585,arizona,America/Phoenix,0,1.0,0.0,0.0,positive,0.0,0.0
628,712424901899100162,2 books: #Giving by Bill Clinton &amp; Giving 2.0 by Laura Arrillaga-Andreessen #BillClinton  https://t.co/oGeF5Otanp,0,0,Hootsuite,2016-03-22 23:45:07,1073942774,OnlinePuma,Online Puma,2013-01-09 14:32:11,,893,1379,Arizona,,2,0.127,0.0550699300699,0.041958041958,positive,0.0,0.0
629,712424716317892609,Markell: Clinton talks tough but still a liberal https://t.co/XfO5L7LsmQ,0,0,Twitter Web Client,2016-03-22 23:44:23,50919244,prayforall,Cindy Schiller,2009-06-26 04:21:08,,12,30,Arizona,Pacific Time (US & Canada),0,1.0,0.201851851852,0.446296296296,positive,0.264351851852,0.626851851852
630,712422947030376448,"RT @Starseed52: No Mysteries That Clinton &amp; Trump supporters do NOT listen or read #Faction3 News!
All in the Archives! https://t.co/znna7T…",13,0,Twitter for Android,2016-03-22 23:37:21,40788228,akeleven,Jean Wylie,2009-05-18 02:01:50,"Supporter of Planned Parenthood since 1971. Retired liberal. Formerly Middle Class. Dreams expired.
TrueTwit users, I will not be following you. Sorry.",2520,4585,arizona,America/Phoenix,1,0.265,0.0161713286713,0.0192307692308,positive,0.0,0.0
631,712422707262939136,Hillary Clinton better reconsider that CRAZY STATEMENT  https://t.co/iB1mKD7ajv,0,0,Twitter for Android,2016-03-22 23:36:24,4304419334,worldgoneweird,jc,2015-11-20 20:14:09,"Christian I love  America and what it really stands for..none of that let everyone in crap.  I specialize in geneology US, France and Britain",751,948,"Arizona, USA",,0,1.0,0.625,0.0,positive,0.625,0.0
632,712422004742172672,RT @Historicalmages: President Clinton poses for a picture with a White House Intern. 1995. https://t.co/ZnZCSvitFR,187,0,Twitter for iPad,2016-03-22 23:33:36,537602851,AZ_Susan,SusanD,2012-03-26 22:09:25,"Conservative Christian, Retired RN. Traveler/writer, consultant, #31gifts #healthy #nutrition #Jesus #pray #pets, #veterans, #police, #Israel #love ❤️ to RT",7755,5728,Arizona,America/Denver,0,1.0,0.0,0.125,positive,0.0,0.0
633,712421917001535488,RT @Carlianna_lovee: 31. Clinton Moxam... Most beautiful man alive or? https://t.co/Aih8MDEP7z,2472,0,Twitter for iPhone,2016-03-22 23:33:15,74250111,KeyairieSmalls,Unbothered,2009-09-14 20:12:06,The fundamentals are the building blocks of fun.,1272,723,Chicago✈ Arizona,Mountain Time (US & Canada),0,1.0,1.02678571429,0.0,positive,1.02678571429,0.0
634,712421791256293376,@Paulicci1 @SenQuezada29 @latejana86 @SDzzz Never heard of usuncut. U ever heard of the @BostonGlobe? #DealWithIt https://t.co/vXfpRZQieR,0,0,Twitter Web Client,2016-03-22 23:32:45,21425343,RealDeeDeeBlase,DeeDee Garcia Blase,2009-02-20 19:33:25,"Veteran, Chicana & Political. Moderate key swing (I) voter. No.1 goal to help motivate Women, Independents, Chicanos / Latinos 2 polls. #ImWithHer #NeverTrump",2305,1361,Arizona,Arizona,1,0.265,0.0,0.0,positive,0.25,0.0
635,712421539732303872,RT @annie_woodard: Hillary Clinton Shoots Down CNN And Dumps Trump By Refusing To Play The Insult Game via @politicususa https://t.co/uFtM1…,11,0,Twitter Web Client,2016-03-22 23:31:45,1421458982,PAWarnhoff,Phyllis Anne,2013-05-11 19:53:31,,4160,4353,Living in sunny Arizona,,0,1.0,0.0327380952381,0.12619047619,positive,0.0,0.0
636,712420896099725312,"@BernieSanders tops trump MORE than Hillary. Change the title @CNN. What do you think, @shailenewoodley ?

https://t.co/UOfMWhvlSF",0,0,Twitter for iPhone,2016-03-22 23:29:12,277693133,BriefCaseJo,Joseph Guardiola,2011-04-05 21:16:30,Hello!,10,22,"USA, Arizona",Arizona,0,1.0,0.1625,0.0302083333333,positive,0.625,0.0
