,tweetID,tweetText,tweetRetweetCt,tweetFavoriteCt,tweetSource,tweetCreated,userID,userScreen,userName,userCreateDt,userDesc,userFollowerCt,userFriendsCt,userLocation,userTimezone,tweetHashtagCt,Weight,positiveness,negativeness,sentiment_label,pos_adj,neg_adj
403,712057220863668224,"RT @ggreenwald: The ""debate"" over Israel between Trump &amp; Clinton is going to be really exciting! They'll be dressing in the Israeli flag.",332,0,Twitter for Android,2016-03-21 23:24:05,44075260,emtgirl09,emtgirl09,2009-06-02 06:46:27,"EMT*Mommy*Liberal*feminist* equality*civil rights*pro choice*police reform* activist*
#BernieSanders #BernieOrBust",393,916,"Arizona, USA",Pacific Time (US & Canada),0,1.0,0.17577457265,0.176388888889,positive,0.375,0.5
404,712056978336456704,RT @thehill: Sanders defeats Clinton in Democrats Abroad primary by a margin of 2-to-1: https://t.co/namKOPY7ak https://t.co/DzEHTxQOfU,63,0,Twitter for Android,2016-03-21 23:23:07,949112370,dehubbard427,Derrick Hubbard,2012-11-15 05:41:44,Semper Fi!!,276,368,"Arizona, USA",Arizona,0,1.0,0.0,0.0,negative,0.28,0.035
405,712056692075171840,GOP front-runner tells CNN Clinton lacks 'strength' to be president:  https://t.co/UIYvqx91Pj,0,0,twitterfeed,2016-03-21 23:21:59,76636688,tjlazo,T.J. Lazo,2009-09-23 12:58:18,Member of Diamond Secrets Team with the Fastest Growing Team in the Trump Network. Our Team Has Automatic Lead Generation Systems to  Catapult You to Success,1584,1770,Arizona,Arizona,0,1.0,0.153846153846,0.0,positive,0.0,0.0
406,712056082097549312,"Hillary Clinton campaigns in Phoenix https://t.co/3rNYpncz8i
https://t.co/T7wGVJs404",5,6,Twitter Web Client,2016-03-21 23:19:33,17187236,12News,12 News,2008-11-05 12:15:42,"#Arizona's source for #breakingnews, #traffic, #weather, #sports and more. Got a news tip? Call us at 602-444-1212. Email photos or video to connect@12news.com.",95609,10667,"Arizona, USA",Arizona,0,1.0,0.0,0.0,positive,0.0,0.0
407,712055973137887233,After hearing what Hillary Clinton has to say. I hope she doesn't get elected 😂 #garbage,0,14,Twitter for iPhone,2016-03-21 23:19:08,3246070964,cobrown99,Connor B,2015-06-15 14:05:42,Perry Baseball,399,530,"Arizona, USA",,1,0.265,0.293400860835,0.0576993364822,negative,0.0,0.0
408,712055942016184320,RT @slone: 61% OF ISRAELIS SAY TRUMP WOULD BE GOOD FOR ISRAEL https://t.co/km10qkkjA8,62,0,Twitter for iPhone,2016-03-21 23:19:00,75736238,Mathiasian,Mathiasian,2009-09-20 06:38:54,"✞ conservative, Pro-Life, Constitutionalist. The GOPe will never stop working against the interests of America. Lets show the establishment their days are few.",35743,26463,Arizona,Mountain Time (US & Canada),0,1.0,0.0,0.0,positive,0.0,0.0
409,712055822273142784,"""Anger is not a strategy. We have to get together and figure out what we can to do to make a difference in people's lives."" - Clinton in AZ",13,15,TweetDeck,2016-03-21 23:18:32,17187236,12News,12 News,2008-11-05 12:15:42,"#Arizona's source for #breakingnews, #traffic, #weather, #sports and more. Got a news tip? Call us at 602-444-1212. Email photos or video to connect@12news.com.",95609,10667,"Arizona, USA",Arizona,0,1.0,0.156801745665,0.0587926309429,positive,0.375,0.2375
410,712055776341143553,The Republican race serves as a useful distraction from how bad things are for Clinton https://t.co/G0SnJ4YU6w,0,0,Mobile Web,2016-03-21 23:18:21,131096288,ArminKaikobad,Armin Kaikobad,2010-04-09 07:30:11,"Liberal Democrat, #FeelTheBern, Executive Producer, State Bar of Arizona, President of Acupuncture-CEUS. com Inc.",97,345,"Arizona, USA",Arizona,0,1.0,0.0580128205128,0.681547619048,positive,0.0,0.660714285714
411,712055588927176705,RT @azcentral: Hillary Clinton appears before enthusiastic Phoenix crowd; rally draws handful of protesters https://t.co/zfSoacj6CY https:/…,8,0,Twitter Web Client,2016-03-21 23:17:36,16373856,phxfloaz,Flo,2008-09-20 02:47:01,see profile picture,564,610,Arizona,America/Denver,0,1.0,0.631944444444,0.0,positive,0.625,0.0
412,712055247078760449,RT @Suns: . @EBled2 met 42nd President @billclinton here in Phoenix this past weekend. https://t.co/w6lWG6MUR6 https://t.co/A3OQOHNQZe,65,0,Twitter for iPhone,2016-03-21 23:16:14,27588463,shawnjsellers,Shawn Sellers,2009-03-30 05:03:37,"Diné. Brown University Alumni. NMH Alumni. Loyal fan of AZ Cardinals, Coyotes, Diamondbacks, SUNS, Robby Gordon, & Lewis Hamilton.",435,1338,"Phoenix, Arizona",Arizona,0,1.0,0.0615384615385,0.128846153846,positive,0.0,0.125
413,712055201419628545,Hillary Clinton rallies supporters in Phoenix https://t.co/fyHR6NDQVt,0,0,Hootsuite,2016-03-21 23:16:04,50099768,azcInsider,azcInsider,2009-06-23 20:56:36,"Breaking news on Arizona politics. Get our NEW apps! iPhone: http://t.co/kcHwSl9cba, iPad: http://t.co/HzzZ5FfuLG, Android: http://t.co/563Yi3rMaJ",7158,504,Arizona,Pacific Time (US & Canada),0,1.0,0.0,0.025,positive,0.0,0.0
414,712055164299939841,RT @dannowicki: Happening now at Carl Hayden High: @HillaryClinton firing up supporters in Phoenix. https://t.co/6iw1NZiBl7 https://t.co/o6…,8,0,TweetDeck,2016-03-21 23:15:55,596311249,AntBejarano,Anthony Bejarano,2012-06-01 09:44:43,Liberal politico. Film buff faker. Thinks too much for own good. Organizer @GenProgress. PoliSci/History @EACmonsters. Knowledge Bowl Supreme. #Hillary2016,825,2096,"#AZ01 | Thatcher, Arizona",Arizona,0,1.0,0.0,0.141666666667,positive,0.0729166666667,0.0104166666667
415,712054837295357952,Hillary Clinton appears before enthusiastic Phoenix crowd; rally draws handful of protesters https://t.co/zfSoacj6CY https://t.co/iYqDrangM3,8,7,Hootsuite,2016-03-21 23:14:37,13115682,azcentral,azcentral,2008-02-05 22:04:38,"Arizona's No. 1 local site. Follow us for breaking news, Things to Do, sports, politics and more.",177969,6118,Arizona ,Arizona,0,1.0,0.631944444444,0.0,positive,0.625,0.0
416,712054806886526976,"RT @washingtonpost: Immigration is the top issue as Clinton, Sanders square off in Arizona https://t.co/erhrskqhre",51,0,Twitter for Android,2016-03-21 23:14:29,139172366,Audrakat,Audrakat,2010-05-01 19:43:36,"I love animals, and encourage all shelters to contact the Animal Foundation in Las Vegas, Nevada. They have very successful program to get all pets happy homes",485,703,"Arizona, USA",America/Phoenix,0,1.0,0.0444711538462,0.0,negative,0.0929166666667,0.43375
417,712054664854777856,"RT @varepall: Bill Clinton slams Barack Obama's 'awful legacy' https://t.co/9uqI7nbZ5y via @DCExaminer

VRA https://t.co/5vCCbRJkMm",14,0,Twitter for Android,2016-03-21 23:13:56,610247272,swwithkids,Scott-haz Wilson,2012-06-16 20:08:05,"Tlááshchí'í • Tó dichíini • Tóbąąhí • Tłízíłání • Tonalea, AZ 
• Zurvita Independent Consultant • Zeal For Life",285,728,"Phoenix, Arizona",,0,1.0,0.0625,0.0,positive,0.0,0.0
418,712054613550051328,"LIVE NOW 🔴: Hillary Clinton campaigns in Phoenix, #Arizona https://t.co/3rNYpncz8i
https://t.co/qQ8yP8lvW2",8,17,Twitter Web Client,2016-03-21 23:13:43,17187236,12News,12 News,2008-11-05 12:15:42,"#Arizona's source for #breakingnews, #traffic, #weather, #sports and more. Got a news tip? Call us at 602-444-1212. Email photos or video to connect@12news.com.",95611,10667,"Arizona, USA",Arizona,1,0.265,0.0,0.0,positive,0.0,0.0
419,712054561637146624,Clinton Or Sanders? Did Obama Made His Move To Support One Of Them | USA Democratic News https://t.co/ixbTWOOynE,0,0,Mobile Web,2016-03-21 23:13:31,131096288,ArminKaikobad,Armin Kaikobad,2010-04-09 07:30:11,"Liberal Democrat, #FeelTheBern, Executive Producer, State Bar of Arizona, President of Acupuncture-CEUS. com Inc.",97,345,"Arizona, USA",Arizona,0,1.0,0.0459183673469,0.00109329446064,positive,0.0,0.0
420,712054292237193216,"""Before it was called #Obamacare it was called #Hillarycare"" - Hillary Clinton in Arizona https://t.co/3rNYpnuawS",2,3,TweetDeck,2016-03-21 23:12:27,17187236,12News,12 News,2008-11-05 12:15:42,"#Arizona's source for #breakingnews, #traffic, #weather, #sports and more. Got a news tip? Call us at 602-444-1212. Email photos or video to connect@12news.com.",95611,10667,"Arizona, USA",Arizona,2,0.127,0.134222919937,0.0204081632653,positive,0.0,0.0
421,712054239372177408,"RT @dannowicki: Clinton tells voters to vote ""for the kind of future you want"" and ""the kind of president you want."" Adds she wants them to…",2,0,Hootsuite,2016-03-21 23:12:14,13115682,azcentral,azcentral,2008-02-05 22:04:38,"Arizona's No. 1 local site. Follow us for breaking news, Things to Do, sports, politics and more.",177969,6118,Arizona ,Arizona,0,1.0,0.296354166667,0.305729166667,positive,1.27083333333,0.0416666666667
422,712053744280580096,"RT @Libertea2012: WATCH LIVE: CNN interviews Clinton, Sanders, and GOP candidates in ‘Final Five’… https://t.co/4Q2SseRJGH #NotMeUs https:/…",5,0,Twitter for Android,2016-03-21 23:10:16,711353466954735617,zangazeit1776,ZangaZeit1776,2016-03-20 00:47:37,"Pumpkins are good! 
#CitizensUnited is bad!
#DemSpring #99Rise #Bernie2016
#DemAwakening #NeverHillary #DumpDrumpf
   Post more tweets!! Hit the Streets!!",109,279,"Arizona, USA",,1,0.265,0.0,0.0,positive,0.0,0.0
423,712053709958569984,"(I'm tweeting like I'm at the Clinton speech, but to be clear I'm not. But lord #bless local news coverage. Thank you local news.)",0,1,TweetDeck,2016-03-21 23:10:08,596311249,AntBejarano,Anthony Bejarano,2012-06-01 09:44:43,Liberal politico. Film buff faker. Thinks too much for own good. Organizer @GenProgress. PoliSci/History @EACmonsters. Knowledge Bowl Supreme. #Hillary2016,825,2096,"#AZ01 | Thatcher, Arizona",Arizona,1,0.265,0.407982183258,0.00367647058824,positive,0.566636029412,0.0193014705882
424,712053688643231745,"FOX10Phoenix: RT SKrafftFox10: Hillary says times were good when Bill Clinton was president, bad with George W. Bush. Better with Obama. #F…",0,0,IFTTT,2016-03-21 23:10:03,703603733092044800,JamesWyseAZ,Arizona 100,2016-02-27 15:32:57,"https://t.co/x7IxYgBLtS Celebrating #Arizona over the last #100years. Proudly promoting #tourism, #localbusiness, #localnews and #sportsnews",35,13,"Arizona, USA",Pacific Time (US & Canada),1,0.265,0.688103563104,0.660714285714,positive,0.619047619048,0.660714285714
425,712053544489095168,Sanders has unpleasant news for Clinton https://t.co/jV8zeauzOd,0,0,Mobile Web,2016-03-21 23:09:28,131096288,ArminKaikobad,Armin Kaikobad,2010-04-09 07:30:11,"Liberal Democrat, #FeelTheBern, Executive Producer, State Bar of Arizona, President of Acupuncture-CEUS. com Inc.",97,345,"Arizona, USA",Arizona,0,1.0,0.00986842105263,0.651315789474,negative,0.0,0.625
426,712053185523752961,"RT @danmericaCNN: Clinton talks about the kind of president the country wants. Man in audience shouts, ""We want you!"" HRC responds, ""I want…",50,0,Twitter for iPhone,2016-03-21 23:08:03,387707281,mothergooseAZ,DL,2011-10-09 14:46:50,"in mourning for victims of gun violence,mother earth,civil rights,retirement, #uniteblue",1355,2266,"ARIZONA, USA",Pacific Time (US & Canada),0,1.0,0.179166666667,0.191666666667,positive,0.625,0.0
427,712052532458053632,"Investigate the violations of Massachusetts voting laws conducted by Bill Clinton on March 1, 2016. https://t.co/61BckeEb7F",0,0,Twitter Web Client,2016-03-21 23:05:27,16849063,stunatra,Stunatra,2008-10-19 07:20:44,"People are crazy and times are strange, I used to care but things have changed.",462,1528,Arizona,Arizona,0,1.0,0.108333333333,0.0,positive,0.0,0.0
428,712052476837363712,"RT @NickCiletti: Supporter just yelled to Hillary Clinton ""We want you!"" &amp; she responded ""I want you to want me!"" Crowd erupted in laughter…",16,0,TweetDeck,2016-03-21 23:05:14,596311249,AntBejarano,Anthony Bejarano,2012-06-01 09:44:43,Liberal politico. Film buff faker. Thinks too much for own good. Organizer @GenProgress. PoliSci/History @EACmonsters. Knowledge Bowl Supreme. #Hillary2016,825,2096,"#AZ01 | Thatcher, Arizona",Arizona,0,1.0,0.232291666667,0.282291666667,positive,1.0,0.0
429,712052229339897856,Shout out to @MamaRedfield just now from Clinton.,0,3,TweetDeck,2016-03-21 23:04:15,12789462,gfallar,George Fallar,2008-01-28 16:00:49,"Software Engineer, CTO Electronic Medical Records Company    Hockey is way more fun than politics. Opinions expressed are strictly my own. Seriously.",1104,1199,Arizona,Arizona,0,1.0,0.0,0.0,positive,0.625,0.2375
430,712052147555184644,RT @NaughtyBeyotch: Focus Group Calls Hillary Clinton ‘Worst Liar I Think I’ve Ever Seen #NTB https://t.co/Dy6Xdr1Xxc,7,0,Twitter for iPhone,2016-03-21 23:03:55,75736238,Mathiasian,Mathiasian,2009-09-20 06:38:54,"✞ conservative, Pro-Life, Constitutionalist. The GOPe will never stop working against the interests of America. Lets show the establishment their days are few.",35744,26462,Arizona,Mountain Time (US & Canada),1,0.265,0.120192307692,0.00160256410256,negative,0.0,0.0
431,712051839240314880,RT @phillyrich1: Bill Clinton Trashes Obama: 'Awful Legacy of the Last Eight Years' https://t.co/foaUnhSeSh via @WeeklyStandard,2,0,Twitter for iPhone,2016-03-21 23:02:42,328236641,teachM2fish,MDK,2011-07-03 00:33:51,"Independent conservative, educator, and voracious reader | I reject identity politics--only content of character matters |",120,345,Arizona,,0,1.0,0.0222222222222,0.166666666667,positive,0.0,0.0
432,712051758990696449,RT @12News: LIVE: Hillary Clinton campaigns in Phoenix at Carl Hayen Community High School right now. WATCH: https://t.co/3rNYpnuawS,3,0,Twitter for iPhone,2016-03-21 23:02:23,627096993,MarchingBand18,Heather S.,2012-07-05 03:35:24,I am a senior at Arizona State University,564,822,"Arizona, USA",Arizona,0,1.0,0.0,0.0,positive,0.330357142857,0.0
433,712051721355145217,"RT @12News: Hillary Clinton takes the stage at Carl Hayden Community HS in Phoenix, AZ. WATCH: https://t.co/3rNYpnuawS https://t.co/l2hW4LX…",10,0,TweetDeck,2016-03-21 23:02:14,596311249,AntBejarano,Anthony Bejarano,2012-06-01 09:44:43,Liberal politico. Film buff faker. Thinks too much for own good. Organizer @GenProgress. PoliSci/History @EACmonsters. Knowledge Bowl Supreme. #Hillary2016,825,2096,"#AZ01 | Thatcher, Arizona",Arizona,0,1.0,0.0257936507937,0.00992063492063,positive,0.0,0.0
434,712051696805875712,"RT @allahpundit: Video: Together we can put the “awful legacy of the last eight years” behind us, says … Bill Clinton? https://t.co/JqLthii…",25,0,Twitter Web Client,2016-03-21 23:02:08,373533486,0ryuge,ryuge,2011-09-14 19:07:10,"After all, there is no meaning to the Patriarch's coming from the west.",2513,2433,Arizona,,0,1.0,0.0474747474747,0.166666666667,positive,0.0222222222222,0.166666666667
435,712051638941388804,"Hillary Clinton takes the stage at Carl Hayden Community HS in Phoenix, AZ. WATCH: https://t.co/3rNYpnuawS https://t.co/l2hW4LXG0F",10,8,TweetDeck,2016-03-21 23:01:54,17187236,12News,12 News,2008-11-05 12:15:42,"#Arizona's source for #breakingnews, #traffic, #weather, #sports and more. Got a news tip? Call us at 602-444-1212. Email photos or video to connect@12news.com.",95612,10667,"Arizona, USA",Arizona,0,1.0,0.0257936507937,0.00992063492063,positive,0.0,0.0
436,712051469252317189,RT @MonicaCrowley: Reminders: Obama doesn't take kindly to this kind of thing.  And it's his @FBI.  Ahem.  https://t.co/8ayppd5j7m via @Ame…,92,0,Twitter for iPad,2016-03-21 23:01:14,394392730,noprezzie2012,DernDawn,2011-10-20 00:38:20,"Political correctness is overrated. Please lead, or get out of the way. Doing my part 2 expose the MSM.
#Schoolchoice #RetireMcCain #CruzCrew #2A",6076,5565,Phoenix - Flagstaff; Arizona ,Arizona,0,1.0,0.0306013431013,0.0291514041514,positive,1.1875,0.0
437,712051091953852416,"@MSNBC @realDonaldTrump Hillary Clinton will be our next President, first female President.",0,0,Twitter Web Client,2016-03-21 22:59:44,16373856,phxfloaz,Flo,2008-09-20 02:47:01,see profile picture,564,610,Arizona,America/Denver,0,1.0,0.133012820513,0.0416666666667,positive,0.104166666667,0.0416666666667
438,712051057401192449,WATCH HERE: Hillary Clinton gives campaign speech in Phoenix https://t.co/3rNYpnuawS https://t.co/ULNORyNzJa,1,2,Hootsuite,2016-03-21 22:59:36,17187236,12News,12 News,2008-11-05 12:15:42,"#Arizona's source for #breakingnews, #traffic, #weather, #sports and more. Got a news tip? Call us at 602-444-1212. Email photos or video to connect@12news.com.",95612,10667,"Arizona, USA",Arizona,0,1.0,0.027534965035,0.020979020979,positive,0.0,0.0
439,712050816711004160,#BREAKING: Hillary Clinton takes the stage in Phoenix  https://t.co/3rNYpnuawS,3,2,Hootsuite,2016-03-21 22:58:38,17187236,12News,12 News,2008-11-05 12:15:42,"#Arizona's source for #breakingnews, #traffic, #weather, #sports and more. Got a news tip? Call us at 602-444-1212. Email photos or video to connect@12news.com.",95612,10667,"Arizona, USA",Arizona,1,0.265,0.0257936507937,0.00992063492063,positive,0.0,0.0
440,712050647453937664,"RT @dennis_welch: Former Rep @GabbyGiffords stumps for Clinton and tells crowd that next year she wants to say, ""Madam President"" https://t…",15,0,TweetDeck,2016-03-21 22:57:58,10025982,azfamily,AZ Family,2007-11-07 08:22:20,"Live from the newsroom of KTVK-3TV and http://t.co/xo6r5wSNdN in Phoenix, Arizona. Delivering local news, weather, sports & just interacting. Visit us online at",130027,132,"Phoenix, Arizona",Arizona,0,1.0,0.0488636363636,0.116666666667,positive,0.0,0.0416666666667
441,712050647445557248,"RT @dennis_welch: Former Rep @GabbyGiffords stumps for Clinton and tells crowd that next year she wants to say, ""Madam President"" https://t…",15,0,TweetDeck,2016-03-21 22:57:58,204991039,CBS5AZ,CBS 5 News,2010-10-19 22:47:08,We give you the ANSWERS you need. The official Twitter page of @cbs5az News KPHO-TV in Phoenix.,35995,234,"Phoenix, Arizona",Arizona,0,1.0,0.0488636363636,0.116666666667,positive,0.0,0.0416666666667
442,712050525479436288,RT @nytpolitics: Sanders performs slightly better than Clinton in hypothetical general-election matchups against Trump https://t.co/vlDpvzb…,20,0,Twitter for iPhone,2016-03-21 22:57:29,1672053968,aidachavez_,aida,2013-08-15 02:54:18,ASU • journalism/political science • retweets ≠ endorsement • reporter for @nstarpost • I'm molly connolly • reverse catfish • compulsive heart breaker,544,292,arizona • cali • colorado,Central Time (US & Canada),0,1.0,0.875,0.0,positive,0.875,0.0
443,712050482328444928,RT @HuffPostPol: Hillary Clinton is actually raising more money from small donors https://t.co/Lg2lK2nQaE https://t.co/5JB4o4tZL3,90,0,Twitter Web Client,2016-03-21 22:57:18,23910844,WithoutaTRACE,Trace Vickrey,2009-03-12 06:12:33,I check #Facts Bullshit Misogynist Witch hunt Equality- Warrior #CATS #Nativelivesmatter #LGBT Abolitionist! Challenge Religion! #SheDidNotLie & I like Skittles,760,1260,Arizona,Arizona,0,1.0,0.0635683760684,0.272916666667,positive,0.125,0.2625
444,712050407887884288,"RT @washingtonpost: Immigration is the top issue as Clinton, Sanders square off in Arizona https://t.co/erhrskqhre",51,0,Twitter for iPhone,2016-03-21 22:57:01,1672053968,aidachavez_,aida,2013-08-15 02:54:18,ASU • journalism/political science • retweets ≠ endorsement • reporter for @nstarpost • I'm molly connolly • reverse catfish • compulsive heart breaker,544,292,arizona • cali • colorado,Central Time (US & Canada),0,1.0,0.0444711538462,0.0,negative,0.0929166666667,0.43375
445,712049941842173952,FOX10Phoenix: RT SKrafftFox10: Get ready people! Our live Twitter feed Hillary Clinton rally begins now.  #FOX10Phoenix,0,0,IFTTT,2016-03-21 22:55:10,703603733092044800,JamesWyseAZ,Arizona 100,2016-02-27 15:32:57,"https://t.co/x7IxYgBLtS Celebrating #Arizona over the last #100years. Proudly promoting #tourism, #localbusiness, #localnews and #sportsnews",35,13,"Arizona, USA",Pacific Time (US & Canada),1,0.265,0.293181818182,0.0875,positive,0.293181818182,0.0
446,712049940474818560,FOX10Phoenix: RT SKrafftFox10: Mark Kelly and Gabby Giffords at Hillary Clinton rally.  #fox10phoenix https://t.co/mi5uCsC9NQ,0,0,IFTTT,2016-03-21 22:55:09,703603733092044800,JamesWyseAZ,Arizona 100,2016-02-27 15:32:57,"https://t.co/x7IxYgBLtS Celebrating #Arizona over the last #100years. Proudly promoting #tourism, #localbusiness, #localnews and #sportsnews",35,13,"Arizona, USA",Pacific Time (US & Canada),1,0.265,0.0,0.0,positive,0.0,0.0
447,712049937249337344,"FOX10Phoenix: RT SKrafftFox10: US Labor Dept. Secretary Tom Perez at Hillary Clinton rally. Mark my words, he will… https://t.co/Za9dEcHB3L",0,0,IFTTT,2016-03-21 22:55:08,703603733092044800,JamesWyseAZ,Arizona 100,2016-02-27 15:32:57,"https://t.co/x7IxYgBLtS Celebrating #Arizona over the last #100years. Proudly promoting #tourism, #localbusiness, #localnews and #sportsnews",35,13,"Arizona, USA",Pacific Time (US & Canada),0,1.0,0.0,0.0,negative,0.0,0.0
448,712049914361094144,azcentral: RT photochowder: Mark Kelly and Gabby Giffords speaking now before Hillary Clinton rally. #OneNation #A… https://t.co/4U2BYw7gVz,0,0,IFTTT,2016-03-21 22:55:03,703603733092044800,JamesWyseAZ,Arizona 100,2016-02-27 15:32:57,"https://t.co/x7IxYgBLtS Celebrating #Arizona over the last #100years. Proudly promoting #tourism, #localbusiness, #localnews and #sportsnews",35,13,"Arizona, USA",Pacific Time (US & Canada),2,0.127,0.0,0.0,positive,0.5,0.0
449,712049901207744512,LIVE: Hillary Clinton campaigns in Arizona https://t.co/3rNYpnuawS,2,0,TweetDeck,2016-03-21 22:55:00,17187236,12News,12 News,2008-11-05 12:15:42,"#Arizona's source for #breakingnews, #traffic, #weather, #sports and more. Got a news tip? Call us at 602-444-1212. Email photos or video to connect@12news.com.",95612,10667,"Arizona, USA",Arizona,0,1.0,0.0,0.0,positive,0.0,0.0
450,712049797780389889,Why Sanders Trails Clinton Among Minority Voters https://t.co/Po9MToaa39,0,0,IFTTT,2016-03-21 22:54:35,2976474495,SEO_CorpEnt,Mary Dodson,2015-01-13 14:29:45,"Trends, how-tos, opinions, and tips on SEO, PPC, analytics, social media, and content.",48,9,"Arizona, Phoenix",Kyiv,0,1.0,0.0,0.0,positive,0.0,0.0
451,712049666473529344,"""Let's work together to make Hillary our president."" - Gabby Giffords https://t.co/3rNYpnuawS",0,1,TweetDeck,2016-03-21 22:54:04,17187236,12News,12 News,2008-11-05 12:15:42,"#Arizona's source for #breakingnews, #traffic, #weather, #sports and more. Got a news tip? Call us at 602-444-1212. Email photos or video to connect@12news.com.",95612,10667,"Arizona, USA",Arizona,0,1.0,0.0755479969766,0.046463664831,positive,0.375,0.0
452,712049631132160000,"Donald Trump: Trade 'Totally My Thing,' Not Hillary Clinton's 'Style' - Breitbart https://t.co/PjABcG0BtE via @BreitbartNews",0,0,Twitter Web Client,2016-03-21 22:53:55,121829079,A4mrMbro,A4mrMbro,2010-03-10 18:36:53,"former embryo, legal American, daughter, sister, student, Christian, patriot, employee, pet-mom, wife, mother, conservative, NRA member",349,979,Arizona,Pacific Time (US & Canada),0,1.0,0.0,0.0,positive,0.0,0.0
453,712049626627477504,"RT @NicoleCritesTV: Watch LIVE: Hillary Clinton campaign event at Carl Hayden High School in Phoenix #azfamily 

https://t.co/S6H29ZzFJh",2,0,TweetDeck,2016-03-21 22:53:54,10025982,azfamily,AZ Family,2007-11-07 08:22:20,"Live from the newsroom of KTVK-3TV and http://t.co/xo6r5wSNdN in Phoenix, Arizona. Delivering local news, weather, sports & just interacting. Visit us online at",130027,132,"Phoenix, Arizona",Arizona,1,0.265,0.0,0.0,positive,0.0,0.0
454,712049424193753094,"Hillary Clinton?,...C'mon! https://t.co/CsfCJw0JrS",0,0,Twitter for Android,2016-03-21 22:53:06,952076527,Joanna95570029,Joanna Appelwick,2012-11-16 17:18:15,,74,58,"Phoenix, Arizona",,0,1.0,0.0,0.0,positive,0.0,0.0
455,712049407647162369,#BREAKING: @GabbyGiffords takes stage at #HillaryClinton rally. https://t.co/3rNYpnuawS https://t.co/HBmj1r7xK2,1,9,TweetDeck,2016-03-21 22:53:02,17187236,12News,12 News,2008-11-05 12:15:42,"#Arizona's source for #breakingnews, #traffic, #weather, #sports and more. Got a news tip? Call us at 602-444-1212. Email photos or video to connect@12news.com.",95612,10667,"Arizona, USA",Arizona,2,0.127,0.0257936507937,0.00992063492063,negative,0.0,0.0
456,712049223961845760,RT @photochowder: Mark Kelly and Gabby Giffords speaking now before Hillary Clinton rally. #OneNation #AZPrimary https://t.co/vB5Ib5ifZ7,34,0,Hootsuite,2016-03-21 22:52:18,13115682,azcentral,azcentral,2008-02-05 22:04:38,"Arizona's No. 1 local site. Follow us for breaking news, Things to Do, sports, politics and more.",177974,6118,Arizona ,Arizona,2,0.127,0.0,0.0,positive,0.5,0.0
457,712048824785588224,RT @victorhugoTAZ: .@GabbyGiffords -at the Hillary Clinton rally in Phoenix @HillaryClinton https://t.co/8bFPLucDpN,10,0,Twitter for Android,2016-03-21 22:50:43,22846618,lehimesa,lehi,2009-03-04 22:33:48,artist mom granny wife teacher caretaker mule friend farm worker cat herder dog lover bird watcher voter. Pres Obama will be in history books forever!,4849,5336,arizona,Pacific Time (US & Canada),0,1.0,0.0,0.0,positive,0.0,0.0
458,712048730501844992,"RT @ABCLiz: Here in Phoenix, Gabby Giffords and Mark Kelly, take the stage ahead of Hillary Clinton https://t.co/HVRcwXojla",19,0,Twitter for Android,2016-03-21 22:50:21,22846618,lehimesa,lehi,2009-03-04 22:33:48,artist mom granny wife teacher caretaker mule friend farm worker cat herder dog lover bird watcher voter. Pres Obama will be in history books forever!,4849,5336,arizona,Pacific Time (US & Canada),0,1.0,0.0257936507937,0.00992063492063,positive,0.0,0.0
459,712048712281944064,RT @cristinalaila1: BREAKING: Bill Clinton makes emergency call to Obama reminding him to bring back some Cuban cigars. #CubaVisit https://…,346,0,Twitter Web Client,2016-03-21 22:50:16,2377792170,kbutler56,Kim Butler,2014-03-07 23:32:44,A rare breed these days. A Proud Conservative Canadian!                         Lover of American Iron!,1266,2069,"Alberta, Canada / Arizona, USA",Mountain Time (US & Canada),1,0.265,0.0686456400742,0.0351842035516,positive,0.0625,0.0729166666667
