,tweetID,tweetText,tweetRetweetCt,tweetFavoriteCt,tweetSource,tweetCreated,userID,userScreen,userName,userCreateDt,userDesc,userFollowerCt,userFriendsCt,userLocation,userTimezone,tweetHashtagCt,Weight,positiveness,negativeness,sentiment_label,pos_adj,neg_adj
281,711281049238528000,"RT @Johnathin79: CRUZ PORN READ---&gt;https://t.co/DiEgnzQlsE
#TrumpCard
#TrumpTrain
#MakeAmericaGreatAgain https://t.co/gLsbneZZcz",10,0,Twitter Web Client,2016-03-19 19:59:51,2971772202,ExcaliburReb03,Excalibur FreedomReb,2015-01-10 11:16:57,"IF YOU ARE anti-TRUMP DON'T FOLLOW ME.  IF YOU LIKE SANDERS THEN YOU MUST BE A COMMUNIST, SO DON'T FOLLOW ME...  IF YOU LIKE HILLARY THEN YOU ARE TOO STUPID...",307,873,"Quartzsite, Arizona, USA",Mountain Time (US & Canada),3,0.063,0.0,0.0,positive,0.0,0.0
282,711280795407650816,"RT @DLoesch: Trump shouts lies about Cruz at presser: “He supports amnesty!” Goes on to say that Cruz was expected to win NH. Um, what? LOL.",433,0,Twitter Web Client,2016-03-19 19:58:51,49455256,BarbieHitsBack,Barbie GC,2009-06-21 22:46:36,"Wife to the man of my dreams, mother of 5 and grandmother of13 and still counting.Passionate for all things political.",1456,1225,Phoenix Arizona,Arizona,0,1.0,0.344944638695,0.375351731602,positive,0.0,0.125
283,711279319755010048,"RT @DLoesch: Trump shouts lies about Cruz at presser: “He supports amnesty!” Goes on to say that Cruz was expected to win NH. Um, what? LOL.",433,0,Twitter for iPad,2016-03-19 19:52:59,394392730,noprezzie2012,DernDawn,2011-10-20 00:38:20,"Political correctness is overrated. Please lead, or get out of the way. Doing my part 2 expose the MSM.
#Schoolchoice #RetireMcCain #CruzCrew #2A",6076,5563,Phoenix - Flagstaff; Arizona ,Arizona,0,1.0,0.344944638695,0.375351731602,positive,0.0,0.125
284,711279174598598656,Adviser to John McCain Thinks Ted Cruz Will Pull Off Upset in Arizona https://t.co/jcx1LcsPSC,0,0,Twitter for iPhone,2016-03-19 19:52:24,382483879,EMichaelGannon,E Michael Gannon,2011-09-30 04:37:25,Summarize myself in fewer than 160 characters? You've got to be kidding!,30,68,"Scottsdale, Arizona",Pacific Time (US & Canada),0,1.0,0.0,0.0,positive,0.0,0.0
285,711279170135851008,"Purpose of gov't ""...to secure the Blessing of Liberty to Ourselves and our Posterity..."" @tedcruz does that! #Cruz https://t.co/gShPGl5WQQ",0,0,Twitter Web Client,2016-03-19 19:52:23,4827687198,jedwardsavary,Jon Savary,2016-01-28 23:52:53,"Project manager by trade, Husband, father, grandfather by grace of God.",184,261,"Arizona, USA",,1,0.265,0.0464743589744,0.0192307692308,positive,0.15,0.08
286,711279121721008128,@meetthepress @realDonaldTrump @MittRomney Cruz is a do nothing politician. His kind are also ruining Canada. #politiciansarehacks,0,1,Twitter Web Client,2016-03-19 19:52:12,706647633440296960,SFRinAZ1,SfrinAZ,2016-03-07 01:08:19,HARDCORE TRUMP SUPPORTER. Trump haters will be Blocked. Trump supporters are my family! #AlwaysTrump #MakeAmericaGreatAgain @realDonaldTrump,1,19,"Arizona, USA",,1,0.265,0.0854700854701,0.111111111111,positive,0.625,0.0
287,711279054800879616,RT @AmBeachy: @gayla415 Cruz has won 9 states and that is enough to automatically be nominated on the first ballot at our GOP Convention! G…,1,0,Twitter for iPad,2016-03-19 19:51:56,146139991,gayla415,Gayla,2010-05-20 17:56:19,"Texas born,NY Raised,Wife,Mother,Followed by Ted Cruz, &Alveda King, CONSTITUTION,Conservative,Love God,Family,FreedomFighter Liberty #TGDN #TCOT #PATRIOTS LD23",13338,14389,Arizona,Pacific Time (US & Canada),0,1.0,0.546727395412,0.0263157894737,positive,0.229166666667,0.625
288,711278867311276033,RT @StephaniScruggs: Notice that the Left is not trying to stop Ted Cruz - They know they have nothing to fear from him.... https://t.co/jj…,26,0,Twitter for iPhone,2016-03-19 19:51:11,3153399655,grammyoftwins1,Carolyn,2015-04-13 19:39:28,AMERICAN'S have spoken......hear us ROAR!!!! VOTE TRUMP 2016! let's take AMERICA BACK....BY THE PEOPLE and FOR THE PEOPLE,425,100,"Arizona, USA",,0,1.0,0.267578211262,0.465659223817,negative,0.0,0.5625
289,711278608669487104,RT @Gawker: Is Ted Cruz the tragically deceased Princess Diana? https://t.co/mBdPb5Lhz5 https://t.co/Xxi3cWdQt8,1074,0,Twitter for iPhone,2016-03-19 19:50:09,450969948,amikyaryyet,michaela,2011-12-30 21:55:19,♡ ♡,508,281,"Arizona, USA",Arizona,0,1.0,0.0288461538462,0.5,positive,0.0,0.5
290,711278179382484992,"RT @2ALAW: I think everyone is getting sidetracked over Trump and Cruz. COME ON PATRIOTS LETS UNITE!!
THE ENEMY IS HILLARY https://t.co/Azw…",280,0,Twitter for Android,2016-03-19 19:48:27,3266469216,Sheepdogleader,Tom McWilliams,2015-07-02 22:40:00,"Child of Heavenly Father, Rosalyn's loving husband, Father of 3, Dad to Dozens. Grandfather, Retired U.S. ARMY, Life Leadership member, entrepreneur,  dreamer.",816,1158,Arizona,,0,1.0,0.16639957265,0.13875534188,positive,0.375,0.0
291,711278003465007105,"Cruz is the right guy.  Too bad @FoxNews won't carry his #AZ events live! @realdonaldtrump @tedcruz 
Last night:
https://t.co/axi9BvDc2n",0,1,Twitter for iPad,2016-03-19 19:47:45,394392730,noprezzie2012,DernDawn,2011-10-20 00:38:20,"Political correctness is overrated. Please lead, or get out of the way. Doing my part 2 expose the MSM.
#Schoolchoice #RetireMcCain #CruzCrew #2A",6076,5563,Phoenix - Flagstaff; Arizona ,Arizona,1,0.265,0.449059447497,0.828943452381,negative,0.330357142857,0.660714285714
292,711277389683142656,Cruz owes no one he can't be bought. He's life work prove that. DT buys ppl what the hell is the difference? A crook https://t.co/GkdXoTLIG0,0,2,Twitter for iPad,2016-03-19 19:45:19,146139991,gayla415,Gayla,2010-05-20 17:56:19,"Texas born,NY Raised,Wife,Mother,Followed by Ted Cruz, &Alveda King, CONSTITUTION,Conservative,Love God,Family,FreedomFighter Liberty #TGDN #TCOT #PATRIOTS LD23",13338,14389,Arizona,Pacific Time (US & Canada),0,1.0,0.349358974359,0.0,negative,0.139285714286,0.05
293,711277206685638656,"RT @JaredWyand: Cruz supporting execution of gays doesn't represent our values @jaketapper @seanhannity

Why are you ignoring it?
https://t…",1283,0,Twitter Web Client,2016-03-19 19:44:35,1902827713,patechinois1,patechinois,2013-09-25 04:16:14,"Meat&Potatoes, w/a little corn thrown in. Do try to ketch up.
Left/Islam joined to destroy ability to ask question WHY?, a distinguising virtue of Western Civ",408,278,"Arizona, Montréal",,0,1.0,0.173805361305,0.147261072261,positive,0.3125,0.0
294,711276766229176320,Come to the Beck Cruz circus tent..And see the Bush GOP animals and their tricks...Also appearing..The Anointed Cruz https://t.co/5A5257YWmO,0,0,Twitter Web Client,2016-03-19 19:42:50,48774099,maverickpost,Maverick Post,2009-06-19 17:49:06,Tired of the useless Washington Money Mafia. Time for the citizen shoe to go up their ass ..Trump supporter. Because who else has to balls to do it..,327,405,"Arizona, USA",Central Time (US & Canada),0,1.0,0.0375,0.00104166666667,positive,0.0,0.0
295,711276687481122816,"RT @Writeintrump: Lindsey Graham is backing Ted Cruz, which is unusual for him since typically he prefers guys getting behind him.",189,0,Twitter for iPhone,2016-03-19 19:42:31,61399163,GreyCoopre,Grey Coopre,2009-07-30 05:17:38,Communiqués from a back country flaneur.,80,457,"Auteur, Arizona",Pacific Time (US & Canada),0,1.0,0.663942307692,0.0954861111111,positive,0.138888888889,0.0833333333333
296,711276313919623168,RT @_HankRearden: Remember: Cruz supports the protesters blocking PHX Trump rally. He doesn't think 1A applies to Trump. #AZPrimary https:/…,270,0,Twitter for iPhone,2016-03-19 19:41:02,301212396,TigCook,Ticook,2011-05-19 02:35:01,"Conservative/patriotic/Catholic/hispanic woman who follows Rush Limbaugh, Donald Trump, Ted Cruz, Sarah Palin and Mark Levin.",1594,1241,Arizona,Hawaii,1,0.265,0.206818181818,0.102509469697,negative,0.0,0.0
297,711276046780215299,RT @AZAustin43: Cruz might win AZ. Smallest crowd ever! Sad!  https://t.co/VgdlPvixtv,1,0,Twitter Web Client,2016-03-19 19:39:59,2468342486,MarcyJMiller,MarcyJMiller,2014-04-28 22:27:55,"Author, photographer, equestrienne, polymath-in-training, desert rat. BA Eng. Lit. PBK.   Ret'd LEO / LT.",1777,3054,Arizona.,Pacific Time (US & Canada),0,1.0,0.15625,0.0,negative,0.0,0.0
298,711275776507678720,"RT @Lynn_Rose1: If Trump won't debate Cruz one-one, Republican voters should take the cue.  He's afraid.  He doesn't have answers. https://…",50,0,Twitter for Android,2016-03-19 19:38:54,4763727018,AZchilly,AZchilly,2016-01-15 17:07:58,"Staunch Conservatarian that will attack secular humanism, progressivism, and general BS with irreverent snarky lashes. My political flavor is #cruz2016 .",731,1569,"Arizona, USA",,0,1.0,0.040469764154,0.649217193625,positive,0.0,0.0
299,711275440183205888,Cruz might win AZ. Smallest crowd ever! Sad!  https://t.co/VgdlPvixtv,1,2,Twitter for iPhone,2016-03-19 19:37:34,2546408312,AZAustin43,Austin Smith,2014-06-04 15:57:39,Grand Canyon University. Pre-Law. Outdoorsman. Contributor at @OUTSETMagazine. Please clap.,1162,358,The Arizona Territory ,Pacific Time (US & Canada),0,1.0,0.15625,0.0,negative,0.0,0.0
300,711275339914186752,RT @TopinoJoey: Ted Cruz is for NAFTA as well as Kasich it's a bad bad decision....taking our business overseas. .#TRUMPNATION,1,0,Twitter for iPad,2016-03-19 19:37:10,587913152,loriann2639,Lori,2012-05-23 01:44:36,"Live, Love, Laugh!! Life is not a dress rehersal! God Bless America Trump 2016",144,200,Arizona,,1,0.265,0.0288461538462,1.32142857143,negative,0.666666666667,1.32142857143
301,711275218010923008,RT @_HankRearden: Remember: Cruz supports the protesters blocking PHX Trump rally. He doesn't think 1A applies to Trump. #AZPrimary https:/…,270,0,Twitter for iPad,2016-03-19 19:36:41,587913152,loriann2639,Lori,2012-05-23 01:44:36,"Live, Love, Laugh!! Life is not a dress rehersal! God Bless America Trump 2016",144,200,Arizona,,1,0.265,0.206818181818,0.102509469697,negative,0.0,0.0
302,711275159630389248,"Graham/Romney endorsmnts are poison. Planned maybe?  Cruz hardly needs them. We'll see at RNC how ""the rest"" roll. @yatescr3 @Doodle66",0,2,Twitter Web Client,2016-03-19 19:36:27,788255594,djaznh,deb-az,2012-08-29 01:28:18,"Veteran Former DNC member who wandered out of the fog.. Republican by definition, not, GOP. Support #TedCruz2016  #CruzCrew #Prolife",2121,2090,Arizona and New Hampshire,,0,1.0,0.0663461538462,0.209375,positive,0.0,0.0
303,711275075664617472,"RT @ChristiChat: Tale of 2 teams

➖GOPe
➖Soros anarchists
➖Cruz bots
➖Socialist Dems

Versus

➖#Trump2016 
➖We The People

⭐️WINNER
✔️ #Tea…",285,0,Twitter for iPhone,2016-03-19 19:36:07,240367875,steverbridges,Stephen R Bridges,2011-01-19 19:25:14,"One of the leading automotive dealership consultants in the industry.Website Conversion, Digital Marketing, Process Management, Phone Skills, Proactive Chat",336,892,"Mesa, Arizona",Pacific Time (US & Canada),2,0.127,0.0,0.0,positive,0.0,0.0
304,711274854641631232,Grayson Allen looks like the love child of Coach K and Ted Cruz.,0,0,Twitter for iPhone,2016-03-19 19:35:14,25024774,Jordan_D23,Jordan Dicksen,2009-03-18 04:02:22,"2012 University of Arizona grad, love sports and my dog Kane",155,609,"Tucson, Arizona",Arizona,0,1.0,0.0416666666667,0.00833333333333,positive,0.1875,0.015625
305,711274846164914176,"RT @js_jennings: @AZConservative1 @AZInformer can you believe the rioting &amp;violence at the Cruz rally last night?Oh, wait, nevermind https:…",8,0,Twitter for iPad,2016-03-19 19:35:12,394392730,noprezzie2012,DernDawn,2011-10-20 00:38:20,"Political correctness is overrated. Please lead, or get out of the way. Doing my part 2 expose the MSM.
#Schoolchoice #RetireMcCain #CruzCrew #2A",6077,5563,Phoenix - Flagstaff; Arizona ,Arizona,0,1.0,0.147222222222,0.166666666667,negative,0.0222222222222,0.166666666667
306,711274638685286400,"Cruz Said He Opposed The #DCCartel Then They Bought Him Off

#AZprimary #UTcaucus 

#tcot #nra #ccot #copolitics https://t.co/6lFaIGkF4l",3,2,TweetDeck,2016-03-19 19:34:23,45156531,VotingFemale,Voting Female,2009-06-06 16:04:32,"I'm A Blogger, Constitution Defender, NRA/GOA Member & Conservative Watch Kitty. Supporter Of Trump • Love Sarah Palin #TCOT #NRA #CCOT",20589,20560,Phoenix Arizona,Arizona,7,0.005,0.135416666667,0.03125,positive,0.0,0.0
307,711274582821351424,RT @JonathanHoenig: Ted Cruz for President https://t.co/Basgq9fCIg,1221,0,Twitter for Android,2016-03-19 19:34:10,268423416,corkysez,Corky #COSProject,2011-03-18 18:59:21,Christian ~ Conservative ~ Pro-life ~ Convention of States ~ #ccot ~ #tcot ~ #NeverTrump ~ #TeamMarco,3262,3239,~ Arizona USA ~,,0,1.0,0.0,0.0,positive,0.0,0.0
308,711274350393958400,RT @USAforTrump2016: Top NRA member Jan Morgan has just withdrawn her endorsement of Ted Cruz in favor of Donald Trump! Please share this h…,281,0,Twitter for iPhone,2016-03-19 19:33:14,329688749,AZ_GoodLife,AZ Good Life,2011-07-05 13:35:31,"Majored in Sales Process, Productivity & Performance Improvement with a Minor in        Sales Recruiting  and  Training.  Trump supporter #Trump2016",2388,3313,Arizona (born & raised Texan),Arizona,0,1.0,0.0133406432749,0.0679824561404,positive,0.625,0.3125
309,711273786239127552,"RT @SBNation: Meanwhile, Duke's Grayson Allen has an uncanny resemblance to Ted Cruz: https://t.co/nj6st3eBKf https://t.co/TDt2k9OMhD",821,0,TweetDeck,2016-03-19 19:31:00,20642872,realBJP,Brian Pedersen,2009-02-12 00:25:07,Bleacher Report college basketball/football writer. Energy drink connoisseur. Idle time avoider. Lover of unfortunate acronyms.,931,556,"Sahuarita, Arizona",Arizona,0,1.0,0.166118421053,0.276315789474,positive,0.15625,0.25
310,711272595765592064,Grayson Allen kinda looks like a young Ted Cruz,1,3,Twitter for iPhone,2016-03-19 19:26:16,458494047,matt_haage,Matt Haage,2012-01-08 16:40:15,crock pots suck.,150,133,"Arizona, USA",Eastern Time (US & Canada),0,1.0,0.116666666667,0.0833333333333,positive,0.2625,0.090625
311,711272288688017409,"@occupypolitix I'm no fan of Trump, I am voting for Cruz. But I am a fan of our rights, all of us, not just the radical and selfish few.",1,2,Twitter for iPad,2016-03-19 19:25:03,4729258724,Michael_Priebe_,Michael Priebe,2016-01-08 16:55:22,"Christian. Husband, dad, grandpa. #USAF vet. #Conservative. #Steelers. H-D rider. #PGR member. Retired Security Professional. Ask B4 add 2 lists or I block you.",335,344,Arizona,Arizona,0,1.0,0.457692307692,0.0,positive,1.1875,0.0
312,711272066524127234,"Kasich RIPS into Romney's Cruz endorsement, pretty much DOOMING him in Utah primary... https://t.co/jqePACp4Vw",0,0,Linkis.com,2016-03-19 19:24:10,34089599,katscolor,Kathy Tucker,2009-04-21 23:29:27,"https://t.co/tE4T22bnpt.Freedom.Conservative .Pro gun. My family. Mother,Grandmother",829,1402,"Mesa,Arizona",Arizona,0,1.0,0.0,0.0,positive,0.21875,0.25
313,711271681323470849,They aren't friendly they R progressive like U.U know nothing bout CRUZ or U would know they hate him bcuz he's 4ppl https://t.co/3e0H0YSGh4,0,3,Twitter for iPad,2016-03-19 19:22:38,146139991,gayla415,Gayla,2010-05-20 17:56:19,"Texas born,NY Raised,Wife,Mother,Followed by Ted Cruz, &Alveda King, CONSTITUTION,Conservative,Love God,Family,FreedomFighter Liberty #TGDN #TCOT #PATRIOTS LD23",13340,14391,Arizona,Pacific Time (US & Canada),0,1.0,0.752962315462,0.763888888889,negative,0.638888888889,0.0295138888889
314,711271492189720576,Romney intentionally lost to OBAMA just like TED CRUZ will intentionally lose to Clinton. Why? For the money and promise of place in NWO.,1,0,Twitter for Android,2016-03-19 19:21:53,4304419334,worldgoneweird,jc,2015-11-20 20:14:09,"Christian I love  America and what it really stands for..none of that let everyone in crap.  I specialize in geneology US, France and Britain",750,949,"Arizona, USA",,0,1.0,0.0,0.454545454545,negative,0.815972222222,0.453125
315,711271491183071232,"Cruz rally was bigger last night. @ThomasGalvin 
#TrumpRally shrinkage",0,1,Twitter for iPad,2016-03-19 19:21:52,394392730,noprezzie2012,DernDawn,2011-10-20 00:38:20,"Political correctness is overrated. Please lead, or get out of the way. Doing my part 2 expose the MSM.
#Schoolchoice #RetireMcCain #CruzCrew #2A",6077,5563,Phoenix - Flagstaff; Arizona ,Arizona,1,0.265,0.176068376068,0.166666666667,negative,0.147222222222,0.166666666667
316,711270629912096769,"Been bashing Romney, Rubio, Cruz etc for several minutes",0,2,Twitter for iPhone,2016-03-19 19:18:27,1565260310,patmoy95,Patrick Moyse,2013-07-03 08:46:37,"Statistically, we're headed toward an age where everybody's gonna be, like, caramel and queer.",295,457,Arizona,,0,1.0,0.0833333333333,0.305555555556,negative,0.0833333333333,0.0555555555556
317,711270321135824897,"RT @realDonaldTrump: Failed Presidential Candidate Mitt Romney was campaigning with John Kasich &amp; Marco Rubio, and now he is endorsing Ted …",4080,0,Twitter for Android,2016-03-19 19:17:13,278559967,Sheehanstoons,Sheehanstoons,2011-04-07 14:27:05,Our Hooves are made for ~ Kick'n ~  May the Luck of the Irish be smilin' on you!  The Official Sheehanstoons ~ Of Tweets. #AZ #MI #Inds & #Dems #USA,1809,2321,Sonoran Desert Of Arizona USA,America/Boise,0,1.0,0.307692307692,0.409090909091,positive,0.0,0.0
318,711269995091722240,"FOX10Phoenix: RT SKrafftFox10: #Trump says Ted Cruz is a liar and what is worse,a Canadian running for U.S. President. #FOX10Phoenix",0,0,IFTTT,2016-03-19 19:15:56,703603733092044800,JamesWyseAZ,Arizona 100,2016-02-27 15:32:57,"https://t.co/x7IxYgBLtS Celebrating #Arizona over the last #100years. Proudly promoting #tourism, #localbusiness, #localnews and #sportsnews",35,13,"Arizona, USA",Pacific Time (US & Canada),2,0.127,0.208055944056,0.2985,positive,0.0416666666667,0.0
319,711269544011046913,RT @JohnAvlon: Arizona Republic: Reject Donald Trump and Ted Cruz. Vote John Kasich instead https://t.co/uo9KdPFs2f via @azcentral,5,0,Twitter for iPhone,2016-03-19 19:14:08,2270705514,Caroline221B,Caroline,2013-12-31 18:41:11,"News junkie, student, cat lover",86,328,Arizona,,0,1.0,0.0,0.0,positive,0.0,0.0
320,711266904569065473,"@Senate_GOPs John Boehnor said Ted Cruz was ""LUCIFER"" should America be surprised Cruz is now your number one man..I DON'T THINK SO!!!!",0,0,Twitter Web Client,2016-03-19 19:03:39,1421458982,PAWarnhoff,Phyllis Anne,2013-05-11 19:53:31,,4147,4342,Living in sunny Arizona,,0,1.0,0.144376456876,0.0192307692308,negative,0.139285714286,0.3
321,711266475441434624,"Ted Cruz tours border, stumps at Phoenix rally: Republican presidential candidate Ted Cruz toured Arizona's bo... https://t.co/0UkWJiA1ec",0,0,twitterfeed,2016-03-19 19:01:57,1594381536,TheTruckStopInc,Truck Stop,2013-07-14 22:35:37,Tucson's finest Trucks and SUV's,1089,1895,"Tucson, Arizona ",Arizona,0,1.0,0.0,0.125,positive,0.0,0.125
322,711266456642543616,RT @TheBardockObama: What if the grandkids never showed up to eat the burgers with Paw Paw because Ted Cruz the Zodiac killer killed them?,112,0,Twitter for iPhone,2016-03-19 19:01:52,2599106336,daltonseviltwin,dalton boi,2014-07-02 04:31:00,,243,288,"Arizona, USA",,0,1.0,0.164880952381,0.0809523809524,negative,0.0729166666667,0.0104166666667
323,711266296139124736,"RT @TheMarcoIslas: Bernie talks about immigration reform. Ted Cruz, a Latino candidate, talks about denying it. Latinos, we know who's best…",84,0,Twitter for Android,2016-03-19 19:01:14,2183461086,peachykanye,spicy,2013-11-09 02:58:33,Bernin' up,60,57,"Arizona, USA",,0,1.0,0.145292207792,0.160714285714,positive,0.0,0.0
324,711266021290606592,New: Ted Cruz patrols the Arizona border. - https://t.co/ALUJSDdlk0 #azright,0,0,MorningInArizona,2016-03-19 19:00:08,242114285,MorninginAz,Dawn West,2011-01-24 00:14:22,A group of conservative bloggers trying to make Arizona the best state in the Union.,520,339,"Tucson, Arizona",Arizona,1,0.265,0.125,0.0,negative,0.0,0.0
325,711265996447715328,"@HouseGOP John Boehnor said Ted Cruz was ""LUCIFER"" should America be surprised Cruz is now your number one man!!!",0,0,Twitter Web Client,2016-03-19 19:00:02,1421458982,PAWarnhoff,Phyllis Anne,2013-05-11 19:53:31,,4147,4342,Living in sunny Arizona,,0,1.0,0.139568764569,0.0,positive,0.139285714286,0.3
326,711265576186851328,"RT @jebmke: @theHoundDawg @randyprine Cruz worse than Trump;  Trump followers worse the Cruz followers.  Weird, but true.",4,0,Twitter for iPhone,2016-03-19 18:58:22,2557881288,DutchDelights13,Tanya,2014-06-10 01:19:08,"Single mom, counselor, teacher, news junkie. Love sunshine, the ocean, dolphins and whales.",180,409,"Arizona, USA",,0,1.0,0.461916666667,0.2985,positive,0.278,0.597
327,711265387220848640,"@Orlafay13 @WDFx2EU @BernieSanders @tedcruz Cruz is a political whore, the things he's doing out of desperation is showing his true colors",1,3,Twitter for Android,2016-03-19 18:57:37,3105709501,nailbender3,nailbender,2015-03-24 01:26:32,"Navy Vet
Seabees Battalion MCB133

TRUMP 2016 I'M ALL IN!",490,489,"Arizona, USA",,0,1.0,0.447916666667,0.0192307692308,positive,0.322916666667,0.2375
328,711264967857573888,Ted Cruz From Obama’s Open Border: ‘This Is A National Security Crisis’ - Breitbart https://t.co/U32KizWwpc via @BreitbartNews,0,0,Twitter Web Client,2016-03-19 18:55:57,333591351,Customsbigbear,Customsbigbear,2011-07-11 19:39:09,"Husband, Father, LEO, US Infantry Veteran,  Conservative, Boxer Dogs, Red Wings Fan.",1302,1168,"Arizona, USA",Arizona,0,1.0,0.0288461538462,0.0,positive,0.0,0.0
329,711264509990580224,"What, no pic, @colleen_cruz? #tcrwp #tcrwpreunion  https://t.co/eoYXlYCues",0,1,Twitter Web Client,2016-03-19 18:54:08,21540116,azajacks,Allison Jackson,2009-02-22 03:00:45,"3rd grade teacher- make that lead learner in my classroom; lover of books, teaching, & learning. Tech newbie. Proud member of #NerdyBookClub! I teach to learn",2562,2146,Arizona,Pacific Time (US & Canada),2,0.127,0.0,0.0,positive,0.0,0.0
330,711264244608557056,Grayson Allen or Ted Cruz?,0,1,Twitter for iPhone,2016-03-19 18:53:05,319861116,PaulPeevyhouse,Paul Peevyhouse,2011-06-18 21:44:50,Arizona State alumn,247,376,"Tempe, Arizona",Arizona,0,1.0,0.0,0.0,positive,0.0,0.0
331,711264158180708353,"@marieann66 @Picassokat @pebblerick @democraticguy John Boehner said Ted Cruz was ""LUCIFER"" the BIBLE THUMPERS are now saying OK CRUZ IT IS!",1,2,Twitter Web Client,2016-03-19 18:52:44,1421458982,PAWarnhoff,Phyllis Anne,2013-05-11 19:53:31,,4147,4342,Living in sunny Arizona,,0,1.0,0.109265734266,0.0,positive,0.0,0.0
332,711263880337424384,"@DLoesch THANKS, @MittRomney Rubio out, Trump up; latest poll should have Cruz, establishment quaking |BizPac Review https://t.co/PN23Ludpy1",0,0,Twitter for iPad,2016-03-19 18:51:38,395462175,mauriciod44,Mauricio D Mendez,2011-10-21 18:03:41,"Nationality: American: Conservative: Allegiance to one Flag: One Country, USA: One Language, English: One Culture, American: Ethnicity: Conservative Hispanic",2285,1981,Arizona,Arizona,0,1.0,0.134868421053,0.0263157894737,positive,0.0625,0.0
333,711263204010172416,"RT @PatrickSvitek: ""Don't settle for someone whose entire agenda can fit on a bumper sticker,"" Mike Lee says, pitching Cruz's presidential …",63,0,Twitter for Android,2016-03-19 18:48:57,282184842,VapinAZ,Brian,2011-04-14 18:25:08,#TCOT #Conservative #TedCruz #2ndAmendment #NRA ΜΟΛΩΝΛΑΒΕ #AmericanLegion #PriorService #OathKeeper #OSUBuckeyes #Vaping since 8/1/10 #Bacon #Galatians67,7338,7488,"Chandler, Arizona",Arizona,0,1.0,0.346768971769,0.165484977985,positive,0.666666666667,0.125
334,711262528316133378,RT @ahs6482: @MrEdTrain @YouTube LOL Cruz is a mumbling fool. Trump 16.,3,0,Twitter for Android,2016-03-19 18:46:16,3034992840,cochran_bob,Bob Cochran,2015-02-21 17:35:06,"Retired married 50 years, 2A all of constitution, USCCA, should be no political parties just Americans. All lives matter, responsible licensed CCW.",462,556,"Concho, Arizona",,0,1.0,0.0288461538462,0.0,positive,0.0,0.0
335,711261153322598401,"RT @phoenixnewtimes: #TedCruz Super Pac tried to ban ""liberal media"" from the candidate's #Phoenix speech: 
https://t.co/Tf8AUGnvc1 https:/…",30,0,Twitter Web Client,2016-03-19 18:40:48,26663678,cpmaz,Craig McDermott,2009-03-26 02:14:46,"Working class guy, political blogger, wise@$$",544,650,Arizona,Arizona,2,0.127,0.245833333333,0.0388888888889,positive,0.5,0.0
336,711260197096796160,RT @mitchellvii: And Cruz ends up looking completely INSIGNIFICANT because NO SCUMBAG DEPENDENT HIPPIES are protesting him.,309,0,Twitter Web Client,2016-03-19 18:37:00,1902827713,patechinois1,patechinois,2013-09-25 04:16:14,"Meat&Potatoes, w/a little corn thrown in. Do try to ketch up.
Left/Islam joined to destroy ability to ask question WHY?, a distinguising virtue of Western Civ",408,278,"Arizona, Montréal",,0,1.0,0.0705128205128,0.00833333333333,negative,0.0729166666667,0.135416666667
337,711259876324982784,RT @TeamTedCruz: “I trust Ted Cruz. I trust that he’s going to do the things he says he’s going to do.” - Steve Ronnebeck https://t.co/wpDi…,170,0,Twitter for Android,2016-03-19 18:35:43,194744637,smithpaulina,Paula Smith,2010-09-24 22:18:35,Conservative. Happy-Go-Lucky. Believer.,331,501,Arizona,,0,1.0,0.288393550894,0.0220085470085,positive,0.0,1.0
338,711259149925900288,"RT @Conservative_VW: If Trump wins AZ &amp; then WI

It is then mathematically over for Cruz to get to 1237 &amp; he becomes just like Kasich😏 http…",19,0,Twitter for iPhone,2016-03-19 18:32:50,1534688612,arizonaonmymind,Kim & Earl,2013-06-20 18:50:17,"The early bird catches the worm, but the second mouse gets the cheese! If you dont like this country, GET OUT! Keeping it real 24/7. #MakeAmericaGreatAgain",3090,2891,"Arizona, USA",,0,1.0,0.233707264957,0.0121527777778,positive,1.1875,0.015625
