,tweetID,tweetText,tweetRetweetCt,tweetFavoriteCt,tweetSource,tweetCreated,userID,userScreen,userName,userCreateDt,userDesc,userFollowerCt,userFriendsCt,userLocation,userTimezone,tweetHashtagCt,Weight,positiveness,negativeness,sentiment_label,pos_adj,neg_adj
567,711643888541274113,If Hillary Clinton wins the election it will be the end for the Jews in Israel Cruz can't win the election so it's Donald Trump or the end,0,0,Twitter for Android,2016-03-20 20:01:39,4304419334,worldgoneweird,jc,2015-11-20 20:14:09,"Christian I love  America and what it really stands for..none of that let everyone in crap.  I specialize in geneology US, France and Britain",750,948,"Arizona, USA",,0,1.0,0.341346153846,0.0,positive,0.0,0.0
568,711643614766469120,"At Phoenix rally, Ted Cruz calls John Kasich 'the spoiler'
https://t.co/oGCtzRqvNt https://t.co/VwOhqAvj8B",2,3,TweetDeck,2016-03-20 20:00:34,2753211010,PhoenixDailyNew,Phoenix Daily News,2014-08-28 09:32:33,"Local news, sports, business, politics, entertainment, travel and opinion for Phoenix and Arizona. DM us 24/7",13636,5405,"City of Phoenix, Arizona",Arizona,0,1.0,0.0382653061224,0.0102040816327,positive,0.0,0.0
569,711643602871451648,"RT @lendergram: Check out this cool #refinance calculator to figure out your potential savings.
Try it Out &gt; https://t.co/kOPLAqZJ6W https:…",1,0,Twitter for iPhone,2016-03-20 20:00:31,711640832403574784,cruz_mechsner,Vickie Cruz Mechsner,2016-03-20 19:49:30,,5,16,"Arizona, USA",,1,0.265,0.34525,0.312347222222,positive,0.21875,0.761458333333
570,711642567775899648,"RT @SandraHartle: @realDonaldTrump well we don't, we aren't blind.   I wouldn't be surprised if some where Cruz supporters like in Chicago …",1,0,Twitter for iPad,2016-03-20 19:56:24,2418520321,PonchyEssie,Dee & Jeff Foote,2014-03-30 05:25:41,Let's Make America Great Again!!!,365,552,"Hereford,Arizona",,0,1.0,0.104166666667,0.0192307692308,negative,0.916666666667,0.296875
571,711642076035723265,"When I see Ted Cruz, I think of Tammy Fae Baker and Husband, I can not see a Preacher In the White House, Scamming the people?",0,0,Twitter Web Client,2016-03-20 19:54:27,44052773,raylunderwood,Ray L. Underwood,2009-06-02 03:54:01,"I am 56 years old and have fibromyalgia. Have had this now 19 years. I Feel I have it Under Control, Happy, Making life better Do something.",194,602,Arizona,Arizona,0,1.0,0.195192307692,0.0036858974359,positive,0.0,0.0
572,711641764516343808,A vote for Ted Cruz is a vote for Hillary Clinton GOP establishment I will absolutely NOT vote for a religious fanatic that hates gays,0,1,Twitter for Android,2016-03-20 19:53:12,4304419334,worldgoneweird,jc,2015-11-20 20:14:09,"Christian I love  America and what it really stands for..none of that let everyone in crap.  I specialize in geneology US, France and Britain",750,948,"Arizona, USA",,0,1.0,0.0288461538462,0.59375,positive,0.0,0.59375
573,711641710242230273,I liked a @YouTube video https://t.co/JNXWMfPEOY [YTP] - Trump and Cruz discover Rubio's Intercockinental Missile,0,0,Google,2016-03-20 19:53:00,706574734293491712,ProfessorNerble,Madelynne B.,2016-03-06 20:18:38,I like music and I want to be,5,8,"Arizona, USA",,0,1.0,0.4,0.0,positive,0.5,0.0
574,711641669486059520,"RT @tedcruz: New Utah poll: https://t.co/wSyGl7av77

Cruz: 53% 
Kasich 29%
Trump 11%

Help us #CruzToVictory: https://t.co/HuP4F2hUE7",1257,0,Twitter for iPad,2016-03-20 19:52:50,394392730,noprezzie2012,DernDawn,2011-10-20 00:38:20,"Political correctness is overrated. Please lead, or get out of the way. Doing my part 2 expose the MSM.
#Schoolchoice #RetireMcCain #CruzCrew #2A",6082,5564,Phoenix - Flagstaff; Arizona ,Arizona,1,0.265,0.0,0.0,positive,0.0,0.0
575,711641551223390208,"Palm Sunday w/Ted Cruz!  Awesome. @LJSelsky @tedcruz 
https://t.co/RYfFiMKb0b

#ChooseCruz #ChooseCruz #AZPrimary

https://t.co/RYfFiMKb0b",0,1,Twitter for iPad,2016-03-20 19:52:22,394392730,noprezzie2012,DernDawn,2011-10-20 00:38:20,"Political correctness is overrated. Please lead, or get out of the way. Doing my part 2 expose the MSM.
#Schoolchoice #RetireMcCain #CruzCrew #2A",6082,5564,Phoenix - Flagstaff; Arizona ,Arizona,3,0.063,0.0,0.0,positive,0.0,0.0
576,711641522496675841,"RT @MattMackowiak: Pretty good front page for Cruz
#UTCaucus 
 https://t.co/oRcD3C29uY",54,0,Twitter Web Client,2016-03-20 19:52:15,2952960674,Mysticeagle1,The American Patriot,2014-12-31 03:02:00,"- BRIAN LEE - MESA, AZ.  Super Ultra Conservative.  Followed by Dana Perino,Ted Cruz, Glenn Beck, Mark Levin & Chuck Nellis.  I Block Trumpkins",1762,832,"Phoenix, Arizona, USA",,1,0.265,0.619047619048,0.0,positive,0.619047619048,0.0
577,711641014511874048,Poll: Cruz Has 42-Point Lead Over Trump in Utah https://t.co/PM0TNUN4hF via @Newsmax_Media,0,0,Twitter Web Client,2016-03-20 19:50:14,14852411,jmeden,Jackie Eden,2008-05-21 04:42:59,"Virtual Assistant specializing in Network  Marketing and helping to connect people, businesses, and non-profits for higher profits and good causes.",2920,3447,Arizona,Central Time (US & Canada),0,1.0,0.0,0.0,positive,0.0,0.0
578,711640944177598464,Why I am Supporting Ted Cruz for President | #politics #mobile #photos | https://t.co/LHcfWhyNyP | via https://t.co/02wO2PyQUJ #AZ #UT,0,0,Twitter Web Client,2016-03-20 19:49:57,59912234,WEBmover,WEBmover,2009-07-24 22:57:25,News Site Aggregator ~ All the News - All the Time - Automated Tweet Lists - Conservative commentary - Thought Provoking articles - Blogger - more...,1128,1803,Arizona / California,Arizona,5,0.018,0.160664335664,0.0113636363636,positive,0.0,0.0
579,711640796135428096,"RT @teddyschleifer: Ted Cruz, originally scheduled to have no public events today, has added a last-minute stop in Peoria, Arizona.",24,0,Twitter for iPad,2016-03-20 19:49:22,394392730,noprezzie2012,DernDawn,2011-10-20 00:38:20,"Political correctness is overrated. Please lead, or get out of the way. Doing my part 2 expose the MSM.
#Schoolchoice #RetireMcCain #CruzCrew #2A",6082,5564,Phoenix - Flagstaff; Arizona ,Arizona,0,1.0,0.103070175439,0.115131578947,negative,0.125,0.0625
580,711640654426869761,@peaceandjoy101 Good Job.  Cruz only wins a caucus where his people pretend to be voters. That grin after every comment is so annoying.,0,0,Twitter for Android,2016-03-20 19:48:48,329144572,terrypcurtin123,Terry Curtin,2011-07-04 16:19:50,We have elections. Not selections. We are at war. No new Muslim entry. Only Trump has the stones to say the Truth!!!   I humbly ask to follow me. Semper Fi,226,333,"Arizona, USA",,0,1.0,0.213942307692,0.5625,positive,0.0625,0.125
581,711640225575874560,RT @Britinnv: #Utah A vote for Ted Cruz is a vote against the Bible 👎👎,8,0,Twitter for iPad,2016-03-20 19:47:06,2418520321,PonchyEssie,Dee & Jeff Foote,2014-03-30 05:25:41,Let's Make America Great Again!!!,365,552,"Hereford,Arizona",,1,0.265,0.0288461538462,0.0,positive,0.0,0.0
582,711640168533336064,Hannity interviews TED Cruz in Phoenix | #politics #mobile #photos #video | https://t.co/Zbz59be5BF | via https://t.co/02wO2PyQUJ #AZ #UT,2,0,Twitter Web Client,2016-03-20 19:46:52,59912234,WEBmover,WEBmover,2009-07-24 22:57:25,News Site Aggregator ~ All the News - All the Time - Automated Tweet Lists - Conservative commentary - Thought Provoking articles - Blogger - more...,1128,1803,Arizona / California,Arizona,6,0.009,0.05,0.0,positive,0.0,0.0
583,711640114884005888,"RT @mitchellvii: I don't deny Cruz has fought for us.  Unfortunately, he always gets his ass kicked. I want a POTUS who WINS when he fights…",255,0,Twitter for Android,2016-03-20 19:46:39,4304419334,worldgoneweird,jc,2015-11-20 20:14:09,"Christian I love  America and what it really stands for..none of that let everyone in crap.  I specialize in geneology US, France and Britain",750,948,"Arizona, USA",,0,1.0,0.2659657959,0.387163622197,negative,0.0,0.0
584,711640103462907904,"RT @foxnation: Poll: @SenTedCruz Takes HUGE Lead In Utah, @realDonaldTrump Dead Last https://t.co/9q0Fa92UIP #Election2016",516,0,Twitter for iPad,2016-03-20 19:46:36,394392730,noprezzie2012,DernDawn,2011-10-20 00:38:20,"Political correctness is overrated. Please lead, or get out of the way. Doing my part 2 expose the MSM.
#Schoolchoice #RetireMcCain #CruzCrew #2A",6082,5564,Phoenix - Flagstaff; Arizona ,Arizona,1,0.265,0.0222222222222,0.166666666667,positive,0.0,0.0
585,711639966254694401,Poll: Cruz Has 42-Point Lead Over Trump in Utah https://t.co/j8sr4O6Al7,0,0,Twitter for iPad,2016-03-20 19:46:04,395462175,mauriciod44,Mauricio D Mendez,2011-10-21 18:03:41,"Nationality: American: Conservative: Allegiance to one Flag: One Country, USA: One Language, English: One Culture, American: Ethnicity: Conservative Hispanic",2285,1980,Arizona,Arizona,0,1.0,0.0,0.0,positive,0.0,0.0
586,711639921459535872,"RT @Spencer57727600: @SherriWilkie @Momservative @djaznh @Scully64 @SenTedCruz @YouTube 
Look up how Cruz handled codepink protesters who t…",1,0,Twitter Web Client,2016-03-20 19:45:53,788255594,djaznh,deb-az,2012-08-29 01:28:18,"Veteran Former DNC member who wandered out of the fog.. Republican by definition, not, GOP. Support #TedCruz2016  #CruzCrew #Prolife",2124,2089,Arizona and New Hampshire,,0,1.0,0.0416666666667,0.05,positive,0.0729166666667,0.0104166666667
587,711639786310619136,"RT @CBS5AZ: LIVE: Ted Cruz is holding a ""Meet &amp; Greet"" at a Peoria church. https://t.co/6ivzAzAsZe https://t.co/sZ8qi5uDD3",3,0,Twitter Web Client,2016-03-20 19:45:21,116539435,AZs_Politics,Arizona's Politics,2010-02-22 20:49:09,Pls check our site for news/opinions/more on Arizona's politics! E-mail: info-at-ArizonasPolitics-dot-com. RT doesn't imply endorsement. Thanks!,2692,1283,Arizona,Arizona,0,1.0,0.0747566476733,0.00231481481481,positive,0.0,0.0
588,711639433116692481,"LIVE NOW: Ted Cruz is campaigning at a Peoria church, where he's holding a ""Meet &amp; Greet."" https://t.co/rK83gFesUn https://t.co/iCTM1M2apz",4,6,TweetDeck,2016-03-20 19:43:57,10025982,azfamily,AZ Family,2007-11-07 08:22:20,"Live from the newsroom of KTVK-3TV and http://t.co/xo6r5wSNdN in Phoenix, Arizona. Delivering local news, weather, sports & just interacting. Visit us online at",130058,132,"Phoenix, Arizona",Arizona,0,1.0,0.0747566476733,0.00231481481481,positive,0.0,0.0
589,711639139091927040,Cruz Flies to Romney's Defense in Spat With Trump Over Mormonism https://t.co/iMCOTmDRL6 via @Newsmax_Media,0,0,Twitter Web Client,2016-03-20 19:42:47,14852411,jmeden,Jackie Eden,2008-05-21 04:42:59,"Virtual Assistant specializing in Network  Marketing and helping to connect people, businesses, and non-profits for higher profits and good causes.",2920,3447,Arizona,Central Time (US & Canada),0,1.0,0.0,0.0,positive,0.0,0.0
590,711639096490217472,"RT @_HankRearden: Illegal voters make their way across US border ahead of #AZPrimary, eager to cast ballots for cartel pick Ted Cruz. https…",1015,0,Twitter for Android,2016-03-20 19:42:36,2263754155,rhUSMC,rh,2013-12-27 04:08:27,"God  Country  Corps 
 Semper Fi    RIGHT   NO BS",1106,932,"Arizona, USA",,1,0.265,0.670918367347,0.0351842035516,positive,0.625,0.0
591,711639031755321345,"LIVE: Ted Cruz is holding a ""Meet &amp; Greet"" at a Peoria church. https://t.co/6ivzAzAsZe https://t.co/sZ8qi5uDD3",3,1,TweetDeck,2016-03-20 19:42:21,204991039,CBS5AZ,CBS 5 News,2010-10-19 22:47:08,We give you the ANSWERS you need. The official Twitter page of @cbs5az News KPHO-TV in Phoenix.,36001,234,"Phoenix, Arizona",Arizona,0,1.0,0.0747566476733,0.00231481481481,positive,0.0,0.0
592,711638925568122880,Cruz will win CA.  YUGE number of delegates. @Conservative_VW,0,0,Twitter for iPad,2016-03-20 19:41:56,394392730,noprezzie2012,DernDawn,2011-10-20 00:38:20,"Political correctness is overrated. Please lead, or get out of the way. Doing my part 2 expose the MSM.
#Schoolchoice #RetireMcCain #CruzCrew #2A",6082,5564,Phoenix - Flagstaff; Arizona ,Arizona,0,1.0,0.15625,0.0,positive,0.0,0.0
593,711638783335137280,"RT @VioPac: .@seanhannity I think Cruz has one more chance to win big. I like him, but if he can't beat Trump he can't beat Hillary.",1,0,Twitter for Android,2016-03-20 19:41:22,18261412,cliffordbrown,Clifford Brown,2008-12-20 04:50:53,Policy-focused. Win the long war. Econ semi-libertarian. Social semi-con/semi-libertarian.,575,952,"Mesa, Arizona",Pacific Time (US & Canada),0,1.0,0.573796793405,0.0731617575153,positive,0.451785714286,0.065625
594,711638684034945028,"RT @ConstanceQueen8: THANKS 4 SHARING
TRUMP SUPPORTERS R LOW INTELLIGENCE, LOL
NEVER CRUZ😛
#AlwaysTrump 😃❤DONALD https://t.co/UM2WkMY5FI",3,0,Twitter Web Client,2016-03-20 19:40:58,3673042064,twocentsandmore,Twocentsandmore,2015-09-24 18:26:50,Child of the 50's who is disgusted with the direction our country is going. I believe in the 2nd Amendment and-want Donald Trump to Make America Great Again!,802,920,Arizona ,Arizona,1,0.265,0.0,0.0,positive,0.0,0.0
595,711638249161170944,Poll: Cruz Has 42-Point Lead Over Trump in Utah https://t.co/liPQy8fsIb #Newsmax via @Newsmax_Media,0,0,Twitter for Android,2016-03-20 19:39:14,610247272,swwithkids,Scott-haz Wilson,2012-06-16 20:08:05,"Tlááshchí'í • Tó dichíini • Tóbąąhí • Tłízíłání • Tonalea, AZ 
• Zurvita Independent Consultant • Zeal For Life",284,728,"Phoenix, Arizona",,1,0.265,0.0,0.0,positive,0.0,0.0
596,711637958151897088,"Other family members endorse Ted Cruz.  Sad there is competition from Trumpers over death. @BlissTabitha 

https://t.co/2ikrG6nW8Q",0,1,Twitter for iPad,2016-03-20 19:38:05,394392730,noprezzie2012,DernDawn,2011-10-20 00:38:20,"Political correctness is overrated. Please lead, or get out of the way. Doing my part 2 expose the MSM.
#Schoolchoice #RetireMcCain #CruzCrew #2A",6083,5564,Phoenix - Flagstaff; Arizona ,Arizona,0,1.0,0.0288461538462,0.3125,positive,0.375,0.0
597,711637630643937281,@Freedomfromu @HomunculusLoikm @Average_Ed A contract between governed and government. Cruz believes in it. That's why he has my vote.,0,0,Twitter for iPad,2016-03-20 19:36:47,4729258724,Michael_Priebe_,Michael Priebe,2016-01-08 16:55:22,"Christian. Husband, dad, grandpa. #USAF vet. #Conservative. #Steelers. H-D rider. #PGR member. Retired Security Professional. Ask B4 add 2 lists or I block you.",340,349,Arizona,Arizona,0,1.0,0.228618421053,0.0263157894737,negative,0.0,0.0
598,711637609164840960,RT @JoanOfArgghh: Glenn Beck is soon going to become the reason I can't vote for Cruz.,9,0,Twitter Web Client,2016-03-20 19:36:42,3066923126,hinkyaz,hinkyaz (Steve H.),2015-03-07 16:55:26,Trucker/former biz owner. Truck owner @ USAF Veteran Steve Hinkle,629,345,"Tucson, Arizona",,0,1.0,0.0962072649573,0.00138888888889,positive,0.0,0.5
599,711637348560154624,"RT @PatrickSvitek: From yesterday: @TedCruz, on brink of two-man race he desperately wants, signals growing frustration w/ @JohnKasich http…",32,0,Twitter for iPad,2016-03-20 19:35:40,394392730,noprezzie2012,DernDawn,2011-10-20 00:38:20,"Political correctness is overrated. Please lead, or get out of the way. Doing my part 2 expose the MSM.
#Schoolchoice #RetireMcCain #CruzCrew #2A",6083,5564,Phoenix - Flagstaff; Arizona ,Arizona,0,1.0,0.0375,0.075,negative,0.0,0.0
600,711636746836975616,RT @hughhewitt: Hard to see @realDonaldTrump getting to 1.237: https://t.co/L9fr2fEpBK. Much harder if @tedcruz wins UT. Impossible if Cruz…,32,0,UberSocial Professional,2016-03-20 19:33:16,239903519,Dannerism,Dannerism,2011-01-18 18:07:58,"Comedian, Mathematician, Juggler, Conservatarian,Teacher, Observer, Patriot and Performer of Antics and Semantics",2024,2204,Mesa Arizona,,0,1.0,0.249305555556,0.356944444444,negative,0.0,0.0
601,711636628385607680,"RT @hughhewitt: Look @ted cruz is going to win UT and @realDonaldTrump likely to win AZ. If either doesn't, major pratfall for them. https:…",9,0,UberSocial Professional,2016-03-20 19:32:48,239903519,Dannerism,Dannerism,2011-01-18 18:07:58,"Comedian, Mathematician, Juggler, Conservatarian,Teacher, Observer, Patriot and Performer of Antics and Semantics",2024,2204,Mesa Arizona,,0,1.0,0.451014957265,0.0753071581197,negative,0.203125,0.6953125
602,711636600875130880,@Biracial_Chick I agree. #Trump does a great imitation of Cruz. He's hilarious!,0,0,Twitter for iPhone,2016-03-20 19:32:41,1534688612,arizonaonmymind,Kim & Earl,2013-06-20 18:50:17,"The early bird catches the worm, but the second mouse gets the cheese! If you dont like this country, GET OUT! Keeping it real 24/7. #MakeAmericaGreatAgain",3098,2894,"Arizona, USA",,1,0.265,0.585164835165,0.519230769231,positive,0.3125,0.875
603,711636500312498176,"RT @ByronTau: Cruz makes a hastily arranged stop at Fresh Start Church in Peoria, Arizona in a return to retail politics. https://t.co/CNhk…",85,0,Twitter for iPhone,2016-03-20 19:32:17,2642847487,lorihack_az,Lori Hack,2014-07-14 03:58:40,"Wife, Mom and Homemaker ... above all, true Believer in Christ ... and I eagerly await His return someday soon.",1094,831,      Arizona Native,,0,1.0,0.135204081633,0.00109329446064,positive,0.0,0.0833333333333
604,711636460105928704,RT @Biracial_Chick: Thankfully they won't be deciding our next POTUS. But voting for Cruz will be a mistake. He's a creepy charlatan. https…,1,0,Twitter for iPhone,2016-03-20 19:32:08,1534688612,arizonaonmymind,Kim & Earl,2013-06-20 18:50:17,"The early bird catches the worm, but the second mouse gets the cheese! If you dont like this country, GET OUT! Keeping it real 24/7. #MakeAmericaGreatAgain",3098,2894,"Arizona, USA",,0,1.0,0.0826923076923,0.729166666667,positive,0.375,0.729166666667
605,711636240173387780,"RT @mitchellvii: It's unfortunate that Utah falls on next Tuesday, allowing Cruz to pretend to have life. In a perfect world, Tuesday would…",168,0,Twitter Web Client,2016-03-20 19:31:15,3066923126,hinkyaz,hinkyaz (Steve H.),2015-03-07 16:55:26,Trucker/former biz owner. Truck owner @ USAF Veteran Steve Hinkle,629,345,"Tucson, Arizona",,0,1.0,0.721587171053,1.08163349781,negative,0.666666666667,1.088
606,711635730351534081,"RT @JasonMillerinDC: Cruz adds Sunday AZ stop: 

12:00 p.m. - Peoria, AZ 
Meet and Greet with Ted Cruz
Fresh Start Church
14185 N 83rd Aven…",12,0,Twitter for iPad,2016-03-20 19:29:14,394392730,noprezzie2012,DernDawn,2011-10-20 00:38:20,"Political correctness is overrated. Please lead, or get out of the way. Doing my part 2 expose the MSM.
#Schoolchoice #RetireMcCain #CruzCrew #2A",6083,5564,Phoenix - Flagstaff; Arizona ,Arizona,0,1.0,0.0833333333333,0.0,positive,0.0,0.0
607,711635411487985664,RT @KLSouth: The percentage of those who did not vote for Ted #Cruz so far: https://t.co/pFJqKc8Fnk via @SandraHartle,116,0,Twitter Web Client,2016-03-20 19:27:58,1902827713,patechinois1,patechinois,2013-09-25 04:16:14,"Meat&Potatoes, w/a little corn thrown in. Do try to ketch up.
Left/Islam joined to destroy ability to ask question WHY?, a distinguising virtue of Western Civ",406,280,"Arizona, Montréal",,1,0.265,0.0298076923077,0.0192307692308,positive,0.0,0.0
608,711635131778228224,RT @amperg33: @michaeljohns @arizonaonmymind Cruz is the biggest fraud perpetrated on the American ppl! Hands down 😡,1,0,Twitter for iPhone,2016-03-20 19:26:51,1534688612,arizonaonmymind,Kim & Earl,2013-06-20 18:50:17,"The early bird catches the worm, but the second mouse gets the cheese! If you dont like this country, GET OUT! Keeping it real 24/7. #MakeAmericaGreatAgain",3098,2894,"Arizona, USA",,0,1.0,0.0288461538462,0.0,positive,0.0111111111111,0.2
609,711635093144514560,Cruz announces Sunday meet-and-greet in AZ https://t.co/xS3yxI6oza #phoenix https://t.co/6rOfjLO8WU,0,0,dlvr.it,2016-03-20 19:26:42,79312869,phxnews,Phoenix News,2009-10-02 23:10:59,Phoenix News • 400 East Van Buren Street • #Phoenix • #Arizona • 85004 • #PHX • @visitphoenix • @ASU • @Suns • @Dbacks • @ArizonaCoyotes • @AZCardinals •,2696,323,"Phoenix, Arizona",Pacific Time (US & Canada),1,0.265,0.0,0.0,positive,0.0,0.0
610,711634760536162305,"RT @oldhickory49: @Pudingtane @KLSouth ""Caution"" is an understatement. There's no way Cruz can get elected.",13,0,Twitter for iPhone,2016-03-20 19:25:23,1534688612,arizonaonmymind,Kim & Earl,2013-06-20 18:50:17,"The early bird catches the worm, but the second mouse gets the cheese! If you dont like this country, GET OUT! Keeping it real 24/7. #MakeAmericaGreatAgain",3098,2894,"Arizona, USA",,0,1.0,0.0462072649573,0.0121527777778,positive,0.0,0.0
611,711634707314659328,RT @Ricky_Vaughn99: Total nutjob Glenn Beck ensures that his acolyte Ted Cruz will lose a general election badly. https://t.co/lchXRBT7db,285,0,Twitter for iPad,2016-03-20 19:25:10,3673042064,twocentsandmore,Twocentsandmore,2015-09-24 18:26:50,Child of the 50's who is disgusted with the direction our country is going. I believe in the 2nd Amendment and-want Donald Trump to Make America Great Again!,802,920,Arizona ,Arizona,0,1.0,0.0,0.248106060606,positive,0.0,0.0208333333333
612,711634541547380736,RT @abc15: JUST IN: Ted Cruz announces meet and greet event at Fresh Start Church in Peoria at 12:00 pm today. #abc15 https://t.co/EG8fDbuv…,10,0,Twitter for iPad,2016-03-20 19:24:30,394392730,noprezzie2012,DernDawn,2011-10-20 00:38:20,"Political correctness is overrated. Please lead, or get out of the way. Doing my part 2 expose the MSM.
#Schoolchoice #RetireMcCain #CruzCrew #2A",6083,5564,Phoenix - Flagstaff; Arizona ,Arizona,1,0.265,0.0625,0.0104166666667,positive,0.625,0.0
613,711634234285252608,RT @JustDonPerla: Voting for Ted Cruz is the same as voting for Hillary Clinton. He can not beat her. Only Donald Trump can. https://t.co/J…,5,0,Twitter for Android,2016-03-20 19:23:17,3034992840,cochran_bob,Bob Cochran,2015-02-21 17:35:06,"Retired married 50 years, 2A all of constitution, USCCA, should be no political parties just Americans. All lives matter, responsible licensed CCW.",463,556,"Concho, Arizona",,0,1.0,0.156563545151,0.0889945652174,positive,0.0625,0.078125
614,711634222402945024,Why Every American Should Vote for Ted Cruz https://t.co/gUUUYD09al,0,0,Linkis.com,2016-03-20 19:23:14,34089599,katscolor,Kathy Tucker,2009-04-21 23:29:27,"https://t.co/tE4T22bnpt.Freedom.Conservative .Pro gun. My family. Mother,Grandmother",828,1402,"Mesa,Arizona",Arizona,0,1.0,0.0,0.0,positive,0.0,0.0
615,711634052571201536,RT @12News: NEW: Ted Cruz event at Fresh Start Church in Peoria at noon; Bernie Sanders rally at Fort Tuthill County Park in Flagstaff 8 p.…,4,0,Twitter for iPhone,2016-03-20 19:22:34,2546408312,AZAustin43,Austin Smith,2014-06-04 15:57:39,Grand Canyon University. Pre-Law. Outdoorsman. Contributor at @OUTSETMagazine. Please clap.,1161,358,The Arizona Territory ,Pacific Time (US & Canada),0,1.0,0.0,0.0,positive,0.0,0.0
616,711634035894652928,"RT @FOX10Phoenix: Ted Cruz is expected to appear at Fresh Start Church in Peoria this afternoon, running about 15 minutes late.",4,0,Twitter for iPad,2016-03-20 19:22:30,394392730,noprezzie2012,DernDawn,2011-10-20 00:38:20,"Political correctness is overrated. Please lead, or get out of the way. Doing my part 2 expose the MSM.
#Schoolchoice #RetireMcCain #CruzCrew #2A",6083,5564,Phoenix - Flagstaff; Arizona ,Arizona,0,1.0,0.0887571100986,0.053910181959,positive,0.0416666666667,0.125
617,711633933989904384,RT @NathanZed: looks like something ted cruz would tweet...hm https://t.co/J0t1t8eJyS,371,0,Twitter for iPhone,2016-03-20 19:22:06,947299639,Gonzinho9,PVA Soldado Marco,2012-11-14 07:58:17,"Marco Medina. #LiverpoolFC supporter, #PVAPHX Pizza Eater, #PanchoVillasArmy , Scouse translator. Question about PVA? Email me at Marco@PanchoVillasArmy.com",427,584,"Maricopa, Arizona.",,0,1.0,0.0,0.0,positive,0.1875,0.015625
618,711633760463106048,RT @veganvecoh: Mary Ann Mendoza says Ted Cruz is “Not somebody I can trust” - She Endorses Donald Trump. 👉 https://t.co/7KWycz2wzE https:/…,345,0,Twitter Web Client,2016-03-20 19:21:24,76133672,AZLovesTrump,AZ4Trump,2009-09-21 20:29:26,MAKE AMERICA GREAT AGAIN!! NO VETERAN LEFT BEHIND!!! SUPPORT OUR TROOPS!! ARM OUR TROOPS TO DEFEND OUR COUNTRY AND THEIR MILITARY BASES!!!! SUPPORT OUR POLICE!!,315,616,"Paradise Valley, Arizona",Pacific Time (US & Canada),0,1.0,0.29020979021,0.0,positive,0.0,0.0
619,711633463938387968,"RT @michaeljohns: I notice #Cruz no longer says ""conservatives are uniting"" behind his candidacy (which was and is untrue). 

Now it's ""Rep…",53,0,Twitter for iPhone,2016-03-20 19:20:13,1534688612,arizonaonmymind,Kim & Earl,2013-06-20 18:50:17,"The early bird catches the worm, but the second mouse gets the cheese! If you dont like this country, GET OUT! Keeping it real 24/7. #MakeAmericaGreatAgain",3098,2894,"Arizona, USA",,1,0.265,0.0979020979021,0.614583333333,positive,0.0,0.0
620,711633442622930944,"RT @VaughnHillyard: Mike Lee on Cruz: It's often in DC ""where he's my only friend in the room...""",45,0,Twitter Web Client,2016-03-20 19:20:08,2952960674,Mysticeagle1,The American Patriot,2014-12-31 03:02:00,"- BRIAN LEE - MESA, AZ.  Super Ultra Conservative.  Followed by Dana Perino,Ted Cruz, Glenn Beck, Mark Levin & Chuck Nellis.  I Block Trumpkins",1762,832,"Phoenix, Arizona, USA",,0,1.0,0.0,0.0,positive,0.0,0.0
621,711633370195689472,RT @12News: NEW: Ted Cruz event at Fresh Start Church in Peoria at noon; Bernie Sanders rally at Fort Tuthill County Park in Flagstaff 8 p.…,4,0,Twitter for iPad,2016-03-20 19:19:51,394392730,noprezzie2012,DernDawn,2011-10-20 00:38:20,"Political correctness is overrated. Please lead, or get out of the way. Doing my part 2 expose the MSM.
#Schoolchoice #RetireMcCain #CruzCrew #2A",6084,5564,Phoenix - Flagstaff; Arizona ,Arizona,0,1.0,0.0,0.0,positive,0.0,0.0
